Street,Address,rent_cold,additional_cost,free_from,distance,gadgets,female_roommates,male_roommates,divers_roommates,room_description,location_description,flat_live,additional,smoker,accessible,kind_of_flat,Url,type,district,size,price,link
Eisenbahnstr. 120,04315 Leipzig Volkmarsdorf,240,100,01.08.2023,5,"Waschmaschine,Balkon,Gartenmitbenutzung,Keller",0,2,0.0," Translation in English: see below!  Unsere 3-Zimmer-Wohnunge bietet mit zwei großen (18-19qm) und einem kleineren (ca. 12qm) Zimmer sowie einer vergrößerten HELLEN KÜCHE mit riesigem BALKON nach Süden und Blick ins Grüne ein ideales Zuhause für eine WG. Das Zimmer kann auf Wunsch möbliert oder unmöbliert übergeben werden. Außerdem gibt es einen kleinen Abstell-/Vorratsraum anliegend an der Küche, Badezimmer mit WANNE, einen gemeinschaftlich genutzten großen SÜD-GARTEN, einen Keller und natürlich INTERNET.  Das Zimmer sit ab 01.08. zu mieten - aufgrund von Renovierungsarbeiten aber evt. erst zum 15.08.2023.   Hier in der WG leben zur Zeit Friedmann (m, 37J), der mit dem Abschluss eines Filmprojektes beschäftigt ist und zum Ausgleich viel Sport macht.  und Moh (m, 39): ""Ich heiße Mohanad Nomaer, bin 38 Jahre alt. Ich komme aus Syrien dort habe ich Wirtschaft studiert und Buchladen gehabt bin seit 6 Jahren in Deutschland und in Erfurt seit 5,5 Jahren als Barista in ein Café gearbeitet.  Ich bin in meiner Freizeit sehr gerne in der Natur. Wandern, Klettern, fahrrad fahren, Picknicken und viele weitere sind mir nicht fremd.  Selbstverständlich brauche ich auch Raum und Zeit für mich, meine Arbeit und Gedanken.   Und gleichermaßen brauche ich ein schönes Miteinander für die Freizeitgestaltung und zum Wohlfühlen.  Liebe Grüße""  Wir, die Vermieter, sind eine kleine Genossenschaft, die dieses Haus, sowie eine Ranch in Coswig und eine Hütte in Österreich verwaltet. Wir bestehen aus derzeit sieben Mitgliedern – und realisieren als eG zum einen Wohnprojekte und zum anderen künstlerische, wirtschaftliche und soziale Projekte. Die Genossenschaft stellt ein idealistisches Forum dar und möchte mit ihren Aktivitäten einen Beitrag zur Förderung des sozialen, kulturellen und wirtschaftlichen Lebens leisten. Aktuell beschäftigen wir uns mit den akuten Problemen der Erde wie Global Warming, Überbevölkerung, Flut, Wirtschaft, Politik etc. und deren Lösungen. Dazu gehören z.B. Spirit und Inspiration interkulturell als bindende und ausgleichende Kraft unter allen Nationen, autarkes Wohnen etc.  Jeder ist eingeladen, aber keiner ist verpflichtet an der Genossenschaft oder ihren Projekten teilzuhaben. Jedoch wünschen wir uns, dass die Mieter Bescheid wissen, was wir planen und damit ok sind, so dass es in der Wohnung eine gute Atmosphäre gibt.  Da wir unten in den Läden vegetarisch-drogenfreie Projekte wünschen und selbst davon überzeugt sind, freuen wir uns über Mieter, die auch begeistert davon sind, INNERHALB des Hauses, der Balkone und des Gartens VEGETARISCH (ohne Fleisch, Fisch, Ei und Gelatine) sowie Alkohol-, Rauch- und Drogenfrei (auch kein Koffein und Teein) zu wohnen und leben. Für uns hat das mit Gewaltfreiheit zu tun. ABER in erster Linie geht es uns nicht um „Regeln“, sondern dass sich die Mieter nicht gegenseitig stören. Also z.B. jemandem, dem es wichtig ist, in einer rein veganen Wohnung zu leben, dem wollen wir das ermöglichen und suchen dann Mitbewohner, die das auch so wünschen und respektieren. Und wenn sich die Bewohner in einer anderen WG aber über andere Absprachen einig sind, ist das auch ok. Rauchen ist allerdings in den Räumen aufgrund von Denkmalschutz nirgends erlaubt. Und zuletzt: was der einzelne außerhalb des Hauses und Gartens konsumiert, ist sowieso jedem selbst überlassen – d.h. wir wollen niemanden ausschließen: z.B. auch ein Raucher oder Nicht-Vegetarier kann einziehen, wenn er eben damit einverstanden ist, außerhalb zu rauchen und Fleisch zu konsumieren oder er/sie spricht sich eben mit seinen Mitbewohnern ab wie oben beschrieben.  Um das Leben im WG-Hause gemeinschaftlicher, gleichberechtigter, offener und freundlicher zu gestalten, vermieten wir die Zimmer einzeln, sprich jeder Bewohner hat seinen eigenen Mietvertrag. Küchen, Bäder und Flure werden mit dem gesamten Haus geteilt und auch die Küchen könnten potentiell nach gemeinsamer Absprache als Schlafplatz vergeben werden. Natürlich muss das Teilen Sinn machen und jeder muss immer wissen, wer warum bei wem einen Schlüssel haben darf und in die Wohnung kommt. Das Zimmer-weise Vermieten ist für die Mieter flexibler (z.B. kürzere Kündigungsfrist) und bringt weniger Haftung mit sich (jeder haftet nur für sein Zimmer und nicht für die gesamte Wohnung).  Alle MieterInnen sind eingeladen – soweit sie möchten – das Haus, die Läden und die „Regeln“ mit zu gestalten und zu beeinflussen. Unser Ziel ist es, bei Konflikten gemeinsam Lösungen zu schaffen. Wir möchten im Haus mit seinen zehn Wohnungen und zwei Ladenflächen eine inspirierende Wohn-, Arbeits- und Lebensatmosphäre schaffen.   Das Haus ist ENERGIE-EFFIZIENT saniert (Zentralheizung, Dämmung, Solaranlage etc.), und wir erhalten den ALTBAU-CHARAKTER, indem wir die noch vorhandenen Holz-Türen und DIELEN-BÖDEN heraus geschält haben. Auch die alten Decken- und Wand-BEMALUNGEN wurden wenn möglich erhalten – wir perfektionieren sie nicht, sondern sie erzählen „ihre Geschichte“ und stoßen teilweise auf im Laufe der Jahre erneuerte Flächen und bilden so manchmal ein radikales Design.   Room in vegan/vegetarian oriented communal house, refurbished old building, original wooden floors  Our three-bedroom apartment consists of two large (18 square metres), one small bedroom (12 square metres) and a BRIGHT KITCHEN with a large BALCONY facing the garden (South). The room can be furnished or unfurnished – as you like. You will find a storage room adjecent to the kitchen, a bathroom with tub, a huge communal GARDEN facing South, a cellar and WIFI.  The room ist for rent from 1st Aug - due to refurbishments maybe from 15th of Aug.  We, the main tenants, are a small founded collective and manage this property and a ranch in Coswig (Anhalt) as well as a cottage in Austria. Our collective is an idealistic forum that realizes projects of social or cultural nature. Currently, we are dealingwith urgent problems on earth like global warming, overpopulation, floods, economy, politics etc. as well as possible solutions such as inter-cultural spirit and inspiration as a connecting and balancing force between nations, autarkic living etc.  Everyone is invited but no one is obligated to become part of the collective or its projects. But we wish to find tenants who are aware of our projects and who are ok with them.  Since we are having vegetarian-drug free projects in our shops on the ground floor and since we are ourselves convinced by this life style, we are looking for tenants that also prefer to lead a vegetarian (no meat, fish and eggs) and drug-free (no alcohol, smoking, drugs and caffeine) life inside the house, on the balconies and in the garden. For us it is based on violent-free principles. BUT more important than setting up rules, are the people and that no one is annoyed by anyone else. For example if a person moves in that wishes to live in a strictly vegan flat, we wish to accomplish that by finding flat mates who also want and respect that. And if flat mates from another flat are agreeing on completely different terms and exceptions, that is ok, too. Only smoking cannot be done inside since the house is under monument protection. And lastly: each tenant consumes outside the house and garden as he/she pleases, meaning we do not wish to exclude anyone: e.g. also a smoker or non-vegetarian is welcome to move in if he/she agrees to smoke/eat meat outside of the premises only or to agree differently with his/her flat mates (see above).  In order to make life in our WG-house more communal, equal, open and friendly, we only rent out rooms meaning each tenant has his/her own agreement for one room. Kitchens, bathrooms and hallways are shared with the whole house and kitchens may potentially - if agreed on - be used as a place to sleep. Sharing among the whole house must make sense of course and each tenant must always know who has a key and who is sharing. Renting out rooms (insteady of flats) is more flexible for the tenants (shorter notice period for example) and means less liability (the tenant is only liable for the rent of his/her room instead of the whole flat).  All tenants are invited – if interested – to shape and influence the house, the shops and its „rules“ together with us. Our goal is to find solutions for conflicts if such arise. We wish to create an inspiring atmosphere inside the house with its 10 flats and 2 shops.  Our concept was to optimize the ENERGY LEVEL (central heating, insulation, solar collectors etc.) and to preserve the beauty of the old building, e.g. we refurbished the ORIGINAL WOODEN DOORS and FLOORS as well as original PAINTINGS on the ceiling where still existing."," Die Eisenbahnstraße gehört zum Stadtteil Volkmarsdorf, der gerade sehr im Kommen ist. Der Multi-Kulti-Charakter mit Bewohnern unterschiedlicher Nationen und Gesellschafts-Schichten, engagierten Studenten, Familien und diversen Initiativen und Vereinen sowie der Tatsache, dass die Mieten noch erschwinglich sind, machen die Gegend zur SZENE.  Unser Haus liegt nur 3 km östlich vom Stadtzentrum mit sehr guter Anbindung an das öffentliche Verkehrsnetz - in wenigen Minuten ist man per Straßenbahn (4 Stationen), Auto oder Fahrrad in der City. Zahlreiche Einkaufsmöglichkeiten (u.a. Netto, Aldi, Kaufland sowie diverse Fachhändler), gastronomische Einrichtungen und Ärzte befinden sich in der Nähe.   Eisenbahnstraße belongs to the district of Volkmarsdorf which is very POPULAR at the moment. People from different nations and social backgrounds come together as well as students, families, various initiatives and NGO’s – it is the place to be.  Our house is just 3 km East of the CITY CENTRE: 4 stops by tram or less than 10 minutes by bike. Shopping and food facilities as well as other shops and doctors are in walking distance.",," Im Preis ist ALLES inklusive außer GEZ: Miete, Nebenkosten-Abschlag, Strom, Gas, Wasser und Internet! Der Abschlag ist im Moment aufgrund der gestiegenen Kosten sehr hoch - aber ihr zahlt natürlich nur den tatsächlichen Verbrauch und vielleicht gibt es ja sogar eine Rückzahlung. Für Putzmittel und Toilettenpapier gibt jeder noch 5 Euro in die Haushaltskasse oder was immer ihr in der WG vereinbart. Die Kündigungsfrist beträgt zwei Monate zum Ende des Monats.  Haustiere sind prinzipiell nicht erlaubt.  Es wäre toll, wenn ihr über wg-gesucht also per Email auf die Anzeige antworten könntet mit einer Vorstellung über euch, was ihr macht, was ihr zu unserer Anzeige denkt und wie lange ihr bleiben möchtet. Und deine Handynummer wäre praktisch - meine steht in der Anzeige.  Wir freuen uns, dich kennen zu lernen!  The price includes EVERYTHING besides GEZ: rent, additional charges (monthly installments), electricity, gas, water and internet! And each flat member chips in 5 Euro for cleaning utensils and toilet paper etc. or whatever you guys decide within the flat share. The notice period is two months until the end of the month.  Pets are generally not allowed.  It would be great if you could reply to this ad via wg-gesucht (via email) with a little presentation about yourself, how long you are planning to stay and whether you are ok with our „terms“. And your mobile phone number would be handy - mine is in the ad.  We are looking forward to meeting you!",0.0,0,"Studenten-WG, gemischte WG, Vegetarisch/Vegan",https://www.wg-gesucht.de/wg-zimmer-in-Leipzig-Volkmarsdorf.6814908.html,3er WG,Volkmarsdorf,    12,340 ,https://www.wg-gesucht.de/wg-zimmer-in-Leipzig-Volkmarsdorf.6814908.html
Hermelinplatz 4,04329 Leipzig Paunsdorf,230,150,05.07.2023,1,Balkon,,,," Servus! Da ich ab Juli für einen gewissen Zeitraum nicht auf Weltreise sein werde, möchte ich meine Wohnung an jemanden untervermieten.38 Quadratmeter, Balkon und Küche, welcheallerdings noch angeschlossen werden muss.ÖPNV, Apotheke, Supermarkt ist alles innerhalb von 2 Minuten Fußweg zu erreichen.Bei Interesse gern anschreiben :)",,,,,0,,https://www.wg-gesucht.de/1-zimmer-wohnungen-in-Leipzig-Paunsdorf.10197447.html,1-Zimmer-Wohnung  ,Paunsdorf,    38,380 ,https://www.wg-gesucht.de/1-zimmer-wohnungen-in-Leipzig-Paunsdorf.10197447.html
Biedermannstraße 9-13,04277 Leipzig Connewitz,250,100,01.07.2023,2,"Waschmaschine,Spülmaschine,Aufzug",1,1,0.0," Es gibt zwei Zimmer zu vergeben. Das eine Zimmer ist etwa 16qm gross das zweite etwas grösser, etwa 18 qm. Beide Zimmer sind hell und ruhig.   --------------------------------------------  There are two rooms available.  One room is about 16 square meters, the second is slightly larger, about 18 square meters.  Both rooms are bright and quiet."," (English below)  Die Wohnung liegt direkt am Connewitzer Kreuz. Hier befinden sich viele Geschäfte, Restaurants, Veranstaltungsorte und Bars in der Nähe. Von der Wohnung ist man auch in ein paar Minuten im Wald und am Fluss, oder mit dem Rad am See. Die nächsten Straßenbahnhaltestellen sind ganz in der Nähe.  --------------------------------------------------------------------------  The apartment is right on the Connewitzer Kreuz.  There are many shops, restaurants, entertainment venues and bars nearby.  From the apartment you can be in the forest and on the river in a few minutes, or by bike on the lake.  The nearest tram stops are very close by.","(English below)  Hallo :)  Wir sind Clemens und Lola und wir wohnen seit kurzem in dieser wunderschöne Wohnung in Connewitz. Wir suchen jetzt noch nach zwei weitere Personen, die hier mit uns einziehen möchten und Lust auf Gemeinschaft haben, das heißt gemeinsam kochen, abends ausgehen, auf Ausflüge gehen, Spiele spielen, Filme schauen etc. Schreibt einfach ein bisschen über euch, was ihr so macht, was ihr gerne in Leipzig macht etc. Kurz noch zu uns:  Lola kümmert sich gerne um Pflanzen, sie hat sich in unserer letzten WG viel um den Balkon und den Garten gekümmert. Sie hat wechselnde Hobbies und fühlt sich v.a. im Element Wasser zuhause und wird im Sommer viel an den Seen Leipzigs sein. Sie kommt ursprünglich aus Albanien und arbeitet als Ärztin in der Kinder und Jugendpsychatrie.  Clemens war bis vergangenen Jahres in der Krebsforschung aktiv. Dieses Jahr nimmt er sich ein Jahr freiund macht viel Musik. Er geht auf Jam sessions und macht elektronische Musik und Videos.(@schuh_mischlingshund). Er geht gerne im Park spazieren und ließt dann ein gutes Buch. Donnerstags geht er zum Acroyoga und ab und zu zum Squash oder Badminton . Wir haben schon früher oft in grossen Wohngemeinschaften zusammengelebt und würden das auch gerne fortsetzen :) Es ist eine Neubauwohnung im vierten Stock (Das Gebäude hat aber einen Aufzug, Glück gehabt ;) ). Die Zimmer sind ausreichend groß und es gibt eine große Küche und ein riesiges, helles Wohnzimmer (über 30 qm). Also haut in die Tasten und schickt uns eine Nachricht, wir freuen uns über alle Anfragen :)  ---------------------------------------------------------------------------  Hello :) We are Clemens and Lola and we have been living in this beautiful apartment in Connewitz for a short time.We are now looking for two more people who would like to move in with us and would like to socialize, i.e. cook together, go out in the evenings, go on excursions, play games, watch films etc. Just write a little bit about yourself, what you thinkdo what you like to do in Leipzig etc. Briefly about us: Lola likes to take care of plants, she took care of the balcony and the garden a lot in our last flat share.She has changing hobbies and feels particularly at home in the element of water and will spend a lot of time at the lakes in Leipzig in the summer.She is originally from Albania and works as a doctor in child and adolescent psychiatry. Clemens was active in cancer research until last year.This year he's taking a year off and doing a lot of music.He goes to jam sessions and makes electronic music and videos.(@schuh_mischlingshund).He...",,,1,"keine Zweck-WG, gemischte WG, WG-Neugründung",https://www.wg-gesucht.de/wg-zimmer-in-Leipzig-Connewitz.9385291.html,4er WG,Connewitz,    16,365 ,https://www.wg-gesucht.de/wg-zimmer-in-Leipzig-Connewitz.9385291.html
Schirmerstraße 21,04318 Leipzig Anger-Crottendorf,350,0,01.09.2023,2,"Waschmaschine,Spülmaschine,Balkon,Keller",2,1,0.0," Hallo ihr Lieben! Da ich für ein Semester nach Schweden gehe, suche ich eine Person, der ich meine geliebte WG anvertrauen kann. Unsere Wohnung ist das geräumige Ergebnis der Verbindung zweier Dreiraumwohnungen, sodass wir neben zwei Küchen und zwei Bädern auch einen Gemeinschaftsraum und ein Gästezimmer haben. Mein Zimmer ist 18qm groß und trotz seiner Nordseitenausrichtung sehr hell, da die gegenüberliegende Häuserfront das Licht reflektiert. Ich vermiete es möbliert."," Unsere Wohnung liegt im schönen Südosten Leipzigs am oberen Ende des Lene-Vogt-Parkts, quasi dem Puls von Reudnitz. Das heißt, dass du fast alles vor der Tür hast, was du dir wünschen könntest: mindestens 3 verschiedene Cafés, mehrere Spätis und diverse Einlaufmöglichkeiten liegebn in einem 10 min Radius zu Fuß um die Wohnung. Bus- und Bahnl erreichst du innerhalb von 3 min oder bist mit dem Fahhrad in 10 min im Stadtzentrum oder am Medizincampus. Wendest du dich nach Osten, kannst du auch den ruhigen Stünzer Park für Spaziergänge oder zum Joggen nutzen.","Für die Dauer meiner Abwesenheit vertraue ich dir meine Mitbewohner an. Das sind Luise, 22, studiert Jura und befindet sich gerade in ihrem Vorbereitungsjahr fürs Staatsexamen. Sie interessiert sich für Politik und Literatur und ist daher eine sehr spannende Gesprächspartnerin. Wenn sie nicht im Repetetorium sitzt, ist sie oft mit ihren Freunden unterwegs, geht joggen oder liest. Luises Zimmer grenzt direkt an deines, sodass ihr euch auch Küche und Bad teilt.  Lisa, 24, studiertMusik und Sonderpädagogik. Sie hat eigentlich fast immer mindestens ein Chorprojekt am Laufen und Univeranstaltungen zu unmöglichen Zeiten. Aber sie ist auch gern zuhause und kocht für sich und uns oder umsorgt ihre vielen Pflanzen. Sie ist ein super Ansprechpartner für die neusten Trash-TV Begebenheiten und kann dir immer eine Styleberatung geben. Als letzter ist Tim im März 22 hier eingezogen. Er ist 27 und studiert Informatik im Master. Wenn du kommst, ist er gerade erst ein paar Wochen aus seinem Erasmussemester in Mailand wieder da. Tim träumt von der großen Darts-Karriere und kann dir alles, was du dir vorstellen kannst, auf seinem 3D-Drucker drucken. Er liebt es zu wandern und reißt gern flache Witze. Mit ihm kannst du auch die Technoclubs der Stadt unsicher machen. Auch wenn das Layout der WG viel Raum dafür ließe sich aus dem Weg zu gehen, sind wir alles andere als eine Zweck-WG. Ob auf ein schnelles Frühstück vor der Uni oder ein gemeinsames Abendbrot, einen Serienabend oder eine spontane Gitarrensession auf dem Balkon: Wir verbringen gern Zeit miteinander und suchen deshalb nach einer Person, die nicht nur eine Zweck-WG möchte. Natürlich haben wir aber auch alle viel zu tun und achten auf unser gegenseitiges Ruhebedürfnis."," Im angegebenen Preis sind alle Nebenkosten enthalten. Wenn du möchtest, könntest du mein Fahrrad benutzen. Wenn ihr Interesse habt, schreibt mir gern eine Nachricht und stellt euch kurz vor.",1.0,0,"Studenten-WG, keine Zweck-WG",https://www.wg-gesucht.de/wg-zimmer-in-Leipzig-Anger-Crottendorf.10155148.html,4er WG,Anger-Crottendorf,    18,350 ,https://www.wg-gesucht.de/wg-zimmer-in-Leipzig-Anger-Crottendorf.10155148.html
Richard Lehmann Str,04275 Leipzig Südvorstadt,251,104,15.08.2023,1,"Waschmaschine,Spülmaschine,Balkon",2,1,0.0," Dein Zimmer ist ca. 18 m2 groß, befindet sich gegenüber von der Küche. Da wir in einem Altbau wohnen, sind die Decken dementsprechend hoch und die Fenster groß. Das Zimmer befindet sich auf Seite zur Straße, weshalb du sehr viel Sonne abbekommst. Aber dadurch, dass wir im Erdgeschoss wohnen, ist es im Sommer im angenehm kalt.  In der WG befinden sich zwei Toiletten, ein großes helles Bad mit Dusche und Badewanne. Außerdem ein großer Flur mit viel Platz für Schuhe, Jacken etc., eine Abstellkammer inkl. Waschmaschine und eine schöne, geräumige Küche nach hinten raus mit Balkon.   Im Hinterhof befindet sich ein Garten, der von vielen Bäumen umrundet ist, was das Gefühl auf dem dem Balkon sehr idyllisch macht.  Das Zimmer wird möbliert zwischenvermietet."," Die Wohnung liegt direkt gegenüber der HTWK in der Richard-Lehmann-Straße. Die Haltestelle Richard-Lehmann / HTWK ist 100m von unserer Haustür entfernt und wird von den Straßenbahnlinien 9 / 10 / 11 sowie der Buslinie 70 bedient. Als Einkaufsmöglichkeiten stehen Rewe(4 Gehminuten), Lidl (3 Gehminuten) und Konsum (3 Gehminuten) zur Verfügung.","Hi, wir sind Lisa, Linus, Martin und Martha. da ich von Mitte August bis Ende September/ Anfang August (Ende ist recht flexibel) ein Praktikum woanders absolviere miete ich mein wunderschönes Zimmer unter. Wir wohnen in der Konstellation jetzt erst frisch zusammen und haben gemeinsam ein entspanntes, schönes Wg-Leben. Wir machen gerne die üblichen WG Dinge miteinander - Kochen, quatschen, Sporteln oder ein Bierchen auf dem Balkon, am See oder in der Kneipe.  Kurz zu uns: Linus arbeitet Drucktechnik und überlegt sich immer neue Hobbys. Martin arbeitet bei einem Solar Unternehmen und macht gerne Sport. Martha schreibt gerade ihre Bachelorarbeit und arbeitet nebenbei im Café Kater. Generell sind die drei immer für einen Schnack in der Küche zu haben und im Zusammenwohnen sehr angenehm.  Wenn du Lust hast uns mal kennenzulernen, kannst du dich gerne bei uns melden und mal bei uns vorbeischneien. Wir freuen uns sehr auf dich!",,1.0,0,"Studenten-WG, keine Zweck-WG, gemischte WG",https://www.wg-gesucht.de/wg-zimmer-in-Leipzig-Suedvorstadt.8678377.html,4er WG,Südvorstadt,    18,355 ,https://www.wg-gesucht.de/wg-zimmer-in-Leipzig-Suedvorstadt.8678377.html
