Street,Address,rent_cold,additional_cost,free_from,distance,gadgets,female_roommates,male_roommates,divers_roommates,room_description,location_description,flat_live,additional,smoker,accessible,kind_of_flat,Url,type,district,size,price,link
Büttnerstr. 22,04103 Leipzig Zentrum-Ost,250,139,01.07.2023,,,1,2,0," Das Zimmer ist zur Südseite zugewandt und hat hohe Decken. Durch drei Fenster kommt viel Licht ins Zimmer und es ist allgemein sehr hell. Außerdem ist das Zimmer zum Innenhof gerichtet, sodass kein Straßenlärm zu hören ist. Vielmehr ist es super ruhig und kann daher perfekt zum Arbeiten, Lernen und Wohlfühlen genutzt werden. Kabelanschluss ist im Zimmer vorhanden. Es können zwei Deckenlampen angebracht werden. Das Zimmer wird unmöbliert übergeben, bei Bedarf kannst du die Gardinenstange übernehmen.  In der Küche ist alles Mögliche vorhanden, was man zum Kochen braucht (Töpfe, Pfannen, Geschirr, ...). Wenn du aber noch etwas mitbringst, ist dafür auch noch Platz. Wir haben zwar keinen Balkon, aber über ein Küchenfenster gelangt man auf die Feuertreppe. Und weil die Sonne dort den ganzen Tag scheint, kann man dort besonders im Sommer gemütlich einen Kaffee trinken und die Sonne genießen."," Die Wohnung liegt hinter dem Wintergartenhochhaus und somit in zentraler Lage. Augustusplatz, sowie der Hauptbahnhof sind innerhalb 10 Minuten zu Fuß erreichbar. Sollten es doch mal die ÖPVM werden, erreicht man auch in 3 Minuten die Haltestelle Hofmeisterstraße. Trotz der hervorragenden Lage ist die Wohnung sehr ruhig, da sie sich in einer Nebenstraße befindet. Einkaufsmöglichkeiten gibt es viele und sind in ein paar Minuten erreichbar (HBF, Rewe, Edeka, Netto, ...)","Zu Zeit sind bei uns zwei Zimmer frei,es gibt also Veränderung. Bisher was das WG-Leben aber sehr entspannt und zwanglos, aber auf keinen Fall eine Zweck-WG. Unter der Woche ist das WG-Leben eher ruhig, da alle durch Studium und Arbeit viel zu tun haben. Doch Abends trifft man sich in der Küche, spricht über den Tag oder sämtlichen Blödsinn. Deine zukünftigen Mitbewohner sind:  Manuel (27) macht gerade eine Ausbildung zum Ergotherapeuten. Er kocht sehr gerne und viel, macht ausgiebige Spaziergänge, geht und hat die besten Tipps, wenn es um Cafés geht. Theresa (31) hat Anglistik studiert und arbeitet als Key-Account-Managerin bei einem Online-Handel. Sie lebt und atmet Bücher und Storytelling. Bei ihr wird mehrmals in der Woche Dungeons und Dragons gezockt oder auch gerne an ihrem neuen Gaming PC was digital gespielt. Björn (30) macht seinen Master als Wirtschaftsingenieur und arbeitet nebenbei bei der DB als Werkstudent. Er ist eine Maschine im Fitti und verbringt das ganze Wochenende mit feiern, katern und Konsole zocken."," Die WG befindet sich im 2. OG und es gibt einen Aufzug. Es gibt einen Fahrradkeller und die Möglichkeit, einen Parkplatz anzumieten. Waschmaschine und Trockner gibt es im Keller.Wenn du dir also vorstellen kannst Teil der WG zu werden, schreib uns einen kleinen Text über dich.  Wir freuen uns von dir zu hören! :)",1.0,0,"Studenten-WG, keine Zweck-WG",https://www.wg-gesucht.de/wg-zimmer-in-Leipzig-Zentrum-Ost.10134933.html,5er WG,Zentrum-Ost,    21,389 ,https://www.wg-gesucht.de/wg-zimmer-in-Leipzig-Zentrum-Ost.10134933.html
Ludwigstraße 54,04315 Leipzig Neustadt-Neuschönefeld,325,125,30.06.2023,2,"Waschmaschine,Spülmaschine,Balkon,Keller",1,0,0," Hier ein kleines Quiz zum Einstieg:  Frage Nummer 0  Hast du schon Mal was von Bildung für nachhaltige Entwicklung (BNE) gehört hast?  Frage Nummer 1:   Toilettenbrille unten oder oben?   Frage Nummer 2:   Wie stehen die beiden Anteile Herz und Taten, deines Wertesystems, unter der Betrachtung des bollschiwistisch- Kommunistischen Ansatzes, in Beziehung zueinander?  Frage Nummer 3: welches Gericht ist das anspruchsvollste in deinem Inneren Kochbuch?   Frage Nummer 4: Wie ist deine Beziehung zu Zimmerpflanzen?   Pflanzen ?   a)Ich kenn nur trockenes Laub  b)Mit Terminerinnerung kann ich auch ab und zu Mal Pflanzen gießen  c)Pflanzen versorgen gehört mit zum Haushalt, wie Abwasch machen.  d)Die Pflanzen sprechen mit mir und ich rede ihnen gut zu damit sie groß werden, dabei denke ich Permakulturell und nachhaltig   Frage Nummer 5:   Nenne die Farben des Regenbogen in der richtigen Reihenfolge ohne zu googlen…  Frage Nummer 6:   Was ist der goldene Schnitt?   Frage Nummer 7:  Wie viele Traumata ergeben ein ADHS?   ***** English below *******   Die Wohnung ist eine Altbauwohnung mit Holzdielenboden was alle Räume erdet und gemütlicher erscheinen lässt.  Zwei Fenster bieten genügend Licht in deinem Zimmer.    Es gibt ein Wohnzimmer mit Kaffemaschine, chillecke und Gästebett (wir bauen noch eine Ebene, wenn du selbst handwerklich begabt bist wärst du eine gute Ergänzung). Mein Schreibtisch steht ebenso im Wohnzimmer.    Die Küche ist Recht klein, aber dafür mündet sie auf einen Balkon.  Das Bad ist mit Wanne und Waschmaschine...    Eine sehr gemütliche kleine Hippiewohnung    English    The apartment is an old building apartment with wooden floorboards which makes all rooms seem more grounded and cozy.    Two windows provide enough light in your room.    There is a living room with coffee maker, chill corner and guest bed (we are still building a level, if you yourself are handy you would be a good addition). My desk is also in the living room.    The kitchen is quite small, but it opens onto a balcony.    The bathroom has a tub and washing machine....    A very cozy little hippie apartment"," Die Wohnung liegt mitten in Neustadt-Neuschönefeld. In 1 Minuten Entfernung sitze du bei Titos Pizza essen, diverse Spätis und das Weitere kulinarische Angebot der Eisi sind ebenfalls in 1-5 Gehminuten schnell erreichbar.   Die Bahnen 1,3 und 8 fahren regelmäßig von Herrmann-Liebmann/Eisenbahnstraße, wo du auch bequem in die 70 steigen kannst.   Neustädt- Neuschönefeld ist ein sehr belebtes und durchmischtes Viertel.   Arabische Kulturen prägen das äußere Bild der Eisenbahnstraße, neue, junge Künstler:innen, FLINTA Bewegungen, Antirassistische  und antidiskriminierende Bewegungen undProjekte, sowie alt eingesessene Leipziger mischen sich ins Stadtbild.   Für Leipzig der Stadtteil mit dem größten Großstadtflair. Hier gibts zugetackte Wände und Häuser. Und kleine noch relativ unkonventionelle Orte für nette Gespräche oder deine tägliche Küfa.   Schnell bist du zum joggen, spazieren gehen oder spielen im Mariannenpark und für die große Runde auch den anschließenden Abtnaundorfer Park. An der Parthe Und einigen Kleingärten entlang kommt ihr zum Theklaer See   English    10 minutes by train to HBF, many nice Arabic stores on the Eisi within a few minutes, as well as delicious snack stores and restaurants.    Cultural events are plentiful, as far as art and politics:) as well as Parkanlanlagen in a short distance (Mariannenpark...)    The Thekla Lake can be reached in about 10-15 minutes by bike.    International residents ensure a high heterogeneity and diversity :)","English below  Ich wohne seit 4 Jahren in diesem Traum von Wohnung und lege viel Wert auf Gemütlichkeit.  ich bin offen für Besucher:innen und veranstalte gerne Feste im und ums Haus. Würde mich freuen du hast Lust mit deinen Ideen einzusteigen und nachbarschaftliche Beziehungen zu stärken...mein Lebensgefährte ist auch öfter bei uns und ebenso engagiert, wie ich Du solltest ein Interesse an Pflanzen haben und einen ökologischen Lebensstil bevorzugen..ich habe.keine Lust auf Suchtproblematiken und kapitalistische, sexistische Denkweisen Wir lieben und leben den Regenbogen 🌈 Du solltest in der Lage sein die Wohnung sauber und ordentlich zu halten und dich gerne freiwillig um ihre Fürsorge bemühen:) My home is a temple my kitchen is the heart my room is for creativity The livingroom is a cozy social place Bevorzugt wünsche ich mir eine weiblich gelesene Person als Mitbewohner:in :)  English  I have been living in this dream of an apartment for 4 years and attach great importance to coziness.  I am open to visitors and like to organize parties in and around the house. Would be happy you have desire to enter with your ideas and nachbark KOschaftliche relationships to strengthen ... my life partner is also often with us and just as committed as I am.  You should have an interest in plants and prefer an ecological lifestyle..I have.no desire for addiction problems and capitalistic, sexist ways of thinking  We love and live the rainbow 🌈  You should be able to keep the apartment clean and tidy and be happy to volunteer to take care of it:)  My home is a temple  my kitchen is the heart  my room is for creativity  The livingroom is a cozy social place  We would be very happy to meet you  Wir würden uns sehr freuen dich kennen zu lernen",,,0,"WG mit Kindern, keine Zweck-WG, gemischte WG, Mehrgenerationen, inklusive WG",https://www.wg-gesucht.de/wg-zimmer-in-Leipzig-Neustadt-Neuschoenefeld.8135008.html,2er WG,Neustadt-Neuschönefeld,    18,465 ,https://www.wg-gesucht.de/wg-zimmer-in-Leipzig-Neustadt-Neuschoenefeld.8135008.html
Walter-Barth-Str,04318 Leipzig Sellerhausen-Stünz,255,0,25.06.2023,,,0,2,0, Zimmer verfügbar zur Untervermietung vom 15. Junibis 31. Juli,,,,,0,,https://www.wg-gesucht.de/wg-zimmer-in-Leipzig-Sellerhausen-Stuenz.10173749.html,3er WG,Sellerhausen-Stünz,    14,255 ,https://www.wg-gesucht.de/wg-zimmer-in-Leipzig-Sellerhausen-Stuenz.10173749.html
Wilhelminenstraße,04129 Leipzig Eutritzsch,380,0,01.08.2023,,Garten,0,1,0," 16 m2 groß Zimmer auf dem Dachgeschoss wird zwischengemietet. Die WG hat einen Flur, eine voll ausgestattete Küche mit 3m Küchenreiche für tägliches Kochen und Unterhalten. Dir steht ein Bad/WC zur gemeinsamen Nutzung mit nur einem/er anderen Mietbewohner/in. In deinem Zimmer steht alles für dein Schlafen und Arbeiten. Auch ein TV steht für dich bereits.  Auf dem Hinterhof/Garten steht neben Stellplätzen auch noch Fläche zur gemeinsamen Nutzung.  Kostenlose öffentliche Parkplätze sind vor dem Haus vorhanden.", 100 m zum Haltestelle (Straßenbahn)  LIDL in der nähe  12 Minuten nach HBF  REWE LUKAS DOMINO ROSSMAN MÄC GEIZ 7 minuten zuFuß,"dein Mitbewohner heißt hanna , er kommt aus Syrien und hat sein medizinische Studium abgeschlossen. Er lernt grad Deutsch, um sich auf seine Deutschprüfung vorzubereiten. Er spricht sowohl gut Deutsch als auch Englisch. Er ist sehr nett und sauber."," weil ich mein Studium ab August in anderer Stadt fortsetzen will, muss ich leider mein wunderschönes Zimmer verlassen. Deswegen suche ich jemanden, der hier wohnen will und das Zimmer sauber halten kann. Die Zwischenmiete ist befristet von 01.08 bis 30.09. Eine Verlängerung ist leider nicht möglich. Die Kaution ist 200€. Das Zimmer muss für 2 Monaten (01.08 - 30.09) zwischengemietet werden.",0.0,0,keine Zweck-WG,https://www.wg-gesucht.de/wg-zimmer-in-Leipzig-Eutritzsch.10198058.html,2er WG,Eutritzsch,    17,380 ,https://www.wg-gesucht.de/wg-zimmer-in-Leipzig-Eutritzsch.10198058.html
Georg-Schwarz-Straße,04179 Leipzig Lindenau,300,95,15.09.2023,1,"Waschmaschine,Spülmaschine,Balkon,Keller,Aufzug",1,1,0," Das Zimmer ist sehr geräumig, hell und alles was man braucht. Die Wohnung hat ein großes Bad mit Dusche und Badewanne und ein kleinen Bad. Die Küche ist ebenfalls so groß, dass sich dort das meiste Wg-Leben abspielt. Direkt an der Küche ist auch unser gemütlicher Balkon mit Blick in den Innenhof.Die Wohnung ist sehr gut angeboten, denn direkt vor der Tür fährt sie 7, welche bis in die Innenstadt fährt. Ein Supermarkt, Bäcker, Apotheke und Essenmöglichkeiten sind auch direkt auf der Tür. Meine Mitbewohner:innen sind sehr nett und wir haben eine gute Zeit hier. Bei Interesse gerne melden :)",,,,1.0,0,"Studenten-WG, gemischte WG",https://www.wg-gesucht.de/wg-zimmer-in-Leipzig-Lindenau.10165697.html,3er WG,Lindenau,    18,395 ,https://www.wg-gesucht.de/wg-zimmer-in-Leipzig-Lindenau.10165697.html
Fliede,04347 Leipzig ,150,100,26.06.2023,2,Balkon,1,0,0," Insgesamt drei Zimmer zur zwischenmiete bis Max. 15.September frei. Evtl. Wird ein Zimmer auch dauerhaft frei sein, das steht noch nicht ganz fest. Einziges Manko, es ist keine Küchenzeile in der Wohnung. Aber gemeinsamkönnen wir eine Lösung finden.", Nördlich vom Zentrum mit der Parthe und dem Park vor der Haustüre. Ruhig und dennoch sehr zentral,"Freie Wohnung, 3 Zimmer, Küche mit Balkon, Flur und Bad",,0.0,0,"Zweck-WG, Studenten-WG, Business-WG, keine Zweck-WG, gemischte WG, Wohnen für Hilfe, Internationals welcome, inklusive WG, WG-Neugründung",https://www.wg-gesucht.de/wg-zimmer-in-Leipzig.10195669.html,3er WG,,    22,250 ,https://www.wg-gesucht.de/wg-zimmer-in-Leipzig.10195669.html
Franckestraße,04318 Leipzig Anger-Crottendorf,320,50,01.09.2023,5,"Waschmaschine,Spülmaschine,Keller,Fahrradkeller",1,0,0," Du wirst in dem 13qm^2 großem Zimmer wohnen. Bett, Schrank, Schreibtisch - alles vorhanden. Es wäre optimal wenn du mit Pflanzen umgehen kannst, weil Mela will dass ihre Pflanzen überleben.Sie lässt ihre Bücher da. Daran kannst du dich bedienen. Ansonsten wird sich für deine Sachen genug Platz finden!Wir teilen uns das große Wohnzimmer, welches bereits gemütlich eingerichtet ist und Möglichkeiten zum gemeinsam Essen und Abhängen bietet. Von der super ausgestatteten Küche geht ein Wintergarten ab, der zum ruhigen und grünen Innenhof ausgerichtet ist. Da kann man auch gut rauchen. Außerdem haben wir noch eine Abstellkammer und ein Kellerabteil."," Die Wohnung liegt in Anger-Crottendorf und ist super an das Tram- und Bus-Netz angebunden (Haltestellen Martinstr., Holsteinstr. und Breitestr. sind in 5-7 min. zu Fuß erreichbar). Zum Bahnhof und zur Innenstadt kommt man in 10 min mit den Öffis oder mit dem Fahrrad. Zum Lene-Voigt Park läuft man in 10min und der ruhige und große Stünzer-Park ist auch nur 15min entfernt. Außerdem hat man auf der Zweinauendorferstr. gute Möglichkeiten für schnelle Snacks und aucheinen Späti :) Der nächste ALDI ist keine 5min zu Fuß entfernt und auch ein Kaufland und Penny sind in der Nähe. Ansonsten ist die Eisenbahnstraße auch nicht weit entfernt.","Mela geht ins Auslandssemester und verlässt mich. Deshalb suche ich eine Person, die mit mir wohnen will. Ich wünsche mir eine Person für ein freundschaftliches, unkompliziertes Zusammenleben. Dafür ist mir offene kommunikation sehr wichtig. Ich bin immer offen für gemeinsame unternehmungen oder einfach gemeinsam im Wohnzimmer zu co-existieren. zu mir: ich bin Eva, 24, studiere an der Htwk und arbeite nebenbei. In Leipzig bin ich erst seit letztem Jahr Oktober. Ich bin im Sommer viel unterwegs. Im Winter eher so drinnie. Dann gucke ich gerne trash tv und andere dinge auf unserem Beamer. Der ist der hammer!! ich brauche ganz viel Musik. ich mache gerne sport, interessiere mich für Kunst und Kultur, Design und Literatur. Meine Lieblingstiere sind Fische. ich funktioniere abends besser als morgens und ernähre mich vegetarisch.Freue mich auf deine Nachricht 🦦ps: Schick mir gerne deinen aktuellen Lieblingstrack :)",,1.0,0,keine Zweck-WG,https://www.wg-gesucht.de/wg-zimmer-in-Leipzig-Anger-Crottendorf.10188924.html,2er WG,Anger-Crottendorf,    13,370 ,https://www.wg-gesucht.de/wg-zimmer-in-Leipzig-Anger-Crottendorf.10188924.html
Ludwigstraße,04315 Leipzig Neustadt-Neuschönefeld,256,0,01.08.2023,1,,1,1,0," In unserer 3er-WG wird ab August ein Zimmer in der schönen Ludwigstraße frei!  Es ist 11 Quadratmeter groß, zum Hinterhof gelegen und dadurch sehr ruhig - und hat wie die übrigen Zimmer und der Flur rote Holzdielen.  Die Warmmiete beläuft sich auf 256 Euro."," Wir wohnen in einer Parallelstraße der Eisenbahnstraße, mit vielen Bars, Cafés, Döner-Läden und Einkaufsmöglichkeiten um die Ecke :)  Fast direkt vor der Haustür fahren Straßenbahn und Bus, mit dem Fahrrad ist man in ca. 7 min. am Hauptcampus u. Hauptbahnhof, im Rabet oder Mariannenpark ist man in 5 Gehminuten, und das Bier kann man sich auch im Späti direkt im Haus holen.Los ist immer etwas, dennoch ist es in der Wohnung rechtruhig, sodass man sich von dem Trubel auch gut mal zurückziehen kann.","Wir sind Tammo und Charlotte, beide Mitte zwanzig. Tammo (er/ihn) studiert Elektrotechnik und ist vor einem halben Jahr zu uns gezogen. Er ist zur Zeit sehr aktiv in einer Kampagne für die Mobilitätswende und ist unser Social Bird, der immer ein offenes Ohr hat für Späße und Sorgen aller Art.Charlotte (sie/ihr) studiert Grundschullehramt und wohnt seit fast 2 Jahren hier. Sie macht zur Zeit viel Musik, ist zum Runterkommen gerne in der Natur, malt und fotografiert gerne.Wir unternehmen regelmäßig Dinge zusammen und würden uns freuen, wenn Du darauf auch Lust hast :)Natürlich ist es aber auch total okay, sich mal zurückzuziehen.",,,0,Zweck-WG,https://www.wg-gesucht.de/wg-zimmer-in-Leipzig-Neustadt-Neuschoenefeld.10197779.html,3er WG,Neustadt-Neuschönefeld,    11,256 ,https://www.wg-gesucht.de/wg-zimmer-in-Leipzig-Neustadt-Neuschoenefeld.10197779.html
Merseburger Straße,04177 Leipzig Plagwitz,200,0,29.07.2023,2,"Waschmaschine,Balkon,Gartenmitbenutzung",1,0,0," Du willst den Sommer in Leipzig verbringen und suchst noch nach einer gemütlichen Unterkunft? Dann habe ich was für dich :)  Ich werde im Juli/August auf Reisen sein und mein Zimmer wünscht sich eine liebe Bewohnerin (ein kürzerer oder evtl. längerer Zeitraum ist auch möglich)  ☆ Kleines, aber feines Zimmer mit 2 Fenstern - es kommt nachmittags die Sonne rein ☆  Vorhandene Möbel:  Bett  Kleiderstange  Tisch  Stuhl  Regal  Spiegel  Es gibt ein paar pflanzliche Mitbewohner in meinem Zimmer - ich lasse sie dir gern da, kann sie aber auch in einen anderen Raum bringen.  Wir haben einen Wasserfilter, den du auch nutzen darfst:)"," Perfekte Lage nahe der Karl-Heine-Strasse, dem gleichnamigen Kanal und diversen Parks :)Es gibt einen Späti in unmittelbarer Nähe sowie verschiedene Restaurants mit Speisen aus aller Welt. Diverse Clubs und Bars sind auch nicht weit.   Zum See sind es ca. 20-30 Minuten mit dem Rad.","Deine Mitbewohnerin Nina ist sehr aktiv in ihrer Freizeit und macht derzeit eine Ausbildung und bereitet sich auf ihre Prüfungen vor. Daher schätzt sie die Wohnung als Ruheoase, Lern- und Erholungsort. Wenn du also auch eher einen ruhigen Ort suchst, passt es sehr gut. Sie selbst ernährt sich vegan, daher wäre es super, wenn du entweder genauso vegan bist oder weitestgehend vegetarisch.  Wir haben einen dritten Raum, den wir als Wohn-, Kreativ-, Tanzzimmer nutzen.  Meld dich, wenn du interessiert bist - wir freuen uns über deine Nachricht :)",,0.0,0,Frauen-WG,https://www.wg-gesucht.de/wg-zimmer-in-Leipzig-Plagwitz.9402716.html,2er WG,Plagwitz,    13,200 ,https://www.wg-gesucht.de/wg-zimmer-in-Leipzig-Plagwitz.9402716.html
Helmholtzstraße 18,04177 Leipzig Plagwitz,280,70,01.09.2023,1,,0,2,0.0," Das Zimmer ist mit 13qm das kleinste in der WG. Dafür ist es aber aufgrund der großen Fenster sehr hell und hat einen direkten Zugang zum Balkon. Das Zimmer ist möbliert (so wie auf den Fotos zu sehen), meine persönlichen Gegenstände werde ich dabei selbstverständlich komplett wegräumen, sodass du die Komode, die Kleiderstange und andere Abstellflächen für deine eigenen Sachen verwendenkannst. Die Musikanlage, der Schalplattenspieler und der PC Bilddchirm können ebenfalls sehr gerne benutzt werden. :) Anstelle eines Bettes, schlafe ich nur auf einer Matratze die ich tagsüber hochklappe, damit sie gut lüften kann und gleichzeitig Platz gespart wird. Die Matratze ist sehr dick und relativ fest, man merkt also nicht, dass man „nur“ auf einer Matratze schläft.",,,,1.0,0,Studenten-WG,https://www.wg-gesucht.de/wg-zimmer-in-Leipzig-Plagwitz.10197755.html,3er WG,Plagwitz,    13,365 ,https://www.wg-gesucht.de/wg-zimmer-in-Leipzig-Plagwitz.10197755.html
Körnerstraße 28,04107 Leipzig Südvorstadt,330,50,01.09.2023,2,"Waschmaschine,Spülmaschine,Keller",1,3,0.0," Das Zimmer ist 12qm groß, durch die über 3 Meter hohen Decken wirkt es dennoch größer. Die meisten Möbel werden im Zimmer bleiben.  In dem großen Flur steht ein Tisch mit Stühlen, sodass man entspannt zusammen sitzen kann und ein wenig plaudern.   Küche und Bad sind sehr modern ausgestattet und haben sogar Wasch- und Spülmaschine. Einen Trockner gibt es auch."," Die Lage könnte besser wohl kaum sein. Die Körnerstraße ist eine direkte Seitenstraße der belebten Karl Liebknecht Straße. Dort findest du allerhand Bars, Restaurants und kleine Läden.   Die Haltestelle Südplatz ist auch direkt um die Ecke. Von dort aus bist du in 10 Minuten an der Uni oder am Bahnhof.   Zum Clara-Zetkin-Park sind’s mit dem Fahrrad auch bloß 5 Minuten und an dort lässt es sich am Ufer des kleinen Flusses perfekt abschalten.","Mit dir zusammen wohnen werden Silvia, Aaron, Ali und Jan. Silvia (20) hat letzten Oktober ihr Studium angefangen. Mit ihrkannst du über jeden Flohmarkt spazieren und Räucherstäbchen kaufen. Aaron (22) fängt im September eine Ausbildung zum Physiotherapeuten an. Er interessiert sich für Sport und Geographie und kennt sich bei beidem echt gut aus. Außerdem hört er gern Metal und geht auf Konzerte. Jan (20) hat gerade sein Fach Abi an einer Leipziger Schule gemacht und arbeitet jetzt als Küchenhilfe. Mit ihm lässt es sich sehr gut über alle möglichen Fragen des Lebens philosophieren. Außerdem kocht er gerne. Ali (29) macht gerade Deutsch Kurse und Prüfungen, um in Zukunft als Zahnarzt arbeiten zu können."," Ich bin Caro (20) und ziehe aus. Ich studiere gerade Medien- und Kommunikationsmanagement in Leipzig und mache im Wintersemester mein Auslandssemester in Mailand. Dafür suche ich jetzt eine/n Nachmieter*in bzw. Zwischenmieter*in. Nach meinem Auslandssemester werde ich zwar wieder zurück nach Leipzig kommen, aber überlege dann nochmal innerhalb von Leipzig umzuziehen, somit gibt es vermutlich die Möglichkeit das Zimmer danach auch komplett zu übernehmen.",,0,,https://www.wg-gesucht.de/wg-zimmer-in-Leipzig-Suedvorstadt.10139834.html,5er WG,Südvorstadt,    12,380 ,https://www.wg-gesucht.de/wg-zimmer-in-Leipzig-Suedvorstadt.10139834.html
Merseburger Straße 124,04177 Leipzig Altlindenau,350,0,31.07.2023,4,"Waschmaschine,Spülmaschine,Balkon,Keller",2,2,0.0," Das Zimmer ist meine gemütliche Base im Leipziger Westen. Es ist komplett möbliert & hat zu dem noch ein paar kleine Features, die das heimische Leben angenehmer machen. Direkt gegenüber befindet sich das Badezimmer.  Insgesamt hat die WG 5 Zimmer mit Mitbewohnis, die vom Flur wegführen & einen großen offenen Küchen- und Wohnzimmerbereich."," Einen Schritt aus der Haustür herausgemacht und du stehst quasi auf dem Parkplatz von Lidl. Näher kann ein Supermarkt wirklich nicht sein. Zur nächsten Tram-Haltestelle sind es rund 5 Minuten zu Fuß.   Ansonsten bietet die Wohnung einen schönen Einblick in die Vorzüge des Leipziger Westens.","Deine lieben Mitbewohnis sind Eva, Madeleine, Lukas & Luca. Von Kochsessions, Filmabenden odersporteln ist alles möglich. Ganz nach dem Motto nichts muss, alles kann freuen wir uns über eine Person, die gerne auch mal Zeit in Gesellschaft verbringt und ein nettes Miteinander pflegt. Dadurch, dass unsere Wohnung geräumig ist und wir gerne Menschen um uns herum haben, geht es bei uns recht lebendig zu. Ein gemeinschaftliches Zusammenleben ist wünschenswert! :)"," Kurze Info zur Zwischenmiete. Ich bin ab Mitte Mai bis mindestens Mitte September unterwegs, um den Wassersport zu zelebrieren. Für den Zeitraum bis Ende Juli habe ich schon eine Zwischenmiete gefunden. Das Zimmer ist entsprechend ab dem 31 Juli frei.  Falls du Lust auf eine gemeinschaftliche WG hast, melde dich gerne bei mir :)",,0,keine Zweck-WG,https://www.wg-gesucht.de/wg-zimmer-in-Leipzig-Altlindenau.9102760.html,5er WG,Altlindenau,    17,350 ,https://www.wg-gesucht.de/wg-zimmer-in-Leipzig-Altlindenau.9102760.html
