Street,Address,rent_cold,additional_cost,free_from,distance,gadgets,female_roommates,male_roommates,divers_roommates,room_description,location_description,flat_live,additional,smoker,accessible,kind_of_flat,Url,type,district,size,price,link
Schützenhausstraße,04315 Leipzig Volkmarsdorf,71,119,25.07.2023,1,"Waschmaschine,Spülmaschine,Garten,Keller",1,2,0," [[Cozy and Bright ]]  Its a cozy small room, 7m² to be precise in a 4 room WG. it faces west and gets plenty of sun during the afternoon.  also through the window you can see our nice wide backyard and the trees of our neighbors so its a very quite room."," [[ Everything Cool is Within a walking distance ]]  The Location of the apartment is actually stellar, and offers many comforts.  First we are within less than a minute walking distance of three tram stations (7,8 and 3)   at a similar distance you find a nice park on the Würzner, more importantly the Bank, AOK and many Doctor praxes are also nearby.   As for shopping, you have the Konsom right behind us. Down the road you find the ‘’Angebot’’ (a cheap place to find Quality Vegan food)  and all the international supermarkets that the Eisi can offer, are under your reach.  Speaking of the Eisi; the place is close to many cool bars and cultural spaces like the Japanize House and many more social spaces. All in all, sometimes you won't even need your bike to get stuff done ;)","[[ Who are we? ..How are we ? ]] your Future Housemates are Ksenia, Rafael and Yaman.  Ill let them introduce themselves Hi, im Rafael and i am form Spain. I am 28 years old and I'm new in Leipzig. I'm studying classical guitar, I teach online and I work some mornings, too.  I really enjoy playing videogames, watching series and talking about anything as Ienjoy theoccasional beer. I'm clean and organized but also a chill guy.  Hola, I'm Yaman, I'm 23 and I'm really into media and storytelling in general,I'm doing an Ausbildung as a media designer ( and I’m loving it ). Sports are a thing for me lately ( hiking, swimming and BJJ) and also spend time making digital art and music, feel free to join me for an artsy evening of that's your thing …or come play video games with me and Rafa. Ksenia : incoming text We are a colorful punch and live our lives closely to each other since in our WG weenjoy communal living and sharing as an example ; we have a shared Kitchen style where we do our shopping together and all food is shared among us, Rafael and Yaman sometimes even plan meals together and cook together often since they have matching schedules of course that does not mean we must always be together at the table or in the supermarket, or share everything we buy lol  ((Atmosphere)) Also, we enjoy doing activities together, such as gaming evenings or movie nights, …sometimes even going out for a beer on the nearby bridge. Personal space is important for us as well, you can always close your door and have you, me time without feeling the pressure to join in whatever the others are up too. We also see our place as a safe space, and for that we try to live aware of each other and our needs, similarities and differences. We don't welcome toxic behaviors, sexist racist, homophobictransphobic or ableist bullshit, any kind of discrimination really. (( Harmony and communication )) Furthermore, we try to be aware of each other's mental health, and believe in open communication as a key for harmony in a WG. being open about our feelings and seeing each other eye to eye has always helped us navigate rough times. So If you are someone who likes to solve conflicts with an open ear and big hart, you'll fit right in. We also have a monthly meeting all of us to talk about the WG life, reflect adjust and fix, this meeting offers an extra chance to voice and wishes and be heard . if you read this far, put the word Unicorn in your text ; ) ((Cleaning housework))  We have a ‘’Putzplan’’ to make things simpler, we can explain to you in our meeting Of course once you move in we can adjust things, so feel free to bring change with you. also feel free to ask anything by texting us"," there is a lot to talk about, and we are looking forward to to do so, so send us a text and hopfully we meet soon  Best wishs  The Wg",1.0,0,"keine Zweck-WG, gemischte WG",https://www.wg-gesucht.de/wg-zimmer-in-Leipzig-Volkmarsdorf.9879150.html,4er WG,Volkmarsdorf,    7,190 ,https://www.wg-gesucht.de/wg-zimmer-in-Leipzig-Volkmarsdorf.9879150.html
Coppistraße 70,04157 Leipzig Gohlis-Mitte,280,113,07.06.2023,,"Waschmaschine,Spülmaschine,Balkon,Keller",0,1,0," Das Zimmer ist 12,5 Quadratmeter groß und die Fenster sind zur Seitenstraße gerichtet. Das Wohnzimmer ist wie zu sehen noch relativ leer, hier kannst du gerne auch kreativ mitgestalten :)", Die Wohnung befindet sichin Gohlis Mitte am Coppiplatz.,"Dein Mitbewohner ist Aymen, er arbeitet in einem Hotel und macht in seiner Freizeit gerne Musik."," Die Hausverwaltung benötigt eine Vorvermieterbescheinigung, Selbstsauskunft, PA-Kopie, Schufa (jetzt beantragen) -Auskunft und die letzten drei Verdienstabrechnungen.",1.0,0,gemischte WG,https://www.wg-gesucht.de/wg-zimmer-in-Leipzig-Gohlis-Mitte.10030251.html,2er WG,Gohlis-Mitte,    12,393 ,https://www.wg-gesucht.de/wg-zimmer-in-Leipzig-Gohlis-Mitte.10030251.html
Eisenbahnstraße 139,04315 Leipzig Neustadt-Neuschönefeld,406,0,01.07.2023,,"Waschmaschine,Balkon,Garten,Gartenmitbenutzung,Keller",1,0,0," In unserer WG sind zwei Zimmer verfügbar, ein drittes wird wahrscheinlich in einigen Monaten frei. Nach mehreren Jahren des Zusammenlebens ist es für jeden von uns an der Zeit, getrennte Wege zu gehen, entweder in eine eigene Wohnung zu ziehen oder in einer neuen Stadt nach Möglichkeiten zu suchen. Derzeit sind zwei Zimmer frei (18 qm und 16 qm). Beide haben Südfenster mit viel natürlichem Sonnenlicht. Zu der Wohnung gehören auch ein großes Wohnzimmer und ein Balkon, der an lauen Sommerabenden ideal ist. Das Gebäude wurde vor ca. 7 Jahren renoviert, ist gut isoliert und verfügt über eine Fußbodenheizung."," Lage  Die Wohnung befindet sich in der Eisenbahnstraße, nicht weit vom Torgauer Platz entfernt. Alles, was die Eisi zu bieten hat, ist schnell zu Fuß oder mit dem Fahrrad zu erreichen, aber unsere eigentliche Straße ist nicht sehr laut. Einkaufsmöglichkeiten sind reichlich vorhanden: Ein Konsum und eine Apotheke befinden sich direkt vor der Wohnung, Rewe, Lidl und Kaufland Reudnitz sind zu Fuß oder mit demFahrrad schnell zu erreichen. In der Umgebung gibt es zahlreiche Bars und Restaurants, und im Zuge der weiteren Entwicklung des Gebiets werden einige neue Geschäfte eröffnet. Die Straßenbahnlinien 7, 8 und 3 fahren direkt an der Wohnung vorbei, und das Stadtzentrum ist mit dem Fahrrad oder der Straßenbahn in etwa 15 Minuten zu erreichen.","Diese Wohnung ist perfekt für Leute, die eine neue WG gründen wollen. Die Wohnung ist voll ausgestattet und Sie müssen nur noch die Möbel für Ihr Zimmer bereitstellen (einige der auf den Bildern gezeigten Möbel sind vorhanden). Pia schreibt zur Zeit ihre Masterarbeit und wird in der Wohnung bleiben, bis sie fertig ist. Sie wird aber wahrscheinlich umziehen, um ihr Studium fortzusetzen, sobald sie fertig ist und ihr Zimmer frei wird.", Die beiden Zimmer sind beide sofort beziehbar. Ein Teil der Möbel kann bei Interesse übernommen werden (wir können Bilder schicken). Und das dritte Zimmer wird voraussichtlich im Herbst frei werden. Die angegebene Miete ist für Warmmiete inklusive Internet und GEZ.,1.0,0,"Studenten-WG, Internationals welcome",https://www.wg-gesucht.de/wg-zimmer-in-Leipzig-Neustadt-Neuschoenefeld.10191374.html,3er WG,Neustadt-Neuschönefeld,    16,406 ,https://www.wg-gesucht.de/wg-zimmer-in-Leipzig-Neustadt-Neuschoenefeld.10191374.html
Kochstraße 38,04275 Leipzig Südvorstadt,192,111,01.09.2023,2,Waschmaschine,1,0,0," Die Wohnung ist saniert und geräumig. Sie befindet sich im Dachgeschoss eines ruhigen Mehrfamilienhauses.   Das Zimmer ist länglich geschnitten und hat einen tollen Ausblick über die Südvorstadt bis hin zum Panorama-Tower.  Es wird unmöbliert vergeben."," Die Wohnung liegt in einer Seitenstraße der Kurt-Eisner-Straße und parallel zur Karli.  Es gibt einen kleinen Konsum und 2 Bäcker 1 Minute zu Fuß entfernt und einen Netto ca. 7 Minuten zu Fuß entfernt.  Man kommt mit den Straßenbahnlinien 10 und der 11 in 10 Minuten zur Innenstadt. Außerdem fahren die Buslinien 60, 74 und die 89 ebenfalls ganz in der Nähe ab.","Liebe WG-Suchenden,  am 01.09. wird das zweite Zimmer in dieser schönen Wohnung frei, da meine Mitbewohnerin mit ihrem Freund zusammenziehen wird.  Ich bin Sarah, 29 Jahre alt, und werde Ende des Jahres mein Lehramts-Studium (ich studiere Englisch und Spanisch) abschließen. Ich wohne seit Ende 2017 in Leipzig, und seit April letzten Jahres in dieser Wohnung.  Von Anfang Februar bis Anfang August 2024 möchte ich verreisen.Für diese Zeit würden wir dann eine/n Zwischenmieter/in für mein Zimmer suchen. Danach möchte ich in die Wohnung zurückkehren und mit dem Referendariat beginnen.  Ich wünsche mir ein ruhiges und harmonisches WG-Leben, denn die Wohnung ist für mich ein Rückzugsort. Das Zusammenleben stelle ich mir nach dem Motto „Alles kann, nichts muss“ vor.  Außerdem ist mir wichtig, dass wir uns jede Woche mit dem Putzen abwechseln, und dass du Nicht-Raucherin bist :)  Wenn du denkst, dass das für dich gut passen könnte, erzähl mir gerne ein bisschen über dich :)"," Du erhältst keinen separaten Mietvertrag, sondern bekommst einen Nachtrag zum Mietvertrag, auf dem wir beide stehen.  Meine Mitbewohnerin möchte einen Ablösebetrag von ca. 200€ für deinen Anteil der Küche, der Waschmaschine, der Möbel im Bad und dem Schuhregal. Das ist ein Anteil von dem, was sie beim Einzug vor 10 Monaten bezahlt hat. Ansonsten sind alle Kosten bereits in den 303€ enthalten.   Besichtigungen sind Montag bis Mittwoch ab 17 Uhr möglich, Freitags-Sonntags bin ich flexibler.",0.0,0,,https://www.wg-gesucht.de/wg-zimmer-in-Leipzig-Suedvorstadt.10141641.html,2er WG,Südvorstadt,    17,303 ,https://www.wg-gesucht.de/wg-zimmer-in-Leipzig-Suedvorstadt.10141641.html
GutsMuthsstraße 26,04177 Leipzig Lindenau,550,0,28.07.2023,1,"Waschmaschine,Gartenmitbenutzung",,,," Hallo zusammen,   ich vermiete meine 1-Zimmer Wohnung für den oben genannten Zeitraum unter. Die Wohnung besteht aus einer Küche, einem Flur, einem Schlafzimmer, und einem Badezimmer. Alle Räume gehen separat vom Flur ab.  Die Küche ist mit allem wichtigen ausgestattet was man zum Kochen und leben benötigt (Kochfeld, Ofen, Kühlschrank, Tisch + Stühle, Küchengeräte etc). Der Flur hat eine Garderobe, einer Kommode für Schuhe/Handtücher/Taschen und einem großen Regal was als Abstellfläche und Kleiderschrank dient. Das Badezimmer hat eine Badewanne sowie Waschmaschine und ist sehr geräumig.   Im Schlafzimmer befindet sich ein 1,40m Bett und eine Kommode mit einem Fernseher drauf (falls benötigt). Die Wohnung hat zwar nicht viele Quadratmeter, ist aber sehr gut geschnitten.   Die Wohnung ist mit Internet ausgestattet und befindet sich im 1. Stock des Hauses. Der Innenhof ist sehr schön, begrünt und kann von allen genutzt werden. Die Hausgemeinschaft ist super nett und besteht mehrheitlich aus Menschen in ihren 30er/40ern - also ein entspannter Umgang miteinander.  Ein wichtiger Punkt für mich ist, dass niemand über meiner Wohnung wohnt - es ist also sehr ruhig und es gibt kein Getrampel von den NachbarInnen. Die Wohnung gehtzur Straße raus, was man aber überhaupt nicht mitbekommt weil die Fenster 3fach verglast und neu sind.   Die Fahrräder werden im Innenhof abgestellt und sind sogar überdacht."," Da Wohnhaus liegt in Leipzig Lindenau, 1 Minute von der Karl-Heine-Straße entfernt (da sind Bars, Restaurants, Supermärkte und kleine Geschäfte) sowie 1 Minute vom Karl-Heine-Kanal, an dem man spazieren oder auch Joggen gehen kann.   Es liegen gleich 2 Tram Stationen unterschiedlicher Linien in 2-3 min Entfernung, man ist also sehr gut angebunden. In der gleichen Straße ist auch ein Netto und ein Konsum ist an der Karl-Heine-Straße - man muss also nicht weit gehen um einkaufen zu können.   Wer gerne Fahrrad fährt ist in 15/20 min in der Innenstadt oder in 25 min am Cospudener See zum baden!   Falls man ein Auto besitzt gibt es eigentlich immer Parkplätze in der Straße, die Parksituation ist also entspannt.",," Wie auf den Fotos zu sehen ist, ist die Wohnung möbliert und wird auch so vermietet.  Die Eigentümer des Hauses sind Privatpersonen und sehr engagiert.  Es ist alles mit den Eigentümern abgesprochen das jemand zur Untermiete in meiner Wohnung wohnt.",,0,,https://www.wg-gesucht.de/1-zimmer-wohnungen-in-Leipzig-Lindenau.10191203.html,1-Zimmer-Wohnung  ,Lindenau,    35,550 ,https://www.wg-gesucht.de/1-zimmer-wohnungen-in-Leipzig-Lindenau.10191203.html
Lilienstraße 35,04315 Leipzig Volkmarsdorf,312,0,01.07.2023,8,"Waschmaschine,Balkon,Keller,Haustiereerlaubt",2,0,0," hey :)  In unserer WG wird, ab dem 1. Juli, ein Zimmer frei. Das freie Zimmer ist, mit ca. 16qm, der zweitgrößte Raum unserer Wohnung. (was aber auch nicht besonders schwer ist, da wir leider nur eine sehr sehr schmale Küche haben)  Da unsere Küche wenig Platz bietet und da auch immer irgendetwas rumsteht, halten wir uns immer in den Zimmern der Mitbewohnis (was aber natürlich kein Muss ist) oder auf unserem Balkon, welcher einen Blick in den Hinterhof bietet & ein Sofa besitzt, auf.  Ansonsten ist unsere Wohnung mit einem (Tageslicht-)Bad (Dusche+Wanne), einer Abstellkammer im Treppenhaus und einem Kellerabteil ausgestattet."," Die Lage ist spitze. Die Tram-Haltestelle ""Reudnitz/Koehlerstraße"", wo regelmäßig die 4 oder die 7 hält, ist nur 8 Minuten zu Fuß von unserer Wohnung entfernt. In 10-15 Minuten kommt Mensch an die Eisenbahnstraße oder auch in den Lene-Voigt-Park, wo eigentlich immer etwas los ist.  Auch Einkaufstüten müssen nicht lang geschleppt werden. Das Kaufland erreicht mensch in 8 Minuten.","Unser WG-Leben war bisher immer sehr harmonisch. Nun zieht leider unser Mitbewohner aus und wir,Francis und Moni, würden uns wieder über ein sehr offenes & kommunikatives WG-Leben freuen. Wir sind leider -bei weitem- nicht die ordentlichsten Menschen & durch unsere kleine Küche fällt das nur noch mehr auf, aber wir geben uns auf jeden Fall Mühe, dass wir das vielleicht ein bisschen in den Griff bekommen. Ansonsten kochen viel zusammen, verbringen die Nächte zusammen auf Raves, vorm Fernseher mit ""Gossip Girl"" oder auch auf dem Balkon mit Wein oder Sekt.  Ich, diesich gerade auch um die Anzeige kümmert, bin Francis. Meine Pronomen sind sie/ihr, ich bin 20 Jahre alt und studiere Sonderpädagogik auf Lehramt. Ich wohne auch erst seit Mitte September in Leipzig und es wäre gelogen, wenn ich sagen würde, dass ich mich schon zu 100% eingelebt habe und auskenne. Ich bin viel auf Konzerten (meistens von Punk-Bands oder von politischen Rap/Hip-Hop Künstler*innen), lese zur zeit wieder mehr (würde auch gern mehr politische Theorie lesen, raff allein aber ziemlich wenig-vielleicht hast du ja da auch Bock drauf und wir können uns gegenseitig unterstützen :D), bin in einem Flinta*-Kollektiv im Leipziger Osten & mach sonst einfach gern was mit Freund*innen. Moni (sie/ihr), 21 Jahre,ist die zweite Person, die in der Wohnung bleibt. Sie studiert Ostslawistik und ist schon seit ca. 2 Jahren in Leipzig. Außerdem ist sie gern unterwegs, trifft sich viel mit Freund*innen und feiert gern mal nächtelang durch. Für mich war sie schon, als ich eingezogen bin, ein ganz großer Halt in Leipzig. Sie ist eine sehr offene und empathische Person, die immer ein offenes Ohr für Probleme hat, aber man parallel dazu auch immer mit ihr Spaß haben kann."," Uns ist wichtig, dass sich alle ihrer Privilegien bewusst sind. Wir haben keine lust auf jegliche Form der diskriminierung & wollen in unserer wohnung weder cops, bundis oder terfs.Da das hier alles relativ spontan ist, würden wir es sicher auch hinbekommen, dass wir im Juli die Hälfte der Miete übernehmen, aber darüber können wir ja persönlich nochmal quatschen. :)",1.0,0,"Studenten-WG, keine Zweck-WG",https://www.wg-gesucht.de/wg-zimmer-in-Leipzig-Volkmarsdorf.10188369.html,3er WG,Volkmarsdorf,    16,312 ,https://www.wg-gesucht.de/wg-zimmer-in-Leipzig-Volkmarsdorf.10188369.html
Industriestraße 29,04229 Leipzig Schleußig,190,80,01.07.2023,5,Waschmaschine,2,0,0," Das Zimmer ist 17,5qm groß, quadratisch geschnitten und hat zwei große Fenster.  Da es sich um einen Altbau handelt, hat es schöne hohe Decken.  Das Zimmer wird unmöbliert übergeben und somit ist viel Platz für deine individuelle räumliche Gestaltung.  Die WG besteht aus 3 Zimmern, einer Küche und einem Bad."," Unsere WG ist ca. 5 Minuten zu Fuß vom Auwald entfernt, von dem man zügig an die Weiße Elster, die Sachsenbrücke und den Clara-Zetkin-Park gelangt. Direkt um die Ecke ist der Konsum, außerdem gibt es hier mehrere Bäckereien, eine Apotheke, kleine Bars und was auch immer das Herz begehrt. Die Karl-Heine-Straße und der Felsenkeller sind von hier aus auch nur einen Katzensprung entfernt.  Zum Cossi braucht man mit dem Fahrrad in etwa 20 Min.","In der WG leben zurzeit Albertina, Carolin und Robert, wobei uns Robert nun leider verlässt.  Albertina ist 30 Jahre alt und kommt aus Argentinien. Bisher ist sie viel in der Welt herumgekommen und arbeitet mittlerweile Vollzeit hier in Leipzig. Abseits der Arbeit nimmt sie Deutschkurse, deshalb ist sie oft beschäftigt und in der WG nicht immer allzu oft anzutreffen.  „Kaffee und Kuchen“ ist einer ihrer deutschenLieblingstraditionen, der sie gerne in ihrer Freizeit nachgeht.  Carolin ist 24, wohnt noch nicht allzu lange in Leipzig und arbeitet als Logopädin. Sie ist sehr gesellig (deshalb auch gerne in der Küche anzutreffen), liest gerne, geht im Park spazieren, macht hin und wieder Sport und versucht gerade nach und nach Stadt und Umgebung kennenzulernen.  Bisher war die WG irgendetwas zwischen Zweck-WG und gemütlichen Beisammensitzen beim Abendessen. Wir verstehen uns alle sehr gut, sind aber berufstätig und haben verschiedene Arbeitszeiten. Im Allgemeinen gilt in unserem Zusammenleben der bekannte Spruch: „Alles kann, nichts muss.“ Da sich durch dich als neue/n Mitbewohner/in sowieso nochmal ein bisschen was ändert, sind wir ganz offen, unsere WG nochmal umzugestalten (sowohl im Bezug auf das Zusammenleben, als auch im Bezug auf die räumliche Gestaltung). Da Robert als langjähriger Mitbewohner einige Dinge aus der WG mitnimmt, würden wir uns sehr freuen, wenn du Interesse daran hast, bei der Neugestaltung der WG mitzuwirken und kreative Ideen mit einzubringen."," Für Fahrräder gibt es im Hinterhof eine überdachte Unterstellmöglichkeit.  In unserer WG haben wir einen Putzplan, wir sind aber auch für neue Ideen/Vorschläge offen, solange eine gewisse Sauberkeit herrscht.",0.0,0,"gemischte WG, Internationals welcome",https://www.wg-gesucht.de/wg-zimmer-in-Leipzig-Schleussig.10174105.html,3er WG,Schleußig,    17,270 ,https://www.wg-gesucht.de/wg-zimmer-in-Leipzig-Schleussig.10174105.html
Bernhardstraße 9,04315 Leipzig Anger-Crottendorf,520,200,01.08.2023,3,"Gartenmitbenutzung,Keller,Fahrradkeller",,,," Die Wohnung liegt im 2. OG rechts (von der Treppe aus gesehen). 3 Zimmer, Küche,  Bad mit Badewanne + Anschluss für Waschmaschine. Praktisch ist die zusätzliche Abstellkammer am Treppenpodest. Zur Wohnung gehört ferner ein Kellerabteil.   Die Wohnung ist sehr gut für eine WG geeignet, weil die drei Zimmer etwa gleich groß sind.  Gartenmitbenutzung ist erlaubt.  Eine Fahrradabstellmöglichkeit befindet sich im Hof. Zusätzlich besteht ein Fahrradkeller.   Ein KFZ-Stellplatz im Innenhof kann bei Bedarf für 25 € je Monat zusätzlich angemietet werden..  WICHTIG: Besichtigungstermine vereinbaren Sie bitte direkt mit dem Wohnnungsverwalter, Herrn Henel, Telefon (siehe unten). Danke."," Die Wohnung befindet sich in der Bernhardstr. 9, Leipzig. Das ist eine ruhige Parallelstraßezur Dresdener Str., direkt am Ramdorscher Park.   Die nächste Haltestelle der Straßenbahn befindet sich in der Dresdener Straße in ca. 200 m Entfernung.  Alle Geschäfte und Einrichtungen des täglichen Bedarfs (Lebensmittelgeschäfte, Supermärkte, Kindergarten etc.) sind in unmittelbarer Nähe vorhanden.",," Die Wohnung kann auch als Studenten-WG genutzt werden. Die drei Zimmer sind etwa gleich groß, sodass häufig Zweier- oder Dreier-WGs die Wohnungen für sich entdecken.  Die Mieter bilden eine sehr nette und ruhige Hausgemeinschaft. Viele Mieter sind Studenten. Die Nähe zur Uni macht die Wohnlage gesucht. Fahrräder können im Hof oder auch im Keller untergestellt werden.  WICHTIG: Besichtigungstermine vereinbaren Sie bitte direkt mit dem Wohnnungsverwalter, Herrn Henel, Telefon (siehe unten). Danke.",,0,,https://www.wg-gesucht.de/wohnungen-in-Leipzig-Anger-Crottendorf.9382531.html,3-Zimmer-Wohnung  ,Anger-Crottendorf,    62,720 ,https://www.wg-gesucht.de/wohnungen-in-Leipzig-Anger-Crottendorf.9382531.html
Straße des 18. Oktober,04103 Leipzig Zentrum-Südost,38,0,15.07.2023,5,"Waschmaschine,Balkon,Fahrradkeller,Aufzug",0,0,0," Die Miete beträgt 38€ am Tag (am besten länger als eine Woche bleiben, dann gerne mit Rabatt). Einmalig 20€ für die Reinigung!  Die Wohnung hat ein großes Zimmer mit allem was das Herz begehrt:   - Durch Vorhang abgetrennt und abgedunkelter Schlafbereich  - Kuschlige Couchecke, mit Pflanzen umgeben   - Einer ruhigen Schreibtischecke, mit tollem Weitblick   - Sowie der halboffenen Küche, die mit selbstgebautem Bartisch.   Desweiteren hat sie einen ruhigen Balkon mit Sitzgelegenheiten und eingroßes Bad.   Ich überlasse die Wohnung komplett möbliert und größtenteils mit meinen privaten Sachen an Ort und Stelle. Störendes zwischenlagere ich in der Abstellkammer.   Die Wohnung ist dadurch komplett eingerichtet, was ihr alles nutzen dürft. Bitte keine Tiere und keine Raucher!"," Direkt am Bayerischen Bahnhof, unweit vom Wilhelm-Leuschner Platz. ÖVP ist direkt vor der Tür, wobei ich die App LMove für kostenfreie Nutzung der NextBikes empfehle.",, Bitte nehmt vorab via eMail mit mir Kontakt auf!,,1,,https://www.wg-gesucht.de/1-zimmer-wohnungen-in-Leipzig-Zentrum-Suedost.9324455.html,1-Zimmer-Wohnung  ,Zentrum-Südost,    44,58 ,https://www.wg-gesucht.de/1-zimmer-wohnungen-in-Leipzig-Zentrum-Suedost.9324455.html
