Street,Address,rent_cold,additional_cost,free_from,distance,gadgets,female_roommates,male_roommates,divers_roommates,room_description,location_description,flat_live,additional,smoker,accessible,kind_of_flat,Url,type,district,size,price,link
Radiusstraße 13,04179 Leipzig Neulindenau,270,40,01.07.2023,5,"Waschmaschine,Keller,Fahrradkeller,Haustiereerlaubt",0,1,0," Hallo da :),  das Zimmer ist zur Westseite gelegen und mit schönen Sonnenuntergangs-Ausblick, Vogelgezwitscher und hell und ruhig, weil es zum Hinterhof heraus liegt. Im Zimmer können Regal, Lattenrost mit Matratze, Ikea-Sessel und weiteres Interiör wie u.a. kleiner Wäscheschrank  und -ständer benutzt werden. Das Zimmer liegt neben der Küche und die Wände sind nicht super-dick. Dennoch möchte ich dir auch ein ruhiges Wohnen ermöglichen und habe zur Schallisolierung  eine Dämmschicht an die Tür angebracht. Nachts bin ich natürlich nur wenn denn leise in der Küche unterwegs. Ich brauche selbst Ruhe für Schlaf und Konzentration und will dir natürlich das gleiche bieten.  Zur Wohnung insgesamt:  Es gibt so die solide Basis-Ausstattung: Internet Wifi-50Mbit, Waschmaschine, Kühlschrank, Superherd und -ofen, Mikrowelle, Toaster (aber leider keine Spülmaschine ;().   ---------------------------------------------------------------------------------------------------------------------------------------------------------------------------  Hi there :),  the room is facing to the westside with nice sunset-views, birds-singing and is bright and calm, because it is also facing to the backyard. A cupboard, ikea-seat , slatted frame, mattress and a small wardrobe can be used. The room is next to the kitchen and the walls aren't super thick. But I've put some acoustic-isolation-plates on the door.The kitchen will be used only during the day or considerately silently at night. I need relative silence for sleeping and focusing and I'm trying to offer the same to you.  About the flat in general:  I have all the solid-standard-stuff: 50Mbit Wifi-Internet, washing machine, fridge, great stove and heating plates, mikrowave, toaster (but no dishwasher ;().   ---------------------------------------------------------------------------------------------------------------------------------------------------------------------------  Tambien hablo español más o menos fluido y me encantaria hablarlo contigo...solamente no tuvé ganas de  traducir todo esto otra vez. Pero lee lo que está escrito en ingles/alemán por favor."," Die Lage ist sehr schön ruhig, weil es eine Nebenstraße mit wenig Verkehr zur Lützner-Straße ist. Altlindenau ist kein Szene-Party-Viertel aber man ist dennoch schnell in 5min mit dem Rad im schönen Plagwitz an die Karl-Heine-Straße mit Bars, Spätis, Kinos und Straßenlebenflair und mehr.  In nem kleinen Park nebenan gibts Tischtennisplatten und ich habe auch eine Kelle für dich :).  Wer Natur mag: Der etwas größere Schönauer Park ist nah dran und man kann von hier aus schön und recht weit ins Grüne spazieren (schaut mal selbst auf der Karte nach) und der Kulkwitzer-See ist auch in 20min per Rad oder Tram erreichbar.  Einkaufsmöglichkeiten und Imbissbuden sind um die Ecke (Netto, Konsum,  toller Handwerks-Bäcker, ne gute Döner-Bude und Asia-Laden).  ---------------------------------------------------------------------------------------------------------------------------------------------------------------------------  It is a calm flat, because it is in a calm side-street to the Lütznerstreet. Altlindenau is not a popular-cultural-live-hood but it it is close to the beautiful Plagwitz, where you can go to in 5min by bike to the the Karl-Heine-Street with its bars, cinemas, latenightshops, streetlife etc.  For Nature-Friends: There is two smaller parks with table-tennis close by and i also have a bat for you :)...and there is even a bigger park (called Schönauer Park) close by and you can have nice long walks in the nature from here (check it on the map) and the Kulkwitzer Lake can be reached by bike or metro in 20min as well.  There are supermarkets and take-aways close by (like Netto, Konsum and a craft-backery, a nice Döner and asian-fast-food)","Ich bin Sozialarbeiter und Ergotherapeut und studiere gerade im Fernstudium Psychologie - um Psychotherapeut zu werden. Seit etwa 8 Jahren bin ich in Leipzig und und habe zwischendurch2 Jahre in Portugal und Spanien gelebt. Ich bin relativ extrovertiert, nerdig, diskussionsfreudig und offen für neue Erfahrungen. Sorry an Party-People: Das hier ist keine wilde Party-WG. Aber ich bin Freund von gemeinsamen WG-Kochen und Brettspielsessions und Kunst&Kultur. Nebenher spiele ich indische Tablas und mag Sport und Bewegung generell (derzeit mach ich Kanupolo, Yoga. Schwimmen, Hiphoptanz, Joggen...ne Runde gemeinsam Tischtennis in den Parks neben an oder wandern am WE leg ich auch gerne ein.=)) Ich übe regelmäßig Achtsamkeitsmeditation und bin großer Fan vonPsychologie, Scifi und Philosophie und Natur-fähigkeiten und -wissen. Wir müssen nicht engste Freunde werden, aber ein Mindestmaß an Höflichkeiten, Wertschätzung und Smalltalk (Wie war der Tag? etc.) im Alltag ist mir wichtig. Ebenso eine wertschätzende und zugleich ehrliche Konfliktkultur.  Zur Sauberkeit:  Etwas Staub und Krümel stressen mich nicht gleich- aber sie sollten auch kein Eigenleben anfangen. Zur Zeit hatte ich mit dem letzten Mitbewohner einen recht lockeren Putzplan mit 1xpro Monat Grundreinigung. Alternativen können wir gerne aushandeln.  WICHTIG: Dies ist eine absolute Nichtraucher-WG (d.h. auch E-Zigarettenverbot) und du solltest auch nicht draußen rauchen bzw. Nikotinabhängig sein und . Jegliche -Ismen wie Rassismus, Sexismus, Homophobie sind bei mir kein Thema. Dennoch erwarte ich einen universell höflichen und friedlichen Umgang mit Menschen - insbesondere mit deren Weltbild/Berufsgruppe/politischer Haltung du nicht sympathisierst.  Zum Mietverhältnis: Wir machen einen Untermietvertrag und ich stelle dir gerne eine Wohnungsgeberbestätigung aus.  ---------------------------------------------------------------------------------------------------------------------------------------------------------------------------  I am a social worker and ocupational therapist and am currently studying my online-masterdegree in psychology to become a therapist. I have been living in Leipzig for around 8 years now and I did spend 2 years living abroad in Portugal and Spain.I'm quite extroverted, nerdy, intellectual, physically active and enjoy constructive debates. Sorry to all the party-people: This is not a party-flat. But I like cooking- and playing boardgames together in the flat or enjoy seeing some culture&arts-stuff. I play indian tablas and like sports and movement in general (Kanupolo, Yoga, Swimming, Running and Hiphopdancing or we play some table-tennis or go hiking =)?). I practice mindfullnessnmeditation and I'm very interested in psychology and philosophie and nature-knowledge and -skills.  We don't have to become closest friends but acertain level of politeness, valuation and non-superficial smalltalk (sharing daily impressions etc.) matters to me. Telling me what disturbs you directly is way better than texting or leaving post-its.  Cleaning: I don't feel uncomfortable with some bits of dust and breadcrumbs around, but they should not start evolving into societies ;). I made up a fixed cleaning schedule for the flat with my last flatmate (1x per month)–but alternatives can be negotiated.  IMPORTANT: This is an absolute smoke-free flat (Vaping also prohibited) - you shouldn't be a smoker either (even if you'd smoke only outside. Doesn't work for me).  Needless to talk about all kinds of -isms like racism, sexism, homophobic behaviour in my flat. But you should be capable of coping with moral-diversity and show a peacefull behaviour towards people with differing morals/jobs/politcal views than yourself. You'll be given a sub-tenant-contract and I can give you a Wohnungsgeberbestätigung for the official registration at the Bürgeramt."," Bitte lest den Text - auch wegen des Party&Raucher-NoGos gründlich, damit wir unnötige Casting-Treffen vermeiden.  Falls ihr interessiert seid oder weitere Fragen habt, kontaktiert mich gerne.   ***WICHTIG***: Ich bitte um Anschreiben, in dem ihr ein Wenig von euch selbst,  was ihr in Leipzig so macht oder vorhabt bzw. wo ihr sonst gerade herkommt und eueren Erwartungen an unser Zusammenleben erzählt. (Sonst bekomme ich den Eindruck, ihr habt hier nichts gelesen.)  PS. Sorry im voraus:  Ich werde nicht alle Anfragen beantworten - dafür sind es zu viele.   ---------------------------------------------------------------------------------------------------------------------------------------------------------------------------  Please read my text carefully - especially because of the Noparty&smoking-rules, to avoid unnecesarry casting-meetings.  If you are interested or have further questions feel free to contact me.   Moving in before the 1. of july earlier is possible.  ***IMPORTANT***: Please write something about yourself, where you're living currently, what your plans are in Leipzig and about your expectations regarding our flat-share-life. (otherwise I'll get the impression you haven't read this)  PS. Sorry in advance, but I won't reply to all the requests - there are too many.",0.0,0,"Studenten-WG, keine Zweck-WG",https://www.wg-gesucht.de/wg-zimmer-in-Leipzig-Neulindenau.10198360.html,2er WG,Neulindenau,    12,310 ,https://www.wg-gesucht.de/wg-zimmer-in-Leipzig-Neulindenau.10198360.html
Bischofstraße 8,04179 Leipzig Leutzsch,270,50,31.07.2023,5,"Waschmaschine,Spülmaschine,Balkon",2,1,0," Ich kann der Hausverwaltung einen Nachmieter für mein schönes Zimmer empfehlen.   Das Zimmer ist mit einem Bett in gutem Zustand,  ein Kleiderbügel ausgestattet, ein Kleiderschrank, sowie ein bücherregal mit einem Screibtisch (auch ein leeres Zimmer ist möglich, je nach Absprache);   Die WG hat:  - Gemütliches, helles Zimmer;  - Einbauküche (Herd, Backofen, Dunstabzug, großer Kühlschrank, Geschirrspüler, Tisch und Schränke);  - Badezimmer mit Dusche und Waschmaschine  - Balkon"," Die WG liegt in der Bischofstraße 8, 3. Stock. Es gibt einen kleinen, gemütlichen Park, den Calisthenics Sportpark.  In einigen Minuten erreicht man die Haltestellen Pfingstweide, oder Leipzig-Leutsch. Die Straße ist eine Einbahnstraße und dadurch wenig frequentiert. In der Nähe der Wohnung gibt es mehrere Geschäfte: Penny, Rewe, Rossmann. Darüber hinaus gibt es mehrere Möglichkeiten, das Zentrum zu erreichen: mit dem Straßenbahn oder mit dem Fahrrad in ungefähr 20 Min.","Außer mir wohnen nochdrei weitere Personen in der Wohnung: Aishah, Olimpia und Kehinde. Olimpia kommt aus Polen und studiert derzeit an der Universität. Aishah ist eine Deutsche und sie auch studiert an der Universität. Kehinde ist neu in unserer Wohnung. Wir haben eine wunderschöne und gemütliche WG. Wir feiern keine Partys, und die meiste Zeit ziehen wir Ruhe und Lernen vor, aber wir leben einmütig.Wir haben auch einen Putzplan in der Wohnung, jede Woche putzt eine Person einen Teil der Wohnung (ein bestimmtes gemeinsames Zimmer), für den er in dieser Woche verantwortlich ist."," Das monatliche Mindesteinkommen muss 900 € betragen, damit Sie sich für dieses Zimmer bewerben können.   Vor Besichtigung der Wohnung müssen Sie die Selbstauskunft ausfüllen, die ich Ihnen zuschicken werde. Alle Unterlagen, die in der Selbstauskunft aufgeführt sind, müssen direkt von Ihrer E-Mail-Adresse an meinen Vermieter geschickt werden.  Es wäre besser, wenn Sie schreiben und nicht anrufen würden",0.0,0,keine Zweck-WG,https://www.wg-gesucht.de/wg-zimmer-in-Leipzig-Leutzsch.10196086.html,4er WG,Leutzsch,    10,320 ,https://www.wg-gesucht.de/wg-zimmer-in-Leipzig-Leutzsch.10196086.html
Leplaystraße 3,04103 Leipzig Zentrum-Südost,262,0,01.08.2023,3,"Waschmaschine,Spülmaschine,Keller",1,1,1," Das unmöblierte Zimmer hat vier weiße Wände, Fußboden, Decke, großes Fenster und Tür. 4,14 m x 3,60 m und 3 m hohe Decke laden dich zum Dekorieren ein. Die Fotos sind aktuell und stellen eine mögliche Lebensform da. 262 € all inclusive.  (Miete, Internet, Strom, GEZ, Mieterschutzbund usw.) Für viele gemeinsame Verbrauchssachen wie Salz, Klopapier usw. haben wir ein ausgeklügeltes Einkaufs- und Abrechnungssystem (EAS) entwickelt. 75 € berechnet unser Vermieter für deinen Einzug."," Kurz und knapp ==> Top Lage.  Du kannst in dieser Stadt kaum zentraler wohnen.  7 Minuten für Mensaspaziergänge, 3 Minuten um in die 2, 9 oder 16 zu hüpfen  oder in 5 Minuten vom Wilhelm Leuschner Platz in jede Richtung zu kommen.  Edeka, Aldi und die Stadtbibliothek sind wenige 100 Meter entfernt.  Die Fahrradselbsthilfewerkstatt vom Studentenwerk ist genau 1 Minute entfernt.   Den Döner gibts im Haus mit dazu, der ist aber nicht gut, für was Besseres kann man sich aber einfach 5 min zur Windmühlenstraße bewegen. Noch besser ist aber Pizza für 7 Euro direkt um die Ecke, die Jungs kennen uns schon, man wird herzlich empfangen und die Mütter werden gegrüßt.   Da wir im Hinterhaus wohnen, bekommen wir aber vom Verkehrslärm sehr wenig ab.","Hello Liebe(r) zukünftige(r) Mitbewohner,  wenn du eine herzliche WG suchst, deren Mitbewohner*innen es wichtiger ist, deine Lieblingsserie zu kennen, als einen dreckigen Teller nach 5 Minuten abzuwaschen, dann bewirb dich bei uns. Wir würden uns freuen, wenn sich etwas freundschaftliches Entwickeln würde und du Herz, Charme und Witz mitbringst. Gemeinsame Brettspieleabende (hier kannst du Pluspunkte bei der Bewerbung sammeln), ausgedehnte Spaziergänge,Container - und Kochaktionen, mittlere Trinkrunden, um die Häuser ziehen könnten deinen grauen Alltag bereichern. :D  Unser lieber Thilo verlässt uns für eine Frau. Wir sind immer noch völlig geschockt von dieser Tatsache.  Wer wird Leah nun Tofu zum Kochen beisteuern? Mit wem wird Pia das literarische Quartett, was nur ein Duett war, fortführen?Und wem skizziert Matti die geopolitische Weltlage am Frühstückstisch? Fragen über Fragen !!!  In der WG backen bleiben folgende Menschen:  Leah, 24 Jahre, studiert Informatik im Bachelor, kommt aus einem Kaff bei Duderstadt.  War nach der Schule 3 Jahre auf Weltreise in Südostasien, wo auch der Entschluss gefasst wurde den digitalen Nomaden Lifestyle zu verwirklichen und hat dort auch ihre Fernbeziehung klargemacht und später wieder aufgelöst. Kann dir tollen Gossip von ihrem Singleleben erzählen. Leah liebt alle Arten von Verkleidung und geht gerne auf Mittelalterfestivals oder WTGs. Versucht schon seit 3 Jahren einen Frühjahrsputz zu organisieren. Leah kocht gerne (z.B.mit Thilo) alle Arten von Hülsenfrüchten, Kartoffeln, Reis und ganz viel Gemüse. Der Dal-Donnerstag unter ihrer fachkundigen Anleitung ist legendär. Hat sich praktisch die komplette Zimmereinrichtung auf Ebay-Kleinanzeigen zusammengeklaubt. Zu ihren Hobbys gehört Slacklinen, Ariel Circle, Wandern, Klettern, Campen, Poi spielen. Ihre nerdige Art lebt Leah beim Programmieren, Sudoku Videos gucken oder beim Brettspielen gegen Matti aus. Hat dort die gefürchtete Leahglücksstrategie entwickelt. Arbeitet nicht mehr in nem unterbezahlten Dödeljob an der Hochschule HTWK, sondern hat sich einen richtigen IT Job gesucht (ganze 12 Wochenstunden). Demnächst startet die High Potential IT Karriere. Verarbeit den Alltag sehr lebhaft in den Träumen. Hat sich den Finger beim einem Rave gebrochen und wurde deswegen auf den Arm genommen. Oder sollte ich besser Finger sagen? Vegan. Pia, 24 Jahre, hat gerade den Germanistikmaster abgeschlossen, kommt aus einem Kaff im Schwarzwald.  Geflüchtet aus der heilen Welt des Schwarzwaldes ist Pia hier gelandet und studierte erst Literarisches Schreiben und dann Germanistik. Will noch einen 3.akademischen Grad in Lesen und Schreiben absolvieren, denn das Schriftstellerinnenleben istziemlich hart und muss mit Kaffee, Rotwein, schlecht gedrehten Zigaretten und ab und an mal IFZ aufgebessert werden. Das beschreibt auch ganz gut Ihr restliches Leben. Sehr gemütlich und sehr belesen wird sich im Morgenmantel und Nachthemd von Tag zu Tag geschrieben und geschlafen (Geheime Superpower: Locker mal 2 Tage schlafen). Falls Sie doch mal rausgeht, dann nur leicht bekleidet, auch bei -5 Grad Celsius reicht der Hoodie, es ist ja schließlich 'gar nicht so kalt'. Kann professionell Tinder Korrespondenz abwickeln. Pia geht um exakt 22 Uhr ins Bett. Uhren haben wir abgeschafft. Hat ihre erste Gedichtesammlung veröfffentlicht und haut das verdiente Geld gleich für die nächsten Bücher uffen Kopp. Ironie wird großgeschrieben und es gibt den ein oder anderen Moment, in dem man sich schon hart verarscht vor kommt, aber mit der Zeit verbessern sich die eigenen Ironiedetektoren. Für Gelaber in der Küche ist sie immer zu haben und auch nicht den nächtlichen Spaziergängen abgeneigt. Spielt höchstens mal ein Siedler mit. Schwäbelt. Matti, erfahrene 34 Jahre, 800. Semester Informatikmaster, ursprünglich aus einem Kaff im Norden Brandenburgs.  Hat mit viel Mühe (und Mate) seinen Bachelor in Wirtschaftsinformatik geschafft, versucht dass seine Semesterzahl nicht das Alter überrundet. Im 30ten Hochschulsemester dümpelt er an der Uni rum. War grad 2 Semester in Israel, für die Vorbereitung hat er nur 5 Jahre gebraucht. Seine Faulheit findet sich auch kulinarisch wieder - er ernährt sich von Mensa, Pizza und BACKCAMEMBERT und das exzessiv. Zuletzt hat er sich monatlang von Erasco Linsen-Einstopf mit Würstchen ernährt, die Sonderangebote der Supermärkte geplündert und eine Notreserve im Keller angelegt. Doch das ist nicht sein einziges Laster. Aktuell versucht er seine Mate-Sucht zu bekämpfen und die Burpeesätze zu steigern. Du triffst ihn überall an, wo es etwas umsonst gibt. Halte Ausschau nach einer rülpsenden Person mit schmuddeligem Jutebeutel, verschlissenem kurzen Jogger mit Löchern an pikanten Stellen, ausgelutschten Sandalen und einer Flasche Erdinger Alkoholfrei. Auf der Facebook Fan Seite von Sternburg kannst du dir ein Bild von ihm machen. Matti trinkt kein Alkohol, raucht nicht und nimmt auch keine anderen Drogen. Trotz dem kann man mit Ihm eine Menge Spaß haben... Er ist Flunkyball Schiedsrichter und hat schon das eine oder andere Turnier ausgerichtet, zuletzt mit seinen Tramper Freunden. Er organisiert abgesehen von diesem Jahr ein Tramp Rennen durch Europa - also falls du Lust hast, komm gerne das nächste Mal mit. Bitte verwende das Wort Steuererklärung in deiner Bewerbung, um deine Lesekompetenz zu überprüfen. Konträr dazu steht seine Leidenschaft zum Zocken. Am PC(Age of Empires) und auf dem Brett, vor allem komplexe Strategiespiele. Mach dich gefasst das ein oder andere Spiel mit ihm zu spielen, oder dir Ausreden einfallen zu lassen, warum das jetzt gerade wirklich gaaaaanz schlecht ist. Falls der Spieleabend in der HTWK mal ausgefallen ist, gibt es eine Runde Tagesthemen, heute- oder Auslandsjournal. Das geht immer als alternative zum Siedler spielen. Sein Humor ist dreckig, so auch seine Einstellung zum Putzen. Ist erklärter Fan von Karl Lauterbach und erzählt seinen 90 Mitbewohnern gerne Details aus dessen Leben. Lieblingsserien: Game of Thrones, House of Cards. Liefert sich bürokratische Scharmützel mit Dönerbudenbesitzern. Experte im Ran- und Wegschaffen... Hat konkrete Pläne, die Weltherrschaft an sich zu reißen, davor muss er aber erst seine Hose flicken lassen. BWLer"," Wir freuen uns auf deine Bewerbung. Je mehr und detaillierter du schreibst, desto besser können wir uns ein Bild machen und die Wahrscheinlichkeit eingeladen zu werden steigt. Wenn du magst, kannst du uns auch zusätzlich dein Facebook, Insta etc. schicken. Wenn du uns sympathisch bist, melden wir uns auch sehr schnell. ;)  Liebe Grüße  Leah, Pia und Matti",1.0,0,"Studenten-WG, keine Zweck-WG, gemischte WG, Internationals welcome",https://www.wg-gesucht.de/wg-zimmer-in-Leipzig-Zentrum-Suedost.7109071.html,4er WG,Zentrum-Südost,    15,262 ,https://www.wg-gesucht.de/wg-zimmer-in-Leipzig-Zentrum-Suedost.7109071.html
Zwenkauer Straße,04277 Leipzig Connewitz,350,0,15.07.2023,3,"Waschmaschine,Garten",1,0,0," Halloo,  da es meine Mitbewohnerin leider nach Berlin verschlägt bin ich auf der Suche nach einer*m neuen Mitbewohner*in.   Das Zimmer ist zwar klein mit seinen ca. 12qm, aber dafür bekommt es wunderbare Sonne und ist sehr hell und da es zum Hof rausgeht auch ziemlich leise. Außerdem gibt es auf halber Treppe einen kleinen Abstellraum, auf den ich keine Ansprüche erhebe, wo alle Dinge die nicht im täglichen Leben gebraucht werden, abgestellt werden können. Und da das Badezimmer riesig ist, muss man sich auch nie mit Wäscheständern und co das Zimmer teilen.   Ansonsten gibt es noch die Küche, mein Zimmer und das eigentlich beste an der Wohnung: den riesen Hinterhof/ Garten. Den teilen wir uns mit der restlichen Hausgemeinschaft, er gehört irendwie ein bisschen allen und auch keinem. Auf jeden Fall läd er, insbesondere bei diesem Wetter, zum in der Sonne frühstücken oder lesen oder auch mal ein Lagerfeuer machen ein."," Die Wohnung liegt in einer Parallelstraße zur Bornaischen Straße, mitten in Connewitz. Die nächste Tramstation ist 3 min entfernt und der nächste Supermarkt ca 4. Auch ansonsten fehlt es hier an nichts, Kneipen, Cafes und co sind alle fußläufig zu erreichen.","Zusammen wohnen würdest du mit mir, Helena (sie/ihr). Ich bin im April hergezogen und werde im Herbst mit meinem Master anfangen (soweit zumidest der Plan bisher). Aktuell lasse ich mich einfach ein bisschen treiben und jobbe nebenher. Ich bin eineoffene Person und tagsüber gerne viel unterwegs. Ich gehe gerne in Museen, auf Flohmärkte oder ins Kino. Abends bin auch gerne mal für ein Bier oder Wein. Was Sport betrifft gehe ich gerne schwimmen oder tanzen und wenn ich mal länger Zeit habe mache ich auch gerne Radtouren oder gehe wandern. Die letzten Monate war es hier recht still, da meine Mitbewohner*in schon viel in Berlin ist. Ich freue ich also schon wenn wieder ein wenig Trubel in die Wohnung kommt. Ich habe schon in verschiedenen WG-Kombis gelebt und bisher hat das immer super geklappt. Mir ist es wichtig, nicht in einer Zweck-WG zu leben. Natürlich kann sich jede*r auch mal zurückziehen und die Tür zumachen, aber ich würde mich über einen freundschaftlichen Umgang und gemeinsame Aktiviäten in der WG freuen, egal obs dabei zusammen in den Park, auf Konzerte, eine Demo oder einfach nur in den Garten geht.  Ansonsten bin ich nicht super penibel, aber eine gewisse Grundsauberkeit ist mir im Laufe meiner verschiedenen WG-Leben doch wichtig geworden. Aber grundsätzlich gilt die Regel, einfach immer über alles reden und dann lotet man das schon aus."," Das Zimmer wäre ab Mitte Juli oder Anfang August frei, wie es für dich besser passt. Alles weitere besprechen wir vielleicht einfach bei einer Limo oder einem Kaffe, aber falls du noch Fragen hast, natürlich immer her damit.  Ich freue mich von Dir zu hören :)",,0,Zweck-WG,https://www.wg-gesucht.de/wg-zimmer-in-Leipzig-Connewitz.10145413.html,2er WG,Connewitz,    12,350 ,https://www.wg-gesucht.de/wg-zimmer-in-Leipzig-Connewitz.10145413.html
