Street,Address,rent_cold,additional_cost,free_from,distance,gadgets,female_roommates,male_roommates,divers_roommates,room_description,location_description,flat_live,additional,smoker,accessible,kind_of_flat,Url,type,district,size,price,link
Neustädter Straße,04315 Leipzig Neustadt-Neuschönefeld,385,245,01.09.2023,3,"Waschmaschine,Spülmaschine",,,," Hallo liebe Interessenten,  wir begeben uns ab Ende des Jahres auf eine längere Reise und wollen dafür gerne unsere Wohnung möbliert untervermieten.  Zeitraum:  01.September 2023 - max. 15.07.2024  Wohnung  Die Wohnung ist eine 70 m² große Eckwohnung und ist im Erdgeschoss gelegen. Sie bietet mit zwei Zimmern, einem großen Bad mit Wanne und eine großen Küche viel  Platz.   Beide Zimmer sind als eigenständig bewohnbare Zimmer konzipiert und verfügen über ein Bett, einen Schreibtisch und einen Kleiderschrank.  Trotz dieser Aufteilung, kann man das eine Zimmer wunderbar als Wohnzimmer nutzen.  Die Küche verfügt über alles was es zum Kochen braucht.   - Ofen mit Herd  - Kühlschrank  - Mikrowelle  - diverse Küchengeräte  - Teller & Besteck  Das Badezimmer mit Tageslicht verfügt über  - Badewanne  - WC  - Waschmaschine  - Spiegel  - Föhn  Welche Benefits werden noch geboten?  - W-Lan  ______________________________________________________________  Hello dear interested people,  We are going on a long trip at the end of the year and would like to sublet our flat furnished.  Period:  01.September 2023 - max. 15.07.2024  Flat  The apartment is a 70 m² corner flat on the ground floor. It offers two rooms, a big bathroom with tub and a big kitchen.  space.   Both rooms are designed as independently habitable rooms and have a bed, a desk and a wardrobe.  Despite this layout, one room can be used wonderfully as a living room.  The kitchen has everything you need for cooking.   - Oven with cooker  - a fridge  - microwave oven  - various kitchen utensils  - plates & cutlery  The bathroom with daylight has  - bath tub  - WC  - washing machine  - mirror  - hairdryer  What other benefits are offered?  - W-Lan"," Die Wohnung befindet sich am Rand des Stadtteils Neustadt-Neuschönefeld. In einem Stadtteil, welches nicht nur durch seine Nähe zum Stadtzentrum besticht,  sondern auch durch zahlreiche Restaurants, Bars, Imbisse und Spätis.  Die Wohnung befindet sich in einer ruhigen, mit Bäumen gesäumten Seitenstraße mit kurzen Wegen zu Supermärkten, Tram undBussen sowie zur Innenstadt.  Zu Fuß sind es  - zur Tram Richtung Innenstadt 250m (3min Gehminuten)  - zum nächsten Supermarkt 500m (6min Gehminuten)  - zum Hauptbahnhof 1,3km (20min Gehminuten)  - zur Innenstadt 1,6km (22min Gehminuten)  Zur Bundesstraße 2 sind es knapp 700m und man ist schnell Richtung Norden raus zur A2, zum Messegelände, BMW, Porsche und zum Flughafen Leipzig/Halle.  ______________________________________________________________  The flat is located in the Neustadt-Neuschönefeld district. This is a district that is not only close to the city centre,  but also because of its numerous restaurants, bars, snack bars and Spätis.  The flat is located in a quiet, tree-lined side street with short distances to supermarkets, trams and buses as well as to the city centre.  On foot it is  - to the tram towards the city centre 250m (3min walk)  - to the nearest supermarket 500m (6min walk)  - to the main station 1,3km (20min walk)  - to the city centre 1,6km (22min walk)  To the federal highway 2 it is just 700m and one is fast north out to the A2, to the fairground, BMW, Porsche and to the airport Leipzig/Halle.",," Miete  - Kaltmiete 385€  - Nebenkostenvorauszahlung 245€  - Strom: 75€  - Internet 50€  - Kaution 1.500€  Welche Unterlagen werden benötigt?  - Kopie vom Ausweis  - Gehaltsnachweise der letzten drei Monate  - Nachweis einer Haftpflichtversicherung  Gerne können wir die Wohnung auch per Videotelefonat vorzeigen. Dann können wir uns auch schon vorab ein wenig kennenlernen. :)  (Wir vermieten nur die gesamte Wohnung. Keine einzelnen Zimmer.)  ______________________________________________________________  Rent per month  - rent 385€  - Advance payment for utility costs 245€  - electricity: 75€  - Internet 50€  - Deposit 1.500€  Which documents are required?  - Copy of identity card  - Proof of salary for the last three months  - Proof of liability insurance  We are also happy to show you the flat by video phone call. Then we can also get to know each other a little in advance. :)  (We only rent the whole flat, not individual rooms).",,0,,https://www.wg-gesucht.de/wohnungen-in-Leipzig-Neustadt-Neuschoenefeld.10073611.html,2-Zimmer-Wohnung  ,Neustadt-Neuschönefeld,    70,755 ,https://www.wg-gesucht.de/wohnungen-in-Leipzig-Neustadt-Neuschoenefeld.10073611.html
Jonasstraße 6,04315 Leipzig Neustadt-Neuschönefeld,210,35,01.06.2023,2,"Waschmaschine,Spülmaschine,Balkon,Keller,Fahrradkeller",1,2,0," Das Zimmer liegt am Anfang der Wohnung, ideal geeignet für Minimalisten ;) Es ist etwa 11 m² groß und geht zu einer ruhigen Nebenstraße raus.   Die Wohnung befindet sich in einem Gründerzeithaus und ist eine klassische Altbauwohnung. Sie befindet sich in der 3. Etage in einem Altbau ohne Fahrstuhl. Du solltest also einigermaßen fit sein! Zur Wohnung gehört ein Kellerabteil und im Innenhof können Fahrräder abgestellt werden. Auf dem Dachboden kann man Wäsche trocknen. Um das Haus herum gibt es einige Parkmöglichkeiten. In der Wohnung haben wir 1 Bad, 1 Abstellraum und 5 Zimmer sowie die Küche (großes Plus: die Spülmaschine) mit Balkonzugang."," Das Mehrfamilienhaus liegt direkt im Szene-Kiez Zentrum Ost. Die Eisenbahnstraße beginnt direkt um die Ecke. Es gibt viele kleine Bars und Restaurants welche internationale Gerichte für jeden Gaumen anbieten.  Die Wohnung liegt sehr zentral im Leipziger Osten, in einer Nebenstraße der Eisenbahnstraße. Der Hauptbahnhof ist in 10 Minuten fußläufig zu erreichen. Die nächste Haltestelle von Bus und Bahn ist etwa 2 Gehminuten entfernt. Zum Augustusplatz und dem Unicampus sind es mit dem Fahrrad ca. 10-12 Minuten. Im direkten Umfeld der Wohnung gibt es mehrere Supermärkte. Zum Stadtteilpark Rabet und Elsapark sind es nur 5 Minuten zu Fuß und die Eisenbahnstraße, wie schon erwähnt, mit Gastronomie und Läden ist direkt um die Ecke. Kurz: Top Lage!","***Please be aware that we are only looking for people who are speaking fluently German since not all people in the shared apartmentfeel comfortable speaking English. We want everyone to be able to communicate with each other. Thank you for your understanding.***  Deine Mitbewohner wären:  Sören arbeitet als Sozialarbeiter. Er ist ein lustiger, sehr entspannter Mitbewohner - immer offen für interessante Gespräche oder ein Bier.  Tim studiert Kunstgeschichte, liest und kocht gern. Letzteres sogar richtig gut! Er arbeitet am Wochenende. Zu Käse oder einem Gläschen Wein kann er nicht nein sagen. Zudem hat er eine Schwäche für Faultier, und kann zu einem Plausch nicht nein sagen.  Linda arbeitet im Homeoffice und schreibt Masterarbeit. Sie ist praktisch nie ohne Kaffeetasse anzutreffen und buddelt gerne in Pflanzenerde. Auch mit ihr kann man jederzeit gerne über Gott und die Welt reden.  Im Alltag gehen wir tagsüber alle unser Arbeit bzw. Studium nach. Abends wird sich gerne in der Küche getroffen zum Quatschen oder Kochen oder auf ein Bier/Getränk."," Da es bisher bei uns sehr harmonisch zugeht und wir gerne möchten, dass das so bleibt, suchen wir jemanden, der gut bei uns reinpasst und wo es vor allem menschlich stimmt. Alter, Geschlecht, Religion usw. spielen dabei für uns überhaupt keine Rolle.  Alles Weitere kann gerne erfragt werden, am besten direkt bei einem persönlichem Kennenlernen. Wenn du denkst, du passt zu uns, dann melde dich gerne einfach.  ***Da wir zu unterschiedlichen Zeiten arbeiten und auch mal unterwegs sind können Kennlerngespräche meist nur zwischen Montag und Donnerstag ab 18.15 Uhr, ggf auch Sonntagvormittag,  stattfinden.***",1.0,0,"keine Zweck-WG, gemischte WG",https://www.wg-gesucht.de/wg-zimmer-in-Leipzig-Neustadt-Neuschoenefeld.9014178.html,4er WG,Neustadt-Neuschönefeld,    11,245 ,https://www.wg-gesucht.de/wg-zimmer-in-Leipzig-Neustadt-Neuschoenefeld.9014178.html
Bernhardstraße 46,04315 Leipzig Volkmarsdorf,400,50,01.06.2023,,"Waschmaschine,Spülmaschine,Balkon,Garten,Keller",0,1,1," Das Zimmer ist mit 16.1 m² das größte der WG. Da die Wohnung in einer ruhigen Seitenstraße liegt, ist der Straßenlärm auch dementsprechend kaum vernehmlich. Trotz der Lage im Erdgeschoss erhellen zwei große Fenster den Raum."," Zu Fuß erreicht man innerhalb von 5 Minuten die Straßenbahnlinie 7. Mit ihr kommt man nur in 4 Haltestellen ins Stadtzentrum/zum Augustusplatz. Zusätzlich erreicht man die Straßenbahnlinie 4 und die Buslinien 70 und 72 in 10 Minuten. Außerdem beträgt der Laufweg zum Kaufland nur 10 Minuten. Des weiteren sind ein Netto und ein Konsum ganz in der nähe. Reudnitz bietet auch viele kleine, gemütliche Cafes an, wo man Freund*innen treffen kann oder sich zum lernen zurückziehen kann.Auch die Eisenbahnstraße ist nicht allzu weit entfernt. Dort gibt es viele internationale Restaurants, durch die man sich durchprobieren kann.","Derzeitwohnen hier Luca (19), Ole (20) und Lily (20). Ich bin Lily, und will bald mit meinem Freund zusammenziehen, weshalb ich eine*n Nachmieter*in für mein Zimmer suche. Luca und Ole sind beide Sehr aufgeschlossen und suchen nach jemanden, der ähnlich tolerant ist wie die beiden. Rassismus, Homophobie und jegliche andere Form der Diskriminierung finden wir gar nicht wünschenswert. Zudem lebt Luca vegan und Ole ist Vegetarier."," Der Vermieter ist gesetzlich dazu in der Lage den Mietpreis für eine*n Nachmieter*in zu erhöhen. Mir wurden jedoch keine genauen Angaben zum neuen Mietpreises gegeben. Ich schätze der neue Preis wird ca. bei 450€ liegen.  Wenn du also denkst die Wohnung passt zu dir, dann melde dich bei mir. Gerne können wir auch einen Termin für eine Wohnungsbesichtigung vereinbaren.  Bis dann,  Lily :))",1.0,0,"Studenten-WG, keine Zweck-WG, gemischte WG",https://www.wg-gesucht.de/wg-zimmer-in-Leipzig-Volkmarsdorf.10075274.html,3er WG,Volkmarsdorf,    16,450 ,https://www.wg-gesucht.de/wg-zimmer-in-Leipzig-Volkmarsdorf.10075274.html
Merseburgerstr. 124,04177 Leipzig Altlindenau,230,70,01.07.2023,3,,1,3,0," Das Zimmer ist 13,5 m² groß und in den Hinterhof ausgerichtet. Daher hat man hier mehr oder weniger seine Ruhe :) Schaus dir doch einfach auf den Bildern an  :) Es hat nur ein Fenster und die Sonne scheint nur morgens rein aber man ist recht weit vom Wohnzimmer entfernt.  Das Wohnzimmer bietet btw. einen tollen Ausgleich mit Sofas, Sonne und mehr Platz.  Das Zimmer wird sehr wahrscheinlich leer übergeben werden. Der hohe Schrank kann drinbleiben wenn ihr wollt."," Unsere WG liegt tief im Westen , nahe am Stadtteilzentrum an der Georg Schwarz Straße oder am Lindenauer Markt. Lidl ist direkt vor der Tür und die nächste Straßenbahnhaltestelle mit Verbindungen zur Innenstadt ist etwa 5 min zu Fuß entfernt. Auch Lindenau und Plagwitz sowie die Karl-Heine-Straße ist nicht weit von uns (circa 10 Minuten zu Fuß), dort gibt es Kinos, Restaurants, weitere Bioläden, Kunstgalerien usw.  Mit dem Radl in die Innenstadt dauert es circa 20 Minuten einplanen, mit der Tram zum Hauptbahnhof sind es 15 Minuten. Von hier joggt man ungefähr  5 min bis man im nahegelegenen Wald ist.","Wir sind eine sehr familiäre WG, haben ein sehr gemeinschaftliches WG Leben und freuen uns wenn du auch Lust hast daran teilzuhaben. Wir verbringen viel Zeit in unserem gemütlichen Wohnzimmer, kochen mal gemeinsam oder machen einen Filmabend auf unserer Leinwand. Die WG ist insgesamt sehr (sportlich) aktiv und hat insgesamt einen extrovertierten Charakter, geht gerne auf Events und schmeißt 1-2 mal im Jahr eine große Party. Falls du sehr ruhebdürftig bist, wäre es vermutlich nicht ganz das Richtige. Ansonsten ist auch das Wort ""Putzen"" für uns kein Fremdwort ...:P Das schöne an der WG für mich war, dass Konflikte schnell und fair angesprochen wurden und werden konnten. So hat das harmonische WG Leben bisher sehr erfolgreich stattgefunden.  Kurz ein zwei Worte zu deinen zukünftigen mitbewohnies:  Eva (28): Eva ist wirklich unverschämt oft gut drauf und macht dir gerne deinen Kaffee um dich vom Lernen, Arbeiten oder was auch immer abzulenken. Wenn sie nicht Kaffee macht studiert sie vielleicht doch mal Bio oder Sport auf Lehramt.  Fabio (27): Auch genannt Frau Krause, ist der größte Schlingel der WG. Dieser Knilch treibt sich sehr viel am Meer herum, Kitet und Surft leidenschaftlich und ist im Winter meistens in den Bergen anzutreffen. Wenn er doch mal da ist ist er der Perfekte Mitbewohner.  Luca (30): Ist so etwas wie ein kletter Nerd. Dieser gute Mann ist in seinem Spowi Master und wird, irgendwann mal anfangen, seine Masterarbeit zu schreiben ;) Er hat eigentlich immer Lust auf tolle WG aktivitäten und überredet dich auch gerne mal auf ein paar Bier und einen guten Schnack.  Luki (24): Ist meistens mit etwas zu viel Energie und guter Laune morgens in der Küche anzutreffen und überredet dich zu einem Brunch der sich über den ganzen Vormittag zieht. Ansonsten macht er allen möglichen Sport und ist Brettspielefanatiker.  Wir sind eine sehr bunte Truppe und freuen uns auch über neuen Input, ein intensives WG Leben und viele gemeinsame Aktivitäten aller Art.  Schreib uns doch ein paar Zeilen über dich und was dich so begeistert ;) !  Wir freuen uns auf dich!  MerseWG", Bitte schreib mir doch einfach auf WhatsApp unter (siehe unten) 😊,1.0,0,"keine Zweck-WG, gemischte WG",https://www.wg-gesucht.de/wg-zimmer-in-Leipzig-Altlindenau.10072862.html,5er WG,Altlindenau,    13,300 ,https://www.wg-gesucht.de/wg-zimmer-in-Leipzig-Altlindenau.10072862.html
Richterstraße 4,04105 Leipzig Zentrum-Nord,250,45,15.06.2023,3,"Waschmaschine,Spülmaschine,Balkon,Garten,Gartenmitbenutzung,Keller",0,0,0," Hallo liebe Menschen,  in unserem Hausprojekt, welches sich gerade in der immer konkreteren Entstehungsphase befindet, wird ein Zimmer in unserer großen schönen Wohnung frei! Es geht nach hinten zum Garten raus, ein toller Blick ins Grüne, viele viele Vögel und ab & zu wildes Kindergetümmel. Ansich aber super idyllisch!  Es gibt 5 Mitbewohner*innen und eine im regen Austausch befindliche Hausgemeinschaft mit einem großen Garten zur Gartenarbeit und Entspannung.  Unsere WG heizt mit Kohlen und Holz.   das Zimmer ist dann natürlich ausgeräumt."," Das Haus liegt in Zentrum Nord, 15min zu Fuß vom Stadtzentrum und 3 Min zu einer der beiden nahegelegenen Tram-Stationen.  Der Hauptbahnhof ist ebenfalls zu fuß in 15min erreichbar.  Ein Konsum Supermarkt ist 1min zu Fuß erreichbar.  Ein Bio-Supermarkt ist ebenfalls 1min zu Fuß erreichbar.  Unser Stadtviertel besteht aus teils Villenbauten, teils 60er Jahre Neubauten und teils  Gründerzeit-Altbausubstanz. Es gibt wenig Ausgehmöglichkeiten, aber mit dem Fahrrad oder Tram  ist  man aufgrund der Nähe zur Innenstadt rasch in anderen Stadtvierteln.  Unser eigener Garten wird von unserem Verein immer wieder mal als Veranstaltungsort für Kunst- Kultur- und Bildungsangebote genutzt.","Wir haben einen Gemeinschafts-Kühlschrank sowie für jede*n auch eigene private Kühlschrankablagen und private Schrankbereiche für Essen. Vieles wird aber auch gemeinsam gekauft, und generell gibt es keine strikte Essenstrennung, das heißt, dass eine*r auch mal für alle kocht,  oder mensch sich nach freundlicher Absprache am leckeren Käse der anderen bedienen darf. Für den Kauf von Putzmitteln, allgemeinem Kochbedarf etc. legt jede*r 5 Eur im Monat in die WG Kasse.  Wir haben einen Putzplan und treffen uns monatlich einmal zum Plenum, wo wir über WG-interne, aber auch Haus-Themen reden und die Chance nutzen, einfach auch mal ganz bewusst zusammen zu sein.  es lebt schon jede*r so ihr*sein eigenes Leben, aber in der Küche finden wir uns auch immer wieder mal zusammen für einen Plausch oder Menschen kochen zusammen!  das Ganze erstreckt sich dann auch einfach aufs Haus, wo jede*r von uns noch so Connections hat!"," Hausprojekt  Je nachdem wie langfristig du planst, das Zimmer zu mieten (und wir sind gerade bevorzugt auf der Suche nach einem Menschen, der nicht nur paar Monate mit uns lebt), wäre es wichtig, dass Du Dich mehr oder weniger an den Prozessen im Hausprojekt beteiligen kannst. Das umfasst in der Regel Plenen oder AGs im Haus, manchmal auch gemeinsame Gartenarbeit oder kleine Reparaturen. Als Selbstverwalter sind wir für alles rund ums Haus selbst verantwortlich.  Wir haben auch einen Kunst- Kultur und Bildungsverein, den Goase e.V., der mehrfach im Jahr Veranstaltungen im Garten macht (www.goase-ev.de).  Bei INTERESSE - NACHFRAGEN.  Schreib uns gerne mit ein paar Infos, was du so machst, was dir wichtig ist, etc.  und gerne direkt bei WG Gesucht :))  Den weiteren Kontakt am liebsten dann bei einem persönlichen Treffen oder über einen Videochat,  wir freuen uns!",1.0,0,"Zweck-WG, Studenten-WG, keine Zweck-WG, gemischte WG, Internationals welcome",https://www.wg-gesucht.de/wg-zimmer-in-Leipzig-Zentrum-Nord.8442373.html,6er WG,Zentrum-Nord,    23,300 ,https://www.wg-gesucht.de/wg-zimmer-in-Leipzig-Zentrum-Nord.8442373.html
"Tarostraße 16, 3. Etage",04103 Leipzig Zentrum Südost,305,0,01.08.2023,2,,1,0,0," Lichtdurchflutetes, helles Zimmer mit Blick auf den ehemaligen Sportplatz und viele Bäume.Möbliert mit 1nem Tisch, 1nem Kleiderschrank, 1nem Bett, 1nem Rolltischchen und einem 1nem Regal.3. Etage, Fahrstuhl vorhanden.  Küche und Bad teilst du mit deiner Mitbewohnerin.Küche ausgestattet mit reichlich Platz in den Aushängeschränken zum Verstauen von Geschirr und Essen, einem Kühlschrank und einer Induktionsherdplatte mit 2 Kochfeldern.  Bad mit Dusche, WC, Waschbecken.  Alle Nebenkosten sind inklusive (Wasser, Strom, Heizung, WLAN: 600 GB/Monat) für monatlich 305€.  Für das WLAN musst du dir einen eigenen Router oder ein LAN-Kabel kaufen.  Die Wohnung wurde vor max. 3 Jahren frisch renoviert und mit hellen Möbeln sowie einem freundlichen, braunen Bodenbelag ausgestattet. Durch die Helligkeit und die Neuwertigkeit des Zimmers / der Wohnung fühlt man sich sehr wohl.  Im Studentenwohnheim enthalten: Fahrradkeller, Fahrstuhl, Briefkasten, Waschraum mit Nutzung von Waschmaschine und Tockner gegen Gebühr.Meine Mitbewohnerin möchte ihr Zimmer ab August 2023 abgeben. Da sie noch nicht genau weiß, zu welchem Datum sie ihre neue Wohnung beziehen kann, müssten wir das genaue Übernahmedatum dann gemeinsam besprechen. Dumusst als Studentin in Leipzig immatrikuliert sein, um den Wohnheimplatz übernehmen zu können."," 7 Minuten zu Fuß zur S-Bahn-Haltestelle MDR. Mit der S-Bahn zum HBF Leipzig in ca. 9 Minuten.  Haltestelle der TRAM 2 und 16 in 5 Minuten zu erreichen, mit der TRAM 8 Minuten Fahrt zur Uni Leipzig und 10 Minuten zum Hauptbahnhof. 5 Minuten mit dem Fahrrad zum Uniklinikum und 12 Minuten bis zum Markt.  Rewe in 2 Minuten fußläufig mit DPD-Packstation und einem Bäcker.","Ruhiges WG-Leben. Jeder lebt mehr oder weniger sein eigenes Leben. Für ein Gespräch ist aber immer Zeit. Absprachen (wie wann wer Bad und Küche nutzt), Sauberkeit und vor allem Rücksicht und Ruhe sind mir sehr wichtig. Bezüglich des Putzens haben wir es bisher so gehalten, dass man sich wöchentlich abwechselt, sodass jede Woche die Wohnung 1x geputzt wird. Ich bin Medizinstudentin im 8. Semester, 23 Jahre alt. In meiner Freizeit mache ich viel Sport und singe im Chor. Da ich für das Studium viel lernen muss und dementsprechend ein ruhiges Umfeld benötige, suche ich eine Mitbewohnerin, die das respektiert oder vielleicht auch viel Ruhe benötigt.",,0.0,0,Studenten-WG,https://www.wg-gesucht.de/wg-zimmer-in-Leipzig-Zentrum-Suedost.10072397.html,2er WG,ZentrumSüdost,    14,305 ,https://www.wg-gesucht.de/wg-zimmer-in-Leipzig-Zentrum-Suedost.10072397.html
