Street,Address,rent_cold,additional_cost,free_from,distance,gadgets,female_roommates,male_roommates,divers_roommates,room_description,location_description,flat_live,additional,smoker,accessible,kind_of_flat,Url,type,district,size,price,link
Tarostraße 16,04103 Leipzig Zentrum-Südost,340,0,01.08.2023,7,"Waschmaschine,Fahrradkeller,Aufzug",0,0,0," !Es ist wichtig, dass du an der Universität, HTWK oder sonstiger Studienstätte eingeschrieben bist. Dies ist ein Studentenwohnheim!  Ich suche dringend einen oder eine NachmieterIn ab August bis mind. 30.09.2023 (länger geht auch).Hierbei handelt es sich um eine WG Auflösung.Das Zimmer ist in einer 3er WG und 21 Quadratmeter groß. Das Studentenwohnheim wurde vor 3 Jahren komplett neu renoviert. Die Wohnung ist groß und hat zwei Bäder mit jeweils einer Dusche. Zudem besitzt die Wohnung einen sehr langen Flur und eine große Küche, in der man ohne Platzprobleme kochen kann. Der größte Vorteil ist der eigene Backofen, den man meist selten in Wohnheimen bekommt.  Das Zimmer ist bereits mit Kleiderschrank, großem Schreibtisch, Bett, Regal, Stuhl und Rollkontainer ausgestattet.ROOM  !It is important that you are enrolled at the university, HTWK or other place of study.  This is a student residence!I am looking for someone who can stay from August till at least 30.09.2023 (it is possible to stay longer)The room is in a 3-person flat share and is 21 square meters.  The student residence was completely renovated 3 years ago and you are the 3th person to move in.  The apartment is big and has two bathrooms each with a shower. Besides the apartment has a long hallway and a big kitchen where you can cook without space problems. The biggest advantage is our oven, which you rarely get in dormitories.  The room is already furnished with a wardrobe, large desk, bed, shelf, chair and desk closet."," Die Verkehranbindung könnte nicht besser sein. Du bist in 5 Minuten bei der Sbahn-Station MDR, wo auch der Bus 74 fährt. In 7 Minuten ist die Bahnhaltestelle Johannisalle entfernt, wo die 16, die 2 und der Bus 60 fährt. Außerdem hast du in 100m einen großen Rewe, der keine Wünsche offen lässt.  Hinter dem Wohnheim befindet sich ein Sportplatz sowie eine Schwimmhalle und es ist immer was los.  POSITIONThe transport links could not be better.  You are in 5 minutes at the Sbahn station MDR, where the bus 74 also goes.  The Johannisalle train station, where the 16, the 2 and the 60 bus runs, is 10 minutes away. In addition, you have a large Rewe in 100m, which leaves nothing to be desired.  There is a sports field and an indoor swimming pool behind the dormitory and there is always something going on.","Da 2 von uns ausziehen, bleibt Sebastián noch in der Wohnung bis Ende August und zieht selber dann aus. Ich, Sebastián, bin im Studienkolleg der Uni Leipzig, komme aus Mexiko und bin seit mehr als einem Jahr in Deutschland. Ich begeisterte mich für Musik und spiele Klavier. APARTMENT LIFETwo of us are moving out so Sebastián is the one who stays in the apartment till end of August and then he moves out too.I am Sebastián, I study in the Studienkolleg of Leipzig University, come from México and I live in Germany over a year now. I enjoy music and play the piano.",,0.0,0,"Studenten-WG, Wohnheim, Internationals welcome",https://www.wg-gesucht.de/wg-zimmer-in-Leipzig-Zentrum-Suedost.9362621.html,3er WG,Zentrum-Südost,    21,340 ,https://www.wg-gesucht.de/wg-zimmer-in-Leipzig-Zentrum-Suedost.9362621.html
Alfred-Kästner-Straße 86,04275 Leipzig Südvorstdadt,20,5,07.06.2023,,"Waschmaschine,Balkon,Garten,Aufzug",0,0,0," Preis pro Person! Bei der Wohnung handelt es sich um eine Monteursunterkunft mit 2 Zimmern, einer vollausgestatteten Küche, einem Bad mit Badewanne und Dusche sowie einem möblierten Balkon. Im ersten Zimmer stehen 3 Betten, Kleiderschränke, Nachttische sowie ein Esstisch mit drei Stühlen und Vorhängen. Im zweiten Zimmer stehen zwei Betten, zwei Nachttische, ein Kleiderschrank und ein Esstisch mit zwei Stühlen, sowie Vorhänge. Durch die Küche erhält man Zugang zu einem Balkon mit Sicht in den ruhigen Innenhof. Im Badezimmerbefindet sich eine Badewanne, eine Waschmaschine, ein Fenster sowie Waschbecken und WC."," Die Wohnung befindet sich Südlich vom Zentum Leipzigs. Bus- und Bahnhaltestellen sind nur 2 min fußläufig entfernt und es gibt viele EInkaufsmöglichkeiten in naher Umgebung. Auch Bars, Cafés und Restaurants finden Sie in der Nähe.",, Die Wohnung befindet sich im 1.Obergeschoss. Desweitern verfügt das Objekt über einen Fahrstuhl. Öffentliche Parkplätze finden Sie vor dem Haus.  In unserem Objekt ist das verwendne von Elektroheizkörpern verboten!,,0,,https://www.wg-gesucht.de/wohnungen-in-Leipzig-Suedvorstdadt.10110109.html,2-Zimmer-Wohnung  ,Südvorstdadt,    60,25 ,https://www.wg-gesucht.de/wohnungen-in-Leipzig-Suedvorstdadt.10110109.html
Kunzestraße 7,04249 Leipzig ,20,5,07.06.2023,,"Waschmaschine,Balkon,Garten,Gartenmitbenutzung",0,0,0," Preis pro Person! Bei der Wohnung handelt es sich um eine Monteursunterkunft mit insgesamt 7 Betten verteilt auf 3 Zimmer. Im ersten Zimmer (ca. 25 qm) befinden sich 2 Betten inkl. Nachttische sowie ein Esstisch mit 6 Stühlen. Durch dieses Zimmer erhält man außerdem Zugang zum Balkon. Im zweiten Zimmer befinden sich 2 Betten inkl. Nachttische und 2 Hängeschränke. Das Zimmer hat ca. 11 qm und ist abschließbar. Im dritten Zimmer befinden sich 3 Betten inkl. Nachttische und Hängeschränke sowie ein Mini-Kühlschrank. Das Zimmer ist ca. 15 qm groß und abschließbar.  Das Badezimmer besteht aus einer Badewannne sowie einerDusche, Waschmaschine, Waschbecken und WC und ist ebenfalls abschließbar.  Die Küche ist vollausgestattet und verfügt über einen Kühlschrank, Herd und Geschirr.", Die Wohnung befindet sich im Südwesten Leipzig. Die Stadtteile sind Groß- und Kleinzschocher. Die Wohnung befindet sich im Erdgeschoss und verfügt zusätzlich über einen Balkon. Einkaufsmöglichkeiten sind nur 2 min füßläufig entfernt und die nächste Bus-/Bahnhalstelle erreichen Sie in 1 min zu fuß.,," In der Unterkunft gibt es WLAN, sowie einen Tiefgaragenstellplatz gegen Gebühr. Öffentliche Parkplätze finden Sie vor dem Objekt. Desweitern finden Sie einen begrünten Innenhof am Objekt und in jedem Zimmer sind Rolladen verbaut.",,0,,https://www.wg-gesucht.de/wohnungen-in-Leipzig.10118008.html,3-Zimmer-Wohnung  ,,    70,25 ,https://www.wg-gesucht.de/wohnungen-in-Leipzig.10118008.html
Münzgasse 5,04107 Leipzig Zentrum-Süd,300,0,01.07.2023,2,,1,1,0," Die Möbel würde komplett im Zimmer bleiben. gerne kann ich auch Bettwäsche und Handtücher da lassen. Das Zimmer ist zum Innenhof ausgerichtet und ist deswegen ruhig gelegen, es scheint sehr schön die Sonne rein und ist hat mit einem Rolladen."," Die Wohnung ist parallel zur Kali gelegenDu bist deswegen perfekt angeschlossen. Zu Fuß brauchst du circa 10 Minuten in die Stadt und die Station Münzgasse ist 2 Minuten entfernt. Außerdem sind in unsrer Straße viele Cafés und Restaurants und natürlich hast auf auf derKarli besonders viel Auswahl. Fußläufig sind verschiedene Einkaufsmöglichkeiten zu erreichen, ob Konsum, Aldi oder Lidl.","Du würdest zusammen mit Jessi und Jonas wohnen. Beide studieren noch, wobei Jonas sich gerade in den Endzügen seiner Masterarbeit befindet und wenn er nicht an dieser schreibt, ist er leidenschaftlich mit seinem Rennrad unterwegs. Jessi studiert Medizin und ist wahrscheinlich zu dem Zeitpunkt Klausuren beschäftigt und hat dann Semesterferien. Wir verstehen uns untereinander super und sitzen gerne in der Küche zusammen oder schauen eine Runde Trash TV.",,,0,,https://www.wg-gesucht.de/wg-zimmer-in-Leipzig-Zentrum-Sued.10148570.html,3er WG,Zentrum-Süd,    13,300 ,https://www.wg-gesucht.de/wg-zimmer-in-Leipzig-Zentrum-Sued.10148570.html
Reudnitz,04317 Leipzig Reudnitz-Thonberg,195,160,15.06.2023,1,"Waschmaschine,Spülmaschine,Garten,Haustiereerlaubt",2,0,0," Heyhey,   wir sind Fine und Pauls und bei uns wird ab dem 15. Juni ein Zimmer frei! Pauls wohnt schon seit Februar 2022 in der Wohnung und Fine zieht erst Mitte Juni ein, es wird also eine ganz neue Konstellation in der du dich einbringen könntest.  Pauls ist von Anfang August bis Ende September in China für Feldforschung und für die Zeit wird vermutlich wer für Zwischenmiete einziehen.  Das freie Zimmer hat (wie die ganze Wohnung) einen schönen Dielenboden und Stuck an der Decke.  Wir haben ein kleines Wohnzimmer mit Schlafsofa, ein großes Badezimmer mit Wanne und ein separates Klo, dass aber hauptsächlich als Abstellraum genutzt wird.   Außerdem haben wir einen sonnigen Garten/Hinterhof der vom ganzen Haus gemeinschaftlich genutzt wird.  Oft kann eins draußen mit anderen Leuten aus dem Haus rauchen, brunchen oder auch coworken."," Die Wohnung liegt an der Ecke Riebeckstraße/Oststraße und ist prima an den ÖPNV angebunden.   Direkt vor der Tür halten die Busse 60 und 70 und die Bahnlinie 4. Aber auch mit dem Rad ist man innerhalb von kurzer Zeit an der Eisenbahnstraße oder der Uni.   Da liegt aber auch schon das Problem. Die Wohnung liegt mit der Hochpaterre direkt an der Straße, es kann zwar nicht reingeschaut werden, aber die Geräusche der Straße kriegt man leider trotzdem mit. Wenn das ein großes Problem für dich ist wird es vermutlich nicht funktionieren.   Die good news sind: eine Straße weiter liegt der Lene-Voigt-Park der sich zum Flanieren in der Sonne perfekt eignet und auch der Friedenspark ist nur ein Katzensprung weit weg!","Wir nehmen Rücksicht aufeinander – allgemein ist die Wohnung unser Rückzugsort, aber eben auch nicht einziger Lebensmittelpunkt. Wir wünschen uns ein emphatisches Miteinander und klare Kommunikation. Wir ernähren uns vegan und hatten bisher Kühlschrankkommunismus, was bedeutet, dass wir uns alles geteilt haben (mit Ausnahmen nach Absprache) und auch oft füreinander und miteinander gekocht haben. Wir würden uns freuen wenn das so bleiben würde. ____________________________  Zu uns: Ich bin Pauls (sie/keine), 25, vegan.  Ich studiere Biologie und bringe immer gerne kleine Schätze aus der Natur mit. Außerdem koche ich sehr gerne für oder mit meinen friends und vielleicht ja dann auch mit dir. Am liebsten sitze ich mit einem Buch und einer Tasse Tee in meinem Sessel oder fahre zum Muay-Thai Training in den Westen. Gerade verbringe ich viel Zeit mit meiner Bachelor-Arbeit, die aber bald fertig ist. Fine (sie/ihr) ist 26 und ernährt sich vegan.  Fine ist gerade am Ende ihrer Bachelorarbeit in Geographie angekommen und möchte eigentlich Sexualpädagogin werden. Sie bewirbt sich nun nochmal für Studiengänge in Merseburg und wenn das nicht klappt findet sie einen anderen Weg. Mit ein paar anderen Menschen baut sie gerade ein Unternehmen auf, welches Events für Erwachsene im Bereich der sexuellen Bildung anbieten möchte. Fine häkelt sehr viel und ist auch sonst viel am rumbasteln. Anonsten verbringt sie sehr gerne Zeit mit Friends, am liebsten in der Sonne, kennt in Leipzig bisher aber noch nicht viele Menschen und freut sich auf viele Begegnungen.  ____________________________  Wir würden uns freuen sweete Menschen zu finden, mit denen das Wohnen richtig schön wird."," Bis jetzt waren wir eine hauptsächlich queere FLINTA* WG und würden gerne auch queer bleiben. Ich weiß allerdings auch, dass der FLINTA* Begriff sehr exklusiv sein kann, daher schreib auch gerne wenn du queer bist, dich aber nicht im FLINTA* Begriff gesehen fühlst. Ich wünsche mir einfach ein soldarisches Miteinander in der wir nicht über die Verteilung von Care-Arbeit streiten müssen.  Einen festen Putzplan haben wir nicht, da wir dem ganzen Bedürfnisorientiert begegnet sind. Es gibt einen Plan auf dem markiert wird, was gemacht werden muss und ein Mensch mit genug Kappas macht es dann. Der Plan ist aber nicht in Stein gemeißelt, falls du andere Ideen hast.  In den 355,-€ Miete ist alles inklusive (von Internet über GEZ...)  Die Wohnung ist teilsanierter Altbau und Vonovia Vermietung, was das ein oder andere in Warteschleifen abhängen bedeuten kann.",1.0,0,"Studenten-WG, keine Zweck-WG, Vegetarisch/Vegan, Internationals welcome, inklusive WG",https://www.wg-gesucht.de/wg-zimmer-in-Leipzig-Reudnitz-Thonberg.8873244.html,3er WG,Reudnitz-Thonberg,    18,355 ,https://www.wg-gesucht.de/wg-zimmer-in-Leipzig-Reudnitz-Thonberg.8873244.html
Ranstädter Steinweg 15,04109 Leipzig Zentrum-West,280,30,28.08.2023,3,"Waschmaschine,Fahrradkeller",0,0,0," Schönes Zimmer mit 2 großen Fenstern und Blick auf Bäume. Möbel vorhanden: Bett, schriebtisch, Kleiderschrank, Regal. Bei Fragen schrieb mir gerne einfach eine kurze Nachricht"," An der Straße gegenüber ist die Haltestelle Leibnizstr sowie ein netto zum Einkaufen. In die Stadt läufst du 5 Minuten.Da die Fenster nach hinten gerichtet sind, ist es nicht laut","Ich reise ende August nach Asien und suche daher jemand Vertrauenswürdigen, der mein tolles Zimmer wertschätzt. + Meine Nachbarn sind sehr nett. Dein Mitbewohner heißt Moritz, ein sehr ruhiger und freundlicher Skater 26",,,0,"gemischte WG, Internationals welcome",https://www.wg-gesucht.de/wg-zimmer-in-Leipzig-Zentrum-West.10148163.html,2er WG,Zentrum-West,    17,340 ,https://www.wg-gesucht.de/wg-zimmer-in-Leipzig-Zentrum-West.10148163.html
Emmausstraße,04318 Leipzig Sellerhausen-Stünz,250,97,01.07.2023,1,"Waschmaschine,Spülmaschine,Balkon,Gartenmitbenutzung,Keller,Fahrradkeller",1,0,0," Die Wohnung liegt im obersten Geschoss eines Altbaus, ein Boden befindet sich noch dadrüber, also keine Schrägen in der Wohnung und keine Nachbarn drüber. Das Zimmer zeigt in den ruhigen, abgeschlossenen Hinterhof richtung Osten und hat ein Fenster zum Balkon mit Blick ins Grün. Von der Wohnküche inkl. gemütlicher Küchenbank und Esstisch kommt man auf den großen, überdachten Balkon, ebenfalls auf der Hofseite. Der geräumige Flur hat eine sehr große Kleiderstange / Garderobe und auch ansonsten viel Stauraum, den wir uns aufteilen würden. Außerdem gibt es noch eine kleine Abstellkammer, in der die Waschmaschine steht."," In Sellerhausen direkt an der Emmauskirche. Tramlinien 7 und 8 fahren 1 Minute von der Haustür entfernt in 15 Minuten zum Hauptbahnhof. Der Bahnhof Sellerhausen ist 5 Minuten zu Fuß entfernt. Mit dem Rad ist man in 5 Minuten auf der Eisenbahnstraße und im schönen, ruhigen Stünzer Park.","Ich befinde mich gerade im Bewerbungsprozess und weiß daher nicht, wie lange ich noch in Leipzig sein werde. Falls ich in den nächsten Monaten in eine andere Stadt ziehen sollte, besteht evtl. die Möglichkeit der Übernahme der Wohnung, vielleicht würde ich aber auch erstmal mein Zimmer 3 Monate zwischenvermieten, um mir die Option auf Zurückkommen offenzuhalten. Steht allesnoch ein bisschen in den Sternen. :D Ansonsten bin ich jetzt im Sommer wahrscheinlich auch relativ viel unterwegs. Trotzdem wünsche ich mir eine Person, mit der ich mich gemeinsam zu Hause fühlen und ein schönes Miteinander haben kann. Ich mache ziemlich selten Party zu Hause, sondern lieber chillige Koch- oder Spieleabende und sehe die Wohnung sonst eher als Rückzugsort. Ich ernähre mich vegan und koche sehr gerne, geh gern Klettern und Wandern oder mach Kreatives zu Hause. Ich bin Raucherin (mit Hoffnung auf Aufhören) und rauche im Sommer bei offenen Fenstern relativ frei überall, wenn's kälter wird nur in der Küche und auf dem Balkon. Ich bin keine Putzteufelin, aber eine Grundsauberkeit in Küche und Bad sind mir wichtig. Wenn ich unterwegs bin, kannst Du gerne mein Zimmer als Wohnzimmer oder für Gäste mitbenutzen."," Wenn Du eine sehr große Monstera im Zimmer haben möchtest, kannst du sie gerne übernehmen. Sonst müssten wir noch einen anderen Platz für sie finden oder zur Adoption freigeben. Ich könnte auch einen kleinen Schreibtisch und Matratze für's Zimmer zur Verfügung stellen, wenn Du selber keine Möbel hast.  Schreib mir gern ein paar Zeilen über Dich, wenn Du Interesse hast. Ich melde mich dann schnellstmöglich zurück!",1.0,0,gemischte WG,https://www.wg-gesucht.de/wg-zimmer-in-Leipzig-Sellerhausen-Stuenz.9397776.html,2er WG,Sellerhausen-Stünz,    12,347 ,https://www.wg-gesucht.de/wg-zimmer-in-Leipzig-Sellerhausen-Stuenz.9397776.html
Büttnerstr. 22,04103 Leipzig Zentrum-Ost,250,139,01.07.2023,,,1,2,0," Das Zimmer ist zur Südseite zugewandt und hat hohe Decken. Durch drei Fenster kommt viel Licht ins Zimmer und es ist allgemein sehr hell. Außerdem ist das Zimmer zum Innenhof gerichtet, sodass kein Straßenlärm zu hören ist. Vielmehr ist es super ruhig und kann daher perfekt zum Arbeiten, Lernen und Wohlfühlen genutzt werden. Kabelanschluss ist im Zimmer vorhanden. Es können zwei Deckenlampen angebracht werden. Das Zimmer wird unmöbliert übergeben, bei Bedarf kannst du die Gardinenstange übernehmen.  In der Küche ist alles Mögliche vorhanden, was man zum Kochen braucht (Töpfe, Pfannen, Geschirr, ...). Wenn du aber noch etwas mitbringst, ist dafür auch noch Platz. Wir haben zwar keinen Balkon, aber über ein Küchenfenster gelangt man auf die Feuertreppe. Und weil die Sonne dort den ganzen Tag scheint, kann man dort besonders im Sommer gemütlich einen Kaffee trinken und die Sonne genießen."," Die Wohnung liegt hinter dem Wintergartenhochhaus und somit in zentraler Lage. Augustusplatz, sowie der Hauptbahnhof sind innerhalb 10 Minuten zu Fuß erreichbar. Sollten es doch mal die ÖPVM werden, erreicht man auch in 3 Minuten die Haltestelle Hofmeisterstraße. Trotz der hervorragenden Lage ist die Wohnung sehr ruhig, da sie sich in einer Nebenstraße befindet. Einkaufsmöglichkeiten gibt es viele und sind in ein paar Minuten erreichbar (HBF, Rewe, Edeka, Netto, ...)","Zu Zeit sind bei uns zwei Zimmer frei, es gibt also Veränderung. Bisher was das WG-Leben aber sehr entspanntund zwanglos, aber auf keinen Fall eine Zweck-WG. Unter der Woche ist das WG-Leben eher ruhig, da alle durch Studium und Arbeit viel zu tun haben. Doch Abends trifft man sich in der Küche, spricht über den Tag oder sämtlichen Blödsinn. Deine zukünftigen Mitbewohner sind:  Manuel (27) macht gerade eine Ausbildung zum Ergotherapeuten. Er kocht sehr gerne und viel, macht ausgiebige Spaziergänge, geht und hat die besten Tipps, wenn es um Cafés geht. Theresa (31) hat Anglistik studiert und arbeitet als Key-Account-Managerin bei einem Online-Handel. Sie lebt und atmet Bücher und Storytelling. Bei ihr wird mehrmals in der Woche Dungeons und Dragons gezockt oder auch gerne an ihrem neuen Gaming PC was digital gespielt. Björn (30) macht seinen Master als Wirtschaftsingenieur und arbeitet nebenbei bei der DB als Werkstudent. Er ist eine Maschine im Fitti und verbringt das ganze Wochenende mit feiern, katern und Konsole zocken."," Die WG befindet sich im 2. OG und es gibt einen Aufzug. Es gibt einen Fahrradkeller und die Möglichkeit, einen Parkplatz anzumieten. Waschmaschine und Trockner gibt es im Keller.   Einzugsdatum ist ab dem 01. Juli, wenn du aber etwas früher oder später einziehen möchtest, dann können wir bestimmt eine Lösung finden. Wenn du dir also vorstellen kannst Teil der WG zu werden, schreib uns einen kleinen Text über dich.  Wir freuen uns von dir zu hören! :)",1.0,0,"Studenten-WG, keine Zweck-WG",https://www.wg-gesucht.de/wg-zimmer-in-Leipzig-Zentrum-Ost.10134933.html,5er WG,Zentrum-Ost,    21,389 ,https://www.wg-gesucht.de/wg-zimmer-in-Leipzig-Zentrum-Ost.10134933.html
Büttnerstraße 22,04103 Leipzig Zentrum-Ost,260,144,07.06.2023,2,"Waschmaschine,Fahrradkeller,Aufzug",1,2,0," Das Zimmer ist geräumig, gut geschnitten und ist mit zwei großen Fenstern ausgestattet. Es handelt sich um einen Altbau mit hohen Decken. Die Fenster machen das Zimmer schön hell und sind Richtung Westen gelegen. Vor dem Zimmer befindet sich eine wenig befahrene Straße, wobei die Gegend sowieso sehr ruhig ist.  Wir haben einen großen Flur im welchen wir allgemeine Dinge wie Putzzeug und Ausstattung für die WG lagern, aber auch Platz für ein paar persönliche Gegenstände und Gaderobe bietet.  Die typische WG Küche hat eigentlich alles was man zum Kochen benötigt und ist zentraler Meetingpoint der WG mit gemeinsamen Esstisch und einer Couch. Wir haben zwar keinen Balkon, aber zur Küche raus ist eine Feuertreppe, auf der man gemütlich Kaffee trinken und die Sonne genießen kann.   Wir haben ein zwei-geteiltes Bad wodurch es selten zu Stau für eine 5er WG kommt."," Unsere WG befindet sich sehr zentral, tatsächlich nur 4 Gehminuten vom Hauptbahnhof entfernt. Innerhalb von 2 Minuten befindet sich die nächste Tram-Haltestelle, mit der Du in 3 unterschiedliche Linien steigen kannst. Um unsere Straße herum befindet sich außerdem ein Bäcker, Döner, Ramen-Restaurants, sogar eine kleine Kantine und viele Essenmöglichkeiten mehr. Zur Uni (Hauptcampus) mit Mensa am Augustusplatz sind es etwa 10 Gehminuten.","Das WG-Leben ist eher entspannt gehalten, da durch Arbeit, Ausbildung und Studium der Tag oft gefüllt ist. Allerdings trifft man sich abends gerne in der Küche und quatscht über den Alltag und isstgemeinsam. Wenn es etwas zu besprechen gibt ruft man ein WG-Plenum zusammen und kocht bei der Gelegenheit auch was zusammen.  Hier ein grober Überblick der neuen potenziellen Mitbewohner:innen:  Manuel (27) macht gerade eine Ausbildung zum Ergotherapeuten. Er kocht sehr gerne, ist Experte wenn es um ausgibige Spaziergänge mit anschließender Cafe-einkehr geht und genießt generell gerne entspannte Aktivitäten.  Theresa (31) hat Anglistik studiert und arbeitet als Account Managerin bei einem Online-Handel. Sie lebt und atmet Bücher, Storytelling und vieles mehr. Bei ihr wird mehrmals die Woche Dungeons and Dragons gezockt oder auch gerne an ihrem neuen Gaming PC was Digital gespielt.  Björn (30) macht seinen Master als Wirtschaftsingenieur und arbeitet nebenbei noch bei der Deutschen Bahn als Werki. Er ist eine Maschine im Fitti und beim Party machen. Den Rest der Woche wird beim Katern und Konsolen zocken verbracht."," Die WG befindet sich im 2. Stock und wir haben einen Aufzug. Es gibt auch einen Fahrradkeller und die Möglichkeit einen Parkplatz anzumieten.  Wir suchen ab den 1. Juni wenn du aber etwas früher oder später rein möchtest, dann können wir das bestimmt regeln :)  Wenn du Bock hast einzuziehen, dann schreib mir einfach hier eine Nachricht und ich melde mich dann bei Dir!   Wir freuen uns schon von Dir zu hören! :)",1.0,0,"Studenten-WG, keine Zweck-WG, gemischte WG",https://www.wg-gesucht.de/wg-zimmer-in-Leipzig-Zentrum-Ost.10029583.html,5er WG,Zentrum-Ost,    22,404 ,https://www.wg-gesucht.de/wg-zimmer-in-Leipzig-Zentrum-Ost.10029583.html
