Street,Address,rent_cold,additional_cost,free_from,distance,gadgets,female_roommates,male_roommates,divers_roommates,room_description,location_description,flat_live,additional,smoker,accessible,kind_of_flat,Url,type,district,size,price,link
Leplaystraße 3,04103 Leipzig Zentrum-Südost,262,0,01.08.2023,3,"Waschmaschine,Spülmaschine,Keller",1,1,1," Das unmöblierte Zimmer hat 4 weiße Wände, Fußboden, Decke, großes Fenster und Tür. 4,14 m x 3,60 m und 3 m hohe Decke laden dich zum Dekorieren ein. Die Fotos sind aktuell und stellen eine mögliche Lebensform da. 262 € all inclusive.  (Miete, Internet, Strom, GEZ, Mieterschutzbund usw.) Für viele gemeinsame Verbrauchssachen wie Salz, Klopapier usw. haben wir ein ausgeklügeltes Einkaufs- und Abrechnungssystem (EAS) entwickelt. 75 € berechnet unser Vermieter für deinen Einzug."," Kurz und knapp ==> Top Lage.  Du kannst in dieser Stadt kaum zentraler wohnen.  7 Minuten für Mensaspaziergänge, 3 Minuten um in die 2, 9 oder 16 zu hüpfen  oder in 5 Minuten vom Wilhelm Leuschner Platz in jede Richtung zu kommen.  Edeka, Aldi und die Stadtbibliothek sind wenige 100 Meter entfernt.  Die Fahrradselbsthilfewerkstatt vom Studentenwerk ist genau 1 Minute entfernt.   Den Döner gibts im Haus mit dazu, der ist aber nicht gut, für was Besseres kann man sich aber einfach 5 min zur Windmühlenstraße bewegen. Noch besser ist aber Pizza für 7 Euro direkt um die Ecke, die Jungs kennen uns schon, man wird herzlich empfangen und die Mütter werden gegrüßt.   Da wir im Hinterhaus wohnen, bekommen wir aber vom Verkehrslärm sehr wenig ab.","Hello Liebe(r) zukünftige(r) Mitbewohner,  wenn du eine herzliche WG suchst, deren Mitbewohner*innen es wichtiger ist, deine Lieblingsserie zu kennen, als einen dreckigen Teller nach 5 Minuten abzuwaschen, dann bewirb dich bei uns. Wir würden uns freuen, wenn sich etwas freundschaftliches Entwickeln würde und du Herz, Charme und Witz mitbringst. Gemeinsame Brettspieleabende (hier kannst du Pluspunkte bei der Bewerbung sammeln), ausgedehnte Spaziergänge,Container - und Kochaktionen, mittlere Trinkrunden, um die Häuser ziehen könnten deinen grauen Alltag bereichern. :D  Unser lieber Thilo verlässt uns für eine Frau. Wir sind immer noch völlig geschockt von dieser Tatsache.  Wer wird Leah nun Tofu zum Kochen beisteuern? Mit wem wird Pia das literarische Quartett, was nur ein Duett war, fortführen?Und wem skizziert Matti die geopolitische Weltlage am Frühstückstisch? Fragen über Fragen !!!  In der WG backen bleiben folgende Menschen:  Leah, 24 Jahre, studiert Informatik im Bachelor, kommt aus einem Kaff bei Duderstadt.  War nach der Schule 3 Jahre auf Weltreise in Südostasien, wo auch der Entschluss gefasst wurde den digitalen Nomaden Lifestyle zu verwirklichen und hat dort auch ihre Fernbeziehung klargemacht und später wieder aufgelöst. Kann dir tollen Gossip von ihrem Singleleben erzählen. Leah liebt alle Arten von Verkleidung und geht gerne auf Mittelalterfestivals oder WTGs. Versucht schon seit 3 Jahren einen Frühjahrsputz zu organisieren. Leah kocht gerne (z.B.mit Thilo) alle Arten von Hülsenfrüchten, Kartoffeln, Reis und ganz viel Gemüse. Der Dal-Donnerstag unter ihrer fachkundigen Anleitung ist legendär. Hat sich praktisch die komplette Zimmereinrichtung auf Ebay-Kleinanzeigen zusammengeklaubt. Zu ihren Hobbys gehört Slacklinen, Ariel Circle, Wandern, Klettern, Campen, Poi spielen. Ihre nerdige Art lebt Leah beim Programmieren, Sudoku Videos gucken oder beim Brettspielen gegen Matti aus. Hat dort die gefürchtete Leahglücksstrategie entwickelt. Arbeitet nicht mehr in nem unterbezahlten Dödeljob an der Hochschule HTWK, sondern hat sich einen richtigen IT Job gesucht (ganze 12 Wochenstunden). Demnächst startet die High Potential IT Karriere. Verarbeit den Alltag sehr lebhaft in den Träumen. Hat sich den Finger beim einem Rave gebrochen und wurde deswegen auf den Arm genommen. Oder sollte ich besser Finger sagen? Vegan. Pia, 24 Jahre, hat gerade den Germanistikmaster abgeschlossen, kommt aus einem Kaff im Schwarzwald.  Geflüchtet aus der heilen Welt des Schwarzwaldes ist Pia hier gelandet und studierte erst Literarisches Schreiben und dann Germanistik. Will noch einen 3.akademischen Grad in Lesen und Schreiben absolvieren, denn das Schriftstellerinnenleben istziemlich hart und muss mit Kaffee, Rotwein, schlecht gedrehten Zigaretten und ab und an mal IFZ aufgebessert werden. Das beschreibt auch ganz gut Ihr restliches Leben. Sehr gemütlich und sehr belesen wird sich im Morgenmantel und Nachthemd von Tag zu Tag geschrieben und geschlafen (Geheime Superpower: Locker mal 2 Tage schlafen). Falls Sie doch mal rausgeht, dann nur leicht bekleidet, auch bei -5 Grad Celsius reicht der Hoodie, es ist ja schließlich 'gar nicht so kalt'. Kann professionell Tinder Korrespondenz abwickeln. Pia geht um exakt 22 Uhr ins Bett. Uhren haben wir abgeschafft. Hat ihre erste Gedichtesammlung veröfffentlicht und haut das verdiente Geld gleich für die nächsten Bücher uffen Kopp. Ironie wird großgeschrieben und es gibt den ein oder anderen Moment, in dem man sich schon hart verarscht vor kommt, aber mit der Zeit verbessern sich die eigenen Ironiedetektoren. Für Gelaber in der Küche ist sie immer zu haben und auch nicht den nächtlichen Spaziergängen abgeneigt. Spielt höchstens mal ein Siedler mit. Schwäbelt. Matti, erfahrene 34 Jahre, 800. Semester Informatikmaster, ursprünglich aus einem Kaff im Norden Brandenburgs.  Hat mit viel Mühe (und Mate) seinen Bachelor in Wirtschaftsinformatik geschafft, versucht dass seine Semesterzahl nicht das Alter überrundet. Im 30ten Hochschulsemester dümpelt er an der Uni rum. War grad 2 Semester in Israel, für die Vorbereitung hat er nur 5 Jahre gebraucht. Seine Faulheit findet sich auch kulinarisch wieder - er ernährt sich von Mensa, Pizza und BACKCAMEMBERT und das exzessiv. Zuletzt hat er sich monatlang von Erasco Linsen-Einstopf mit Würstchen ernährt, die Sonderangebote der Supermärkte geplündert und eine Notreserve im Keller angelegt. Doch das ist nicht sein einziges Laster. Aktuell versucht er seine Mate-Sucht zu bekämpfen und die Burpeesätze zu steigern. Du triffst ihn überall an, wo es etwas umsonst gibt. Halte Ausschau nach einer rülpsenden Person mit schmuddeligem Jutebeutel, verschlissenem kurzen Jogger mit Löchern an pikanten Stellen, ausgelutschten Sandalen und einer Flasche Erdinger Alkoholfrei. Auf der Facebook Fan Seite von Sternburg kannst du dir ein Bild von ihm machen. Matti trinkt kein Alkohol, raucht nicht und nimmt auch keine anderen Drogen. Trotz dem kann man mit Ihm eine Menge Spaß haben... Er ist Flunkyball Schiedsrichter und hat schon das eine oder andere Turnier ausgerichtet, zuletzt mit seinen Tramper Freunden. Er organisiert abgesehen von diesem Jahr ein Tramp Rennen durch Europa - also falls du Lust hast, komm gerne das nächste Mal mit. Bitte verwende das Wort Steuererklärung in deiner Bewerbung, um deine Lesekompetenz zu überprüfen. Konträr dazu steht seine Leidenschaft zum Zocken. Am PC(Age of Empires) und auf dem Brett, vor allem komplexe Strategiespiele. Mach dich gefasst das ein oder andere Spiel mit ihm zu spielen, oder dir Ausreden einfallen zu lassen, warum das jetzt gerade wirklich gaaaaanz schlecht ist. Falls der Spieleabend in der HTWK mal ausgefallen ist, gibt es eine Runde Tagesthemen, heute- oder Auslandsjournal. Das geht immer als alternative zum Siedler spielen. Sein Humor ist dreckig, so auch seine Einstellung zum Putzen. Ist erklärter Fan von Karl Lauterbach und erzählt seinen 90 Mitbewohnern gerne Details aus dessen Leben. Lieblingsserien: Game of Thrones, House of Cards. Liefert sich bürokratische Scharmützel mit Dönerbudenbesitzern. Experte im Ran- und Wegschaffen... Hat konkrete Pläne, die Weltherrschaft an sich zu reißen, davor muss er aber erst seine Hose flicken lassen. BWLer"," Wir freuen uns auf deine Bewerbung. Je mehr und detaillierter du schreibst, desto besser können wir uns ein Bild machen und die Wahrscheinlichkeit eingeladen zu werden steigt. Wenn du magst, kannst du uns auch zusätzlich dein Facebook, Insta etc. schicken. Wenn du uns sympathisch bist, melden wir uns auch sehr schnell. ;)  Liebe Grüße  Leah, Pia und Matti",1.0,0,"Studenten-WG, keine Zweck-WG, gemischte WG, Internationals welcome",https://www.wg-gesucht.de/wg-zimmer-in-Leipzig-Zentrum-Suedost.7109071.html,4er WG,Zentrum-Südost,    15,262 ,https://www.wg-gesucht.de/wg-zimmer-in-Leipzig-Zentrum-Suedost.7109071.html
Kochstrasse 13,04275 Leipzig Südvorstadt,400,40,05.07.2023,2,"Waschmaschine,Spülmaschine,Balkon,Keller,Fahrradkeller",1,0,0," Dein Zimmer ist 24 m² groß mit 2 Fenstern zur ruhigen Kochstraße. Die Wände sind weiß, der Boden ist helles Laminat. Von den Nachbarn ist wenig zu hören, da das Haus ein Altbau ist.  Die Wohnung ist mit den wichtigen Geräten ausgestattet: Küche inklusive Geschirrspülmaschine, eine Waschmaschine ist auch vorhanden. Ein großer geräumiger, grüner Balkon (ca. 8 m²) in Richtung Hof lädt zum sonnigen Frühstück ein. Zwei Bäder mit einer Wanne und großem Spiegel gestalten das Zusammenleben unkompliziert.  Dein Zimmer hat ein Bett mit einer 140 x 200 cm Doppelmatratze und lädt genauso wie die Couch zum Entspannen ein. Neben einem Schreibtisch und Sessel gibt es Regal mit Fächern zum Verstauen.3 Lampen, Bilder und Pflanzen machen das Ganze wohnlich.   Einzelne Möbel/ Dinge können gerne entfernt oder umgestellt werden sowie eigenes integriert.   Diese Dinge mietest du neben der Wohnung und ihren Utensilien mit an und haftest via Kaution."," Die Kochstraße ist eine ruhige Parallelstraße der Karl-Liebknecht-Straße. Obwohl nur wenige Meter von der Karli entfernt, bleibt man vom Trubel verschont. Selbst die Straßenbahn ist nicht zu hören, obwohl die Haltestelle (Südplatz) der Tram 10 und 11, gleich um die Ecke ist.  In der näheren Umgebunggibt es viele Einkaufsmöglichkeiten: Unverpackt, Biomare, Aldi, Konsum und Netto sind jeweils keine 5 Gehminuten entfernt. Dazu gesellen sich Kneipen, Bars, Cafés und div. Spätis.  Der Clara-Zetkin-Park mit seinen vielfältigen Möglichkeiten ist zu Fuß leicht in 10 Minuten zu erreichen. Der Cospudener See ca. 20 Fahrradminuten.  Innerhalb von 5 Min. bist du mit dem Rad im Zentrum, in der Uni, an der S-Bahn Station Wilhelm-Leuschner-Platz oder MDR.","Ich beende aktuell mein Studium in Soziale Arbeit und arbeite in Teilzeit. Weiterhin bin ich reiselustig, vielseitig interessiert und habe einen großen Bekanntenkreis in der Stadt. Als Urleipziger bin ich gerne unterwegs, aber auch abends auf dem Balkon anzutreffen. Vielleicht können wir noch mehr von uns erzählen, wenn wir uns treffen oder skypen  Ansonsten hast du in deinem Zimmer immer eine Rückzugsgelegenheit."," Es gibt die Möglichkeit sein Fahrrad in den Innenhof zu stellen oder einen Parkplatz anzumieten.  Ich nutze Naturstrom, lebe weitestgehend umweltbewusst, versuche auf Fleisch zu verzichten und Müll zu vermeiden.  Wenn dein Interesse geweckt ist, würde ich mich freuen, wenn du mir eine kurze persönliche Beschreibung sendest.   Solltest du pendeln, wäre das für mich kein Problem.  Bei Fragen schreibe mir einfach.",1.0,0,"Zweck-WG, Studenten-WG, Frauen-WG, keine Zweck-WG, gemischte WG",https://www.wg-gesucht.de/wg-zimmer-in-Leipzig-Suedvorstadt.6684254.html,2er WG,Südvorstadt,    24,450 ,https://www.wg-gesucht.de/wg-zimmer-in-Leipzig-Suedvorstadt.6684254.html
Henricistr. 52,04177 Leipzig Altlindenau,510,140,19.08.2023,,,,,," [English below]  Liebe alle  Meine schnuckelige 2-Raumwohnung wird im Sommer von August bis September leer stehen, da ich in dieser Zeit verreisen werde. Ich suche auf diesem Wege nach einer*m Untermieter*in für diesen Zeitraum, die Wohnung sollte auch genügend Platz für zwei bieten.  Die Einrichtung bleibt komplett bestehen, Kleider und persönliche Gegenstände werden allerdings weggeräumt. Das kann aber bei einem persönlichen Treffen gerne alles nochmals besprochen werden. Wichtig ist mir, dass meine Pflanzen glücklich überleben - denn inzwischen bin ich eine echte Pflanzenmama :D  Die Wohnung verfügt neben einer Grundausstattung auch über zwei Nähmaschinen, eine Hängematte im Wohnzimmer (max.1 Pers.), Yogamatte, -blöcke und -rad sowie Keyboard, Gästesofa und ausreichend Spiegelfläche zum Tanzen oder Trainieren. Ein paar Jonglagespielzeuge gibt es auch und auch mein Fahrrad stelle ich gerne zur Verfügung.  __________  Dear all  I am subletting my lovely 2 room apartment from August to September because I’ll be travelling. It is a cozy place with a bed and a living room for one person, but it provides enough space for two people, too.The apartment is fully equipped, but clothes and personal belongings will of course be stored away. What exactly should be put away or you’re happy to use yourself can be discussed in person. What is important to me is that you’re taking great care of my plants – as I’m a real and proud plant-mama by now :D  Next to the basic amenities, the apartment offers a hammock in the living room (max. 1 pers.), two sewing machines, a yoga mat, yoga blocks as well as a yoga wheel, a Yamaha Keyboard, a sofa for guests and plenty of mirrors for dancing or practicing. There are also some juggling toys and my bicycle can be used, too."," Die Wohnung liegt direkt hinter Kaufland am Lindenauer Markt. Die Strassenbahnstationen 'Lindenauer Markt' und 'Angerbrücke' sind beide in 7-8 Gehminuten zu erreichen.  Die Lage ist ruhig, trotzdem ist man nach 15 Minuten Fussmarsch in der Karl-Heine-Str. und imPalmengarten. Mit dem Fahhrad ist man ebenso schnell im Auwald oder im Clara-Zetkin-Park.  Zum Einkaufen gibt es Kaufland und dm in kürzester Entfernung, ein Angebot mit wöchentlich neuen Superschnäppchen sowie ein Lidl sind auch nicht weit.  Zum Essen, Trinken und Ausgehen gibt es ein paar Bars und Restaurants, ansonsten wird man spätestens in Plagwitz fündig.  __________  The apartment is located behind Kaufland at Lindenauer Markt. The next stops for public transport are ‘Lindenauer Markt’ and ‘Angerbrücke’ and both can be reached within 7-8 minutes walking.  The neighbourhood is quiet, but within 15 minutes by foot you’ll be at Karl-Heine-Str. and in Palmengarten. And Auwald as well as Clara-Zetkin-Park is about 15 minutes by bike.  There is Kaufland and dm for shopping only a 5 minutes walk from the apartment. In 10 minutes walk you’ll be at Lidl or ‘Angebot’ where you find groceries that are about to expire and therefore for sale.  For food, drinks and nightlife there are a few bars and restaurants, otherwise you’ll definitely find a place in Plagwitz the hip neighbourhood.",," Falls bis zu dieser Zeile noch immer Interesse besteht, freue ich mich, von dir/euch zu hören :)  Weitere Infos sowie genauer Ein- und Auszug, bürokratische und finanzielle Fragen lassen sich am besten bei einem persönlichen oder virtuellen Kennenlernen besprechen.  Ah, noch was. Aufgrund meiner persönlichen Putz- und Ernährungsweise würde ich mich sehr über umweltbewusste und im besten Falle vegetarische/vegane Interessenten*innen freuen. Ist kein Muss, aber ein Plus :)  __________  If you’re still reading and interested up to that point, I’m happy to hear from you!  Everything else about the dates of moving in and out, paperwork as well as financial stuff is best discussed in person or online.  Oh, and last but not least. For personal cleaning and diet reasons, I’d be very happy to have someone with a sense for the environment and maybe a vegetarian/vegan diet living here. It’s not a must, but a plus :)",,0,,https://www.wg-gesucht.de/wohnungen-in-Leipzig-Altlindenau.8930309.html,2-Zimmer-Wohnung  ,Altlindenau,    51,650 ,https://www.wg-gesucht.de/wohnungen-in-Leipzig-Altlindenau.8930309.html
Wiebelstraße,04315 Leipzig ,230,100,01.07.2023,2,"Waschmaschine,Balkon,Keller,Fahrradkeller",2,0,0," Hallo liebe Interessenten,  das Zimmer ist ein 10qm großes Zimmer.  Dieses besitzt zwei Fenster mit großer Fensterbank, auf denen man enspannt sitzen kann.  Im Zimmer passt perfekt ein 200cm x 140cm großes Bett hinein. Bei einem kleineren Bett ist natürlich mehr Platz im Raum.  Bei der Neuvermietung bleiben der Schrank, die Vorhänge an den Fenstern (grau und weiß) und die Regalbretter bestehen für einen Preis von 150€.  Bitte berücksichtigt diese Verbindlichkeit, da ich dies genau so gemacht habe ;)"," Die WG befindet sich im Osten von Leipzig. Mit der Haltestation „Wiebelstraße“ gelangt Ihr mit der Tram 7 ganz entspannt in 10min in die Innenstadt und zu jeder Uhrzeit auch wieder zurück. Ebenfalls ist über die Tram 7 eine Direktanbindung zum Stadion oder zum belebten Stadtreil Lindenau gegeben. Am Wochenende kann man hiermit auch schnell zum Paunsdorf Center fahren.  Einkaufmöglichkeiten sind nur wenige Minuten entfernt, wie z.B. Penny und Kaufland.  Ein Späti ist nur 2min entfernt.  Bäcker, Imbiss und Bars sind ebenfalls fußläufig zu erreichen.  Genau so schnell wie der Rest erreicht Ihr auch einen kleinen Park.  Ich fande die Lage immer super und konnte mich nie beschweren.","Ihr würdet mit aktuell zwei 24 jährigen Frauen zusammen wohnen.  Lena: Arbeitet gerade als Physiotherapheutin und studiert nebenbei. Sie kommt ursprünglich aus Spanien und kann euch garantiert bei Rücken- oder Nackenschmerzen helfen. ;)  Greta: Istgerade in Ihrer Endphase vom Bachlor im Bereich Informatik. Sie kann bei EDV Problemen helfen und hat immer einen Zollstock parat.  Da WG-Leben ist offen. Jeder kann sich die Zeit für sich nehmen und bekommt diese auch.  Wenn man gerne mehr machen möchte sind beide Mitbewohnerinnen sehr offen für Spieleabende, Clubbesuche oder gemeinsammes Kochen.  Wichtig ist bei dem gemeinsammen zusammenleben die Sauberkeit in der Wohnung. Aus diesem Grund gibt es einen Putzplan, bei dem alle Mitbewohner sich abwechseln.  Also ob du gerne in der Sonne auf dem Balkon sitzen möchtest oder vor deinem PC deine Ruhe benötigst, beides ist gegeben."," Bitte haltet die angegebenen Forderungen ein.  Zusammengefasst zählt aber besonders folgendes:  - sein ein Mensch 👽  - freundlicher Umgang   - bitte haltet das vorgegebene Mindestalters ein  - Bereitschaft für die Reinigung der Wohnung   - frühster Einzugtermin ist sofort  - die mindestens Dauer ist ein Jahr  - Ein Arbeitsverhältnis oder eine Bürgschaft wäre unserem Mieter sehr WICHTIG! 🚨  - die Übernahme der beschrieben Möbel für 150€  Ich selber ziehe aus, weil ich in eine eigene Wohnung ziehe.  Ich werden vernünftigen Bewerbungen akzeptieren. Diese gebe ich an meine Mitbewohnerinnen weiter. Diese entscheiden den weiteren Verlauf.  Nach der Entscheidung geben wir die Daten unserem Vermieter weiter, welcher uns die Auswahl eines Nachfolgers überlässt.  Bitte nur bei Interesse melden!",1.0,0,"Zweck-WG, Studenten-WG, Frauen-WG, keine Zweck-WG, gemischte WG",https://www.wg-gesucht.de/wg-zimmer-in-Leipzig.10126541.html,3er WG,,    10,330 ,https://www.wg-gesucht.de/wg-zimmer-in-Leipzig.10126541.html
Stockstraße,04155 Leipzig Gohlis-Süd,335,0,01.08.2023,3,"Waschmaschine,Balkon,Keller",1,1,0," Hellou :)  Wir, Saskia und Johannes, suchen für unsere Dreier-WG eine*n neue*n Mitbewohner*in.  Bevor wir uns vorstellen, muss an erster Stelle gesagt werden, dass wir ein Pärchen sind. Uns ist wichtig zu sagen, dass wir, obwohl wir ein Pärchen sind, ein ganz normales WG-Leben haben wollen und Entscheidungen immer im Sinne der WG getroffen werden.  Die Altbauwohnung liegt im schönen Gohlis-Süd. Unsere Nachbarschaft ist super nett und umgänglich, vor allem, weil bei uns mehrere andere WGs wohnen. Ganz in der Nähe sind Kaufland, Rewe und weitere Läden fußläufig zu erreichen. Daneben bist du auch innerhalb von 10 min. im Auwald. Die Straßenbahnlinie 4 ist innerhalb von 3 min. zu erreichen. Innerhalb von 5 min. erreicht man dann auch die Straßenbahnlinien 10 und  11, sowie den Bus 90. Man ist dementsprechend mit der Straßenbahnlinie 4 in 13 min. am Hauptbahnhof, aber auch mit dem Rad bist du schnell in der Innenstadt. Unsere Wohnung hat insgesamt eine Fläche von 82 m^2, wovon diese aus drei Zimmern, einem Balkon zum Hinterhof und natürlich einem Bad und einer Küche besteht. Dein wundervolles Zimmer hat 18 m^2. Ansonsten ist unsere Wohnung standardmäßig mit Waschmaschine, Mikrowelle, Kühlschrank und Kaffeevollautomaten etc. ausgestattet. Deine Möbel müsstest du selber mitbringen.",,"Unsere WG besteht derzeit aus Saskia und Johannes.  Bevor wir uns vorstellen, muss an erster Stelle gesagt werden, dass wir ein Pärchen sind. Uns ist wichtig zu sagen, dass wir, obwohl wir ein Pärchensind, ein ganz normales WG-Leben haben wollen und Entscheidungen immer im Sinne der WG getroffen werden. Saskia studiert momentan im vierten Semester Lehramt für Gymnasien mit den Fächern Musik und Deutsch. In ihrer Freizeit singt oder spielt sie selbst, wobei sie das auch manchmal in der Wohnung macht. Außerdem malt sie leidenschaftlich gerne Aquarell, aber nicht museumstauglich. Saskia geht daneben auch sehr gerne in die Oper, ins Theater oder ins Konzert. Johannes studiert Archäologie im sechten Semester. Wenn gerade mal keine Pandemie herrscht, ist er meistens beim Bouldern in der Kletterhalle. Außerdem ist er ein passionierter PC-Spieler mit großem Interesse an Mineralien und Fossilien.  Gerne genießen wir auch die Zeit zu Hause, kochen gemütlich und nutzen den Sommer auf dem Balkon.  Wir suchen einen offenherzigen Menschen, der für vieles zu haben ist und gern länger ein Teil unserer WG sein möchte. Die Mindestmietdauer würde ein Jahr betragen und wir würden uns freuen, wenn du auch darüber hinaus bei uns wohnen bleiben möchtest. Wenn ihr euch bei uns bewerbt, braucht ihr nicht zu schreiben, wie viel WG-Erfahrung ihr schon habt oder dass ihr der Putzteufel vom Dienst seid. Es versteht sich von selbst, in der Gemeinschaft auf Ordnung und Sauberkeit zu achten. Uns kommt es einfach darauf an, das Prinzip des gemütlichen und friedlichen Zusammenwohnens langfristig zu erhalten. Schreibt uns einfach, wer ihr seid, was ihr so treibt und was ihr hier in Leipzig vorhabt.",,0.0,0,Studenten-WG,https://www.wg-gesucht.de/wg-zimmer-in-Leipzig-Gohlis-Sued.10170610.html,3er WG,Gohlis-Süd,    18,335 ,https://www.wg-gesucht.de/wg-zimmer-in-Leipzig-Gohlis-Sued.10170610.html
Krokerstraße 15,04157 Leipzig Grünau-Mitte,300,50,11.07.2023,3,"Waschmaschine,Spülmaschine,Haustiereerlaubt",0,1,0," Die Wohnung befindet sich im 1. Stock und verfügt über ein geräumiges Wohnzimmer mit offenem Küchenbereich, zwei Schlafzimmer, ein renoviertes Badezimmer mit Badewanne und Dusche und ein zusätzliches separates Gäste-WC.  Die Einbauküche, die integraler Bestandteil der Wohnung ist, verfügtüber zahlreiche Arbeitsplatten, einen Herd mit Backofen, einen Geschirrspüler und einen Kühlschrank mit Gefrierkombination.  Helle, ganztägig sonnige, geräumige 3-Zimmer-Wohnung, zwei Schlafzimmer, 2 Betten, neu renoviert, modern möbliert.   Aufteilung: großes Wohn-Esszimmer mit offener Küche",,,,,0,"keine Zweck-WG, gemischte WG",https://www.wg-gesucht.de/wg-zimmer-in-Leipzig-Gruenau-Mitte.9986786.html,2er WG,Grünau-Mitte,    17,400 ,https://www.wg-gesucht.de/wg-zimmer-in-Leipzig-Gruenau-Mitte.9986786.html
"5, Johannes-R.-Becher-Strasse",04279 Leipzig Lößnig,230,0,01.07.2023,2,"Waschmaschine,Keller,Fahrradkeller,Aufzug",0,1,0," Hello, thank you for looking at our ad!   I am Yash and looking for an roommate    Your future room is 12sqm, bright and completely furnished.    In addition, bathroom and the kitchen with C4 studenclub downstairs for you.    Your room is facing a beautiful city view which is perferct for  sleeping, studying or relaxing.  The apartment is located on  Johannes-R.-Becher-Strasse in Lößnig. The tram stop ""Moritz hof"" is a 2-minute walk away. With the streetcar line 1 you can reach city center in 14 minutes, also the bus lines 79 stop here.   Living is pleasantly quiet, the Lößnig park and the beautiful Lake are only a few streets away,  you can easily reach to lake  in 5 minutes.    I  spend my time mostly in classes and would highly appreciate if peace is maintained in the appartment  This room belong to chetan and he is visiting his home formonth and half and his some accesories will be in the room ,but we will clear the space for you and you will get a desk chair , a table and a bed with matress with some additional furniture  All cost are included like water, gas, internet etc.   If there is time, we are  averse to cooking evenings, and other leisure activities together.    If you are interested, please contact us and tell us a little bit about yourself. We are looking forward to reading from you!  Yash"," Take tram line 10 or 16 (departs directly in front of the main train station) in the direction of Lößnig to the Moritz-Hof stop on Zwickauer Straße  turn left into J.-R.-Becher-Straße and walk through the arcades  the hall of residence is now immediately on the left-hand side",I am student and my roommate is travelling to his home for one and half month and Life in Studentenwohnheim is very peaceful and quiet,,1.0,0,Studenten-WG,https://www.wg-gesucht.de/wg-zimmer-in-Leipzig-Loessnig.10186773.html,2er WG,Lößnig,    12,230 ,https://www.wg-gesucht.de/wg-zimmer-in-Leipzig-Loessnig.10186773.html
