Street,Address,rent_cold,additional_cost,free_from,distance,gadgets,female_roommates,male_roommates,divers_roommates,room_description,location_description,flat_live,additional,smoker,accessible,kind_of_flat,Url,type,district,size,price,link
Zweinaundorfer Straße,04318 Leipzig Anger-Crottendorf,413,0,01.08.2023,3,"Waschmaschine,Spülmaschine,Balkon,Gartenmitbenutzung",1,0,0," Ab August werden in meiner WG zwei Zimmer frei. Ein Zimmer ist ca. 20m² groß, quadratisch geschnitten, mit 2 Fenstern (Nordseite) und Blick auf ein kleines Birkenwäldchen. Das andere Zimmer ist ca. 9m² groß, schlauchig geschnitten, mit 1 Fenster (Südseite) und Blick in den Hinterhof auf einen großen Baum. Außerdem gibt es noch ein weiteres Zimmer (17m²), welches bisher in unserer WG als Wohn- und Arbeitszimmer genutzt wurde. Ich selbst lebe in einem 10m² großen Zimmer, weshalb mein Wunsch ist, dieses Wohnzimmer weiter beizubehalten. Wir können aber gern noch einmal persönlich über die Aufteilung der Zimmer ins Gespräch kommen.  Außerdem gibt es einen großen Flur, ein Bad mit Dusche, Badewanne und Fenster, ein Gästeklo sowie eine Küche mit angrenzendem Balkon (Südseite). Unsere Fahrräder können wir im Hinterhof anschließen."," Die WG liegt im hinteren Teil der Zweinaundorfer Straße (zwischen den Haltestellen Martinstraße und S-Bahnhof Anger-Crottendorf). Zu Fuß sind es 3min zur Bushaltestelle Martinstraße und 10min zur Tramhaltestelle Breite Straße. Die Anbindung an den Radweg zum Lene-Voigt-Park ist für mich persönlich ein großes Plus. Außerdem sind es etwa 5min mit dem Rad bis zu meinem Kleingarten in der Nähe des Stünzer Parks. Ich pachte diesen Kleingarten mit einer befreundeten Person zusammen und verbringe da im Sommer gerne meine Zeit. Ich freue mich, wenn meine zukünftigen Mitbewohner:innen mich auch gerne mal im Garten besuchen kommen (: Dort lässt es sich gut lesen, grillen, ...","Bisher haben wir zu Dritt hier in der WG gelebt (zwischenzeitlich auch mal zu Viert). Da nun beide meine Mitbewohner:innen Ende Juli ausziehen werden, kann ich derzeit nur von meinen Wünschen über ein zukünftiges WG-Leben schreiben: Ich selbst werde im Juli meinen Master in Psychologie abschließen. Danach möchte ich mir für etwa ein Jahr die Zeit nehmen, mir über eine mögliche weiterführende Psychotherapie-Ausbildung Gedanken zu machen. In der Zeit möchte ich auf Teilzeit jobben, viel Lesen, im Garten werkeln und das ein oder andere(Bau-)projekt starten (: Wie es danach für mich weitergehen wird, bleibt offen. Mein großer Wunsch ist es aber, möglichst noch einige Jahre in Leipzig zu wohnen. Ich wandere sehr gerne und bin ehrenamtlich als Jugendleiterin in einer Klettergruppe aktiv. Ich mag es, mich handwerklich auszuprobieren und gemeinsam mit meinen Mitbewohner:innen zu kochen & zu essen. Ich mag Theater, Kino und Konzerte und freue mich auf gemeinsame WG-Ausflüge (:  Mir ist ein respektvoller Umgang wichtig. Ich suche nach Menschen, die bereits WG-Erfahrung mitbringen und denen ein wertschätzendes Miteinander wichtig ist. Am liebsten würde ich die Lebensmittel mit allen in der WG teilen, kann aber auch mit getrennten Schubfächern leben, falls wir da nicht zusammenfinden. Generell ist es mir wichtig, dass Dinge direkt angesprochen werden und alle sich gleichermaßen am WG-Leben beteiligen."," Wie bereits angesprochen, werden in der WG zwei Zimmer frei. Grundsätzlich wäre in der WG auch Platz für eine vierte Person. Allerdings würde ich mich (v.a. mit Blick auf den Winter) über ein gemeinsam geteiltes Wohnzimmer freuen, welches wir für Kino- und Spieleabende nutzen können (:  Derzeit bespreche ich mich noch mit meinen ""alten"" Mitbewohner:innen, welche Möbel sie mitnehmen werden und welche in der WG bleiben. Die WG wird vermutlich leerer aussehen, als auf den Bildern zu sehen ;)  Ich bin bereits als neue Hauptmieterin ab August 2023 bei unserem Vermieter gemeldet. Es soll allerdings noch eine weitere Person in den Hauptmietvertrag aufgenommen werden - das müssen wir dann im Detail besprechen. Außerdem haben wir leider eine vertraglich festgelegte Staffelmiete, mit der wir leben müssen: Ab dem 01.06.2023 bis 30.05.2024 zahlen wir für die gesamte Wohnung 880€ und ab dem 01.06.2024 dann 930€. Genaueres dazu können wir gerne persönlich besprechen.  !! In den aktuellen 440€ für das große Zimmer (20m²) sind Warmmiete, Strom, Internet sowie GEZ bereits enthalten. Es kommen also keine weiteren Kosten noch dazu (bis auf die Staffelmiete) !!",1.0,0,"Studenten-WG, keine Zweck-WG, gemischte WG, Vegetarisch/Vegan",https://www.wg-gesucht.de/wg-zimmer-in-Leipzig-Anger-Crottendorf.10166568.html,3er WG,Anger-Crottendorf,    9,413 ,https://www.wg-gesucht.de/wg-zimmer-in-Leipzig-Anger-Crottendorf.10166568.html
Zweinaundorfer Straße,04318 Leipzig Anger-Crottendorf,440,0,01.08.2023,3,"Waschmaschine,Spülmaschine,Balkon,Gartenmitbenutzung",1,0,0," Ab August werden in meiner WG zwei Zimmer frei. Ein Zimmer ist ca. 20m² groß, quadratisch geschnitten, mit 2 Fenstern (Nordseite) und Blick auf ein kleines Birkenwäldchen. Das andere Zimmer ist ca. 9m² groß, schlauchig geschnitten, mit 1 Fenster (Südseite) und Blick in den Hinterhof auf einen großen Baum. Außerdem gibt es noch ein weiteres Zimmer (17m²), welches bisher in unserer WG als Wohn- und Arbeitszimmer genutzt wurde. Ich selbst lebe in einem 10m² großen Zimmer, weshalb mein Wunsch ist, dieses Wohnzimmer weiter beizubehalten. Wir können aber gern noch einmal persönlich über die Aufteilung der Zimmer ins Gespräch kommen.  Außerdem gibt es einen großen Flur, ein Bad mit Dusche, Badewanne und Fenster, ein Gästeklo sowie eine Küche mit angrenzendem Balkon (Südseite). Unsere Fahrräder können wir im Hinterhof anschließen."," Die WG liegt im hinteren Teil der Zweinaundorfer Straße (zwischen den Haltestellen Martinstraße und S-Bahnhof Anger-Crottendorf). Zu Fuß sind es 3min zur Bushaltestelle Martinstraße und 10min zur Tramhaltestelle Breite Straße. Die Anbindung an den Radweg zum Lene-Voigt-Park ist für mich persönlich ein großes Plus. Außerdem sind es etwa 5min mit dem Rad bis zu meinem Kleingarten in der Nähe des Stünzer Parks. Ich pachte diesen Kleingarten mit einer befreundeten Person zusammen und verbringe da im Sommer gerne meine Zeit. Ich freue mich, wenn meine zukünftigen Mitbewohner:innen mich auch gerne mal im Garten besuchen kommen (: Dort lässt es sich gut lesen, grillen, ...","Bisher haben wir zu Dritt hier in der WG gelebt (zwischenzeitlich auch mal zu Viert). Da nun beide meine Mitbewohner:innen Ende Juli ausziehen werden, kann ich derzeit nur von meinen Wünschen über ein zukünftiges WG-Leben schreiben: Ich selbst werde im Juli meinen Master in Psychologie abschließen. Danach möchte ich mir für etwa ein Jahr die Zeit nehmen, mir über eine mögliche weiterführende Psychotherapie-Ausbildung Gedanken zu machen. In der Zeit möchte ich auf Teilzeit jobben, viel Lesen, im Garten werkeln und (Bau-)projekte starten(: Wie es danach für mich weitergehen wird, bleibt offen. Mein großer Wunsch ist es aber, möglichst noch einige Jahre in Leipzig zu wohnen. Ich wandere sehr gerne und bin ehrenamtlich als Jugendleiterin in einer Klettergruppe aktiv. Ich mag es, mich handwerklich auszuprobieren und gemeinsam mit meinen Mitbewohner:innen zu kochen & zu essen. Ich mag Theater, Kino und Konzerte und freue mich auf gemeinsame WG-Ausflüge (:  Mir ist ein respektvoller Umgang wichtig. Ich suche nach Menschen, die bereits WG-Erfahrung mitbringen und denen ein wertschätzendes Miteinander wichtig ist. Am liebsten würde ich die Lebensmittel mit allen in der WG teilen, kann aber auch mit getrennten Schubfächern leben, falls wir da nicht zusammenfinden. Generell ist es mir wichtig, dass Dinge direkt angesprochen werden und alle sich gleichermaßen am WG-Leben beteiligen."," Wie bereits angesprochen, werden in der WG zwei Zimmer frei. Grundsätzlich wäre in der WG auch Platz für eine vierte Person. Allerdings würde ich mich (v.a. mit Blick auf den Winter) über ein gemeinsam geteiltes Wohnzimmer freuen, welches wir für Kino- und Spieleabende nutzen können (:   Derzeit bespreche ich mich noch mit meinen ""alten"" Mitbewohner:innen, welche Möbel sie mitnehmen werden und welche in der WG bleiben. Die WG wird vermutlich leerer aussehen, als auf den Bildern zu sehen ;)  Ich bin bereits als neue Hauptmieterin ab August 2023 bei unserem Vermieter gemeldet. Es soll allerdings noch eine weitere Person in den Hauptmietvertrag aufgenommen werden - das müssen wir dann im Detail besprechen. Außerdem haben wir leider eine vertraglich festgelegte Staffelmiete, mit der wir leben müssen: Ab dem 01.06.2023 bis 30.05.2024 zahlen wir für die gesamte Wohnung 880€ und ab dem 01.06.2024 dann 930€. Genaueres dazu können wir gerne persönlich besprechen.  !! In den aktuellen 440€ für das große Zimmer (20m²) sind Warmmiete, Strom, Internet sowie GEZ bereits enthalten. Es kommen also keine weiteren Kosten noch dazu (bis auf die Staffelmiete) !!",1.0,0,"Studenten-WG, keine Zweck-WG, gemischte WG, Vegetarisch/Vegan",https://www.wg-gesucht.de/wg-zimmer-in-Leipzig-Anger-Crottendorf.10165999.html,3er WG,Anger-Crottendorf,    20,440 ,https://www.wg-gesucht.de/wg-zimmer-in-Leipzig-Anger-Crottendorf.10165999.html
Georg-Schwarz-Straße 1,04177 Leipzig Lindenau,295,0,01.08.2023,1,"Waschmaschine,Spülmaschine",3,4,0," Die Zimmer sind 13qm groß. Wir suchen 2 Personen in Zwischenmiete: eine ab August und eine ab September - beide bis zwischen Anfang November und Ende Januar. Die Zeiträume, die oben stehen sind also ein wenig flexibler.  Wenn Du keine Möbel mitbringst können wir dir beim Beschaffen helfen, denn es finden sich mit Sicherheit noch Dinge im Haus, wie Tisch, Regal oder Matraze. Die Zimmer selber sind zwar nicht groß, aber es gibt dafür viel Gemeinschaftsraum (eine riesige Wohnküche, 2 Bäder und eine weitere kleine Küche) den wir gemeinsam nutzen - wobei die kleine Küche auch mal für exklusivere Anlässe, wie z.B. romantische Dinner, Kinderfütterung oder als Rückzugsort, ""reserviert"" werden kann."," Unser Haus liegt an der Georg-Schwarz-Straße 1/Merseburger Straße 94 in einer lebendigen Ecke, welche sowohl Cafénachmittage und Kneipenabende bietet, aber auch nur 10 Minuten vom Auwald entfernt liegt. Das Haus ist mit den Öffies super angebunden, aber die Tram fährt direkt vor der, was für geräuschempfindliche Leute wichtig zu wissen ist. 2018 wurde unser Haus von der SoWo Leipzig Genossenschaft dem Wohnungsmarkt entzogen und danach von uns als Hausprojektgruppe 3 Jahre lang mühevoll saniert und renoviert. Fertig sind wir noch nicht, aber soweit fertig, dass in allen 58 Zimmern (große und kleine, mehrheitlich weiße) Menschen wohnen. Entscheidungen werden auf dem Hausplenum im Konsens getroffen; organisiert sind wir in einer AG-Struktur. Weiter schmökern über unser Hausprojekt könnt ihr unter https://gseins.noblogs.org","Unsere WG hat sich vor 1.5 Jahren neu gegründet und ist Teil eines Hausprojekts in Altlindenau, welches nach einer anstrengenden Bauphase langsam so richtig in der Wohnphase ankommt. Aktuell erleben wir in der WG einen Umbruch, sodass 2 Zimmer frei werden. Diese Zimmer möchten wir zur Zwischenmiete anbieten um Zeit zu haben uns zu sortieren und neu zu orientieren um eine langfristig stabile Gemeinschaft aufzubauen. Wir wünschen uns ein solidarisches Leben und Miteinander und verstehen uns nicht als Zweck-WG. Alle Menschen in unserer Gruppe sind in unterschiedlichenErwerbs- und Lebensrealitäten, wobei viele aktuell stark erwerbstätig eingebunden sind und ein Paar mit Kind in Elternzeit im Leben-mit-Kind ankommt. Da dieses süße 1-jährige Kind mit uns wohnt, solltest du Lust und am besten auch Erfahrung im zusammen wohnen mit Kind haben oder selbst ein Kind ""mitbringen"". Eng angeschlossen an die WG und mit einer Durchgangstür verbunden leben 2 weitere Erwachsene mit 2 Kindern, 5 und 8 Jahre alt. Die Erwachsenen (3 cis-w/3 cis-m) sind alle um Mitte 30/Anfang 40. Ein achtsames Miteinander ist uns sehr wichtig.  Wir nutzen das meiste haushaltsmäßige gemeinsam (gemeinsame Haushaltskasse, Solawi) und machen im Moment sehr regelmäßig jede Woche ein Plenum. Es floß und fließt viel Zeit und Energie in den Bau und die Organisation dieses Lebensortes und wir sind definitiv nicht fertig, aber soweit, dass es kein absolutes Chaos mehr ist. Wir mögen, wenn es sauber und ordentlich ist und versuchen immer wieder den riesigen Flur möglichst Gerümpelfrei zu halten. Viele von uns lieben es zu Feiern, gemeinsam zu essen oder Gäste zu haben, politisch und/oder hedonistisch zu sein. Hier tummeln sich unterschiedlichste Hobbies - Gärtnern, Kochen, Barabende und Festivals organisieren, Meditieren, Klettern, Nähen,... .Insgesamt geht es bei uns mal laut, mal leise, mal arbeits-, mal zusammen, mal zurückgezogen zu, wobei wir uns als Gemsinschaft verstehen und uns gegenseitig unterstützen. Insgesamt fühlt es sich nicht an wie eine 9ner WG, weil viele regelmäßig außerhalb Termine haben."," Wenn du meist recht gut drauf bist oder (wenn schlecht drauf) gut in Kommunikation, Lust auf Leute kennenlernen hast und kein perfektes unstrittig fertig entwickeltes gemeinschaftliches Leben erwartest, dann meld dich gerne.   WE DON'T LIKE: Rassismus/Sexismus/Homo*Transphobie und andere unnötige Verhaltensweisen oder Ideen.   Schreib bitte ausfühlich an . Für uns wichtig sind auch Infos über wie lange du gerne bleiben würdest und ob du ab nach der Fusion die Möglichkeit hast vorbeizukommen. Bitte schick auch deine Handynummer mit!!",,0,"WG mit Kindern, keine Zweck-WG, gemischte WG, Internationals welcome",https://www.wg-gesucht.de/wg-zimmer-in-Leipzig-Lindenau.9130154.html,9er WG,Lindenau,    13,295 ,https://www.wg-gesucht.de/wg-zimmer-in-Leipzig-Lindenau.9130154.html
Davidstr.,04109 Leipzig Zentrum-West,480,0,10.09.2023,2,"Waschmaschine,Spülmaschine,Balkon",1,1,0," Hallo,  zum 10. September wird in unserer WG ein helles und sympathisch geschnittenes 26qm-Zimmer mit eigenem kleinem Balkon zur zeitlich flexiblen Zwischenmiete frei. Das Zimmer besitzt 3 große Fenster und ist vollmöbliert, d.h. ausgestattet mit Schreibtisch, großem Bett (1,40m x 2,00m), Kleiderschrank, Regalen und diversen Sitzmöglichkeiten (siehe Fotos). Der sanierte Altbau punktet zudem mit schönen hohen Decken."," Das gründerzeitlich-pittoreske Bachviertel liegt nur ein paar Gehminuten westlich der Innenstadt, direkt an den beliebten Grünanlagen Johannapark und Clara-Zetkin-Park. Mit dem Fahrrad ist man schnell überall in Leipzig. 2 Gehminuten von der WG entfernt halten zudem die Trams 1, 2 und 14. Im gemütlichen und übersichtlichen Viertel gibt es neben Supermarkt, Bäcker, Späti und Eisdiele auch eine Pizzeria sowie diverse Cafés und Galerien. Auf der östlichen Seite des Viertels befindet sich das Internat desThomanerchores.","Da Deine potentiellen Mitbewohner:innen Dani und Johannes beruflich stark eingespannt sind (Uni Leipzig), ist die WG ein relativ unspektakulärer Rückzugsort, wo jeder sein Refugium genießen und seine Akkus aufladen kann. Wenn Du also kein aufregendes und lautes Zusammenleben, sondern eher ein ruhiges Nebeneinander bevorzugst, gerne Zeit für Dich alleine hast und Dein Alltag durch Deinen Job zum unkomplizierten und erwachsenen Wohnungsteilen passt, dann wird es Dir hier gefallen. Plauder- statt Partyzone."," Die 480€ beinhalten sämtliche Kosten (Kaltmiete + Betriebskosten + Heizkosten/Wasserkosten + Ökostrom + Internetflatrate + Haushaltsabgabe/Rundfunkbeitrag + Mitnutzung der Waschmaschine etc.). Wenn Zimmer- und WG-Beschreibung Dein Interesse geweckt haben und Du mal zum Anschauen und Kennenlernen vorbeikommen möchtest, schreib mir gerne eine Nachricht - bitte auch schon mit ein paar Infos zu Dir. Ich melde mich dann zeitnah zurück.",0.0,0,"Business-WG, gemischte WG, Internationals welcome, funktionale WG",https://www.wg-gesucht.de/wg-zimmer-in-Leipzig-Zentrum-West.7170490.html,3er WG,Zentrum-West,    26,480 ,https://www.wg-gesucht.de/wg-zimmer-in-Leipzig-Zentrum-West.7170490.html
Helmholtzstr 12,04177 Leipzig Plagwitz,570,250,01.09.2023,4,"Waschmaschine,Spülmaschine,Balkon",,,," Hallo zusammen,  ich biete zur Zwischenmiete (1.09.2023 - 30.11.2023) meine schöne, helle und gemütliche Wohnung. Die Altbauwohnung liegt ggü. vom Westwerk und bietet einen offenen Blick über das Jahrtausendfeld. Sie hat einen sehr großen Balkon, der zum verweilen einlädt.  Wohnung und Haus:  Die Wohnung ist komplett ausgestattet: im Wohnzimmer gibt es eine ausziehbare Couch, einen Esstisch, Komode, Bibliothek. Im Schlafzimmer gibt es ein großes Bett, ein Schrank und 2 Komoden. Das Bad hat eine Dusche und eine Badewanne und eine Waschmaschine. Die Küche hat eine Spülmaschine, Herd, Ofen, Wasserkocher, Toaster. Der Balkon ist ebenfalls ausgestattet.  Das Schlafzimmer ist Richtung Helmholtzstr., das Wohnzimmer und die Küche Richtung Kanal.  Der Innenhof hat ein Spielplatz und einen kleinen Brunnen."," Die Wohnung istsuper platziert: 2 Min vom Westwerk, Karl-Heine Str. und vom Kanal und 4 Min bis zur nächsten Tram-Station. Ihr findet super viele Restaurants, Cafés, einen großen Spielplatz, der Weg zum Park ist ziemlich kurz und die Innenstadt ist ebenfalls in lockeren 15 Min mit dem Rad zu erreichen.  Im Westwerk gibt es ein Konsum, eine Apotheke, etwas weiter weg gibt es ein Netto.",," Die gesamte Wohnung hat 85 m2, das kleinste Zimmer (12m2) wird nicht vermietet, da ich es als Ablageraum während meiner Abwesenheit benutzen werde.  Kosten:  820 EUR/ Monat - alles inklusive (Strom, Wasser, Internet, GEZ und was noch so dazu kommt, wie zB: Müll, Haustreppenreinigung)  Kaution: 1.640 EUR  Ihr müsst nur einziehen und euch wohlfühlen :)",,0,,https://www.wg-gesucht.de/wohnungen-in-Leipzig-Plagwitz.10198620.html,2-Zimmer-Wohnung  ,Plagwitz,    85,820 ,https://www.wg-gesucht.de/wohnungen-in-Leipzig-Plagwitz.10198620.html
15,04177 Leipzig Plagwitz,450,40,28.08.2023,,"Waschmaschine,Balkon",,,," Ich bin im Juni verreist! Daher vermiete ich meine kleine gemütliche Wohnung im Leipziger Westen und Szenenviertel Plagwitz. Von meiner kleinen Wohnung aus kann man nicht nur über die Dächer blicken, sondern man ist auch nur einen Katzensprung entfernt von der beliebten Karl Heine Straße die zumflanieren und Kaffee trinken einlädt. Aber auch der wunderschöne Kanal und der Palmengarten ist ist von der Wohnung in 2 Minuten zu erreichen.  Ein toller Ort um den Juni zentral und naturverbunden zu verbringen!", im wunderschönen Plagwitz!!,, ...noch mal als info: 4ter stock :),,0,,https://www.wg-gesucht.de/1-zimmer-wohnungen-in-Leipzig-Plagwitz.10067473.html,1-Zimmer-Wohnung  ,Plagwitz,    60,490 ,https://www.wg-gesucht.de/1-zimmer-wohnungen-in-Leipzig-Plagwitz.10067473.html
Graffstraße,04179 Leipzig Neulindenau,306,0,11.08.2023,3,"Waschmaschine,Balkon,Garten,Gartenmitbenutzung,Keller,Fahrradkeller",3,1,0," Hallo liebe Menschen!  10qm scheinen auf den ersten Blick recht klein zu sein, jedoch bietet die restliche Wohnung - besonders die Küche, der große Flur, Balkon & das 18qm Wohnzimmer - noch sehr viel zusätzlichen Raum zum ausleben und gemeinsam sein (:  ---> WICHTIG:  - Über das genaue Einzugdatum lässt sich noch sprechen, es ist also auch ab 01.09.23 möglich! (spätestens)  Aktuell werden noch Baumaßnahmen aufgrund eines Wasserschadens in einem der zwei (Tageslicht-)Bäder beendet, diese werden aber noch im Juli fertig, sodass wir dann wieder zwei Bäder nutzen können."," Schräg gegenüber der Wohnung liegt ein kleiner, grüner Park mit Tischtennisplatten und Basketballkorb. Zwei Minuten zu Fuß aus der Haustür heraus nach rechts gelangst du zu den öffentlichen Verkehrsmitteln, zwei Minuten aus der Tür nach links und schon befindest du dich am schönen Karl-Heine-Kanal, der zu gemütlichen Spaziergängen einlädt.  Der Westen Leipzigs bietet unglaublich viele aufregende Spots, welche allesamt fix von der Wohnung aus zu erreichen sind, und schafft eine perfekte Verbindung aus Natur, Kunst und Kultur.","Wir möchten weiterhin ein freundschaftliches Zusammenleben führen mit gegenseitiger Wertschätzung und Vertrauen, wobei gleichzeitig jeder Person ihr nötiger Freiraum gegeben wird. Dafür wünschen wir uns eine offene Person, die Lust auf ein entspanntes, längerfristiges Zusammenleben und gemeinsame Aktivitäten und Chillen hat (haben jetzt einen Beamer im Wohnzimmer...).  Wichtig sind uns außerdem Ordnung, Sauberkeit und direkte, ehrliche Kommunikation, damit das WG-Leben auch möglichst entspannt bleibt (;  Kurz zu uns:  Laura hat ihr Psychologiestudium beendet und arbeitet nun Teilzeit als Sozialarbeiterin in einer Unterkunft für geflüchtete Menschen. Sie ist gerneaktiv unterwegs zum Wandern, geselligen Abenden, Festivals/Raves, Beachvolleyball oder zum Lebensmittel retten. Auch in der WG ist sie für allen möglichen Unfug & Chillerei zu haben.  Roxana hat nach ihrem Psychologiestudium ein Jahr zeitgenössischen Tanz studiert und arbeitet jetzt in der Kinder- und Jugendhilfe. Außerdem orientiert sie sich in Richtung einer körpertherapeutischen Ausbildung. Sie schätzt tief- bis blödsinnige Gespräche, Wandern, Netflix- und Spieleabende und Kreatives.  Matthias ist im Januar neu bei uns eingezogen. Er ist gelernter Zimmerer, macht aktuell eine Tanzpädagogik-Ausbildung und ist generell ein musikalischer (E-Piano im Wohnzimmer!, Gitarre, Rap), entspannter und linkspolitisch interessierter Mensch, der sich mit uns auf ein gemeinschaftliches Zusammenleben freut. Er talkt gern deep, macht ab und zu Quatsch, interessiert sich für das große Ganze genauso wie für den einzelnen Körper und sein Befreiungspotenzial, spielt gerne Gesellschafts- und Kartenspiele und hat Bock auf gemeinsames Kochen (...und SEKT!).  Theresa ist seit April Teil der WG. Sie arbeitet als Musikpädagogin in einem Soziokulturellen Zentrum und versucht nebenher ihre Masterarbeit zu schreiben. Musik ist ihre Leidenschaft, sie tanzt auch gern und ist gerade noch auf der Suche nach einem Chor. Sie ist definitiv Langschläferin, für sämtliche Outdoor- und Kreativaktionen immer zu begeistern, außerdem fürs gemeinsame Kochen, tiefe Gespräche, Musikmachen und aktivistischen Gedankenaustausch."," Wenn du dir nun also vorstellen kannst, bei und vor allem mit uns zu leben, dann würden wir uns über eine Nachricht von dir mit einer aussagekräftigen Beschreibung zu deiner Person sehr freuen. Wir werden erstmal ein paar Tage Anfragen sammeln und uns dann bei dir melden.   Wir sind gespannt darauf, dich kennenzulernen!",1.0,0,keine Zweck-WG,https://www.wg-gesucht.de/wg-zimmer-in-Leipzig-Neulindenau.9142521.html,5er WG,Neulindenau,    10,306 ,https://www.wg-gesucht.de/wg-zimmer-in-Leipzig-Neulindenau.9142521.html
