Street,Address,rent_cold,additional_cost,free_from,distance,gadgets,female_roommates,male_roommates,divers_roommates,room_description,location_description,flat_live,additional,smoker,accessible,kind_of_flat,Url,type,district,size,price,link
Gräfestraße 39,04129 Leipzig Eutritzsch,190,0,30.06.2023,2,"Waschmaschine,Spülmaschine,Terrasse,Balkon,Garten,Gartenmitbenutzung,Keller",0,6,0," Unsere bescheidene Altbauvilla bietet dir alles was du zum erfolgreichen studieren brauchst: eine kleine Kneipe, einen Sportraum, einen Garten zum Grillen und ein gut gefülltes Bierlager.  Du kannst hier Wäsche waschen und trocknen, du kannst kochen, backen, braten, dämpfen oder was auch immer. Wenn du Wert darauf legst, kannst du dich in einem unserer drei Bäder sogar waschen.  Ansonsten gibt’s für dich ein recht annehmbares Zimmer von überdurchschnittlicher Größe, vollständig mit den Ikea-Essentials (Bett, Kleiderschrank, Schreibtisch) möbliert, teilweise mit Parkettfußboden."," Du hast keinen Bock eine Dreiviertelstunde zur Uni zu gurken? Keine Angst, trotz unserer Lage etwas außerhalb des Trubels der Innenstadt bist du durchaus nicht abgeschnitten. Die Tram-Linie 16 verkehrt alle 10min 100m vor der Haustür und bringt dich zuverlässig binnen 15min zum Augustusplatz, wo sich Uni und Innenstadt befinden.  Das Haus selbst ist umgeben von sehr viel Grün. So viel, dass wir von unseren Nachbarn fast nichts mitkriegen und sie umgekehrt auch von unseren Eskapaden weitgehend verschont bleiben. Hinter unserem Garten schließt sich ein Park an. Außerdem liegen noch eine kleine Schwimmhalle und ein paar Supermärkte in der Nähe.","Du säufst gerne mal ne Nacht durch und kommst morgens trotzdem aus dem Bett? Du möchtest nicht peinlich als Elite posen, willst aber in Zukunft trotzdem einer guten berufliche Perspektive entgegenblicken? Du schlägst im Suff nicht um dich, aber stehst trotzdem auf Kampfsport? Du hältst dich selbst nicht für die geilste Sau der Welt, hast aber ein gesundes Selbstbewusstsein? Du bist ein umgänglicher Typ, aber du stehst trotzdem auch mal auf Dosenstechen? Du glaubst, dass Regeln wichtig sind, aber auchmal gebrochen werden sollten? Du isst gern Schnitzel (meinetwegen auch ohne Schwein oder aus Tofu), aber schaffst mindesten 10 Liegestützen bzw. kannst zumindest 10 Höhenmeter gehen ohne einen Herzinfarkt zu riskieren? Wir auch (zumindest die meisten)! Komm vorbei und überzeuge dich selbst!  Wir sind eine dysfunktionale aber dafür sehr liebevolle zweite Familie abseits der Heimat. Wir sind Typen die sich übereinander aufregen und trotzdem immer loyal zusammenstehen – und wir haben noch Platz in unserer Mitte."," Uns interessiert nicht was du studierst, Hauptsache du nimmst es ernst. Ob du ein verlotterter Geschichtswissenschaftler, ein ekelhafter Rechtsverdreher oder ein pickliger Elektroingenieur werden willst, geht uns grundsätzlich am Arsch vorbei, solange du deinen Scheiß irgendwie auf die Kette kriegst. Genau so wenig interessiert uns wo du her kommst, welcher politischen Richtung du dich zugehörig fühlst (vorausgesetzt du bist kein Nazi oder versiffter Steineschmeißer) oder wen oder was du anbetest (Gott, Jehova, Flying Spaghetti Monster oder deine Porno-Sammlung)  Wir suchen keine passiven Weicheier, sondern Macher oder zumindest Weicheier, die keine mehr sein wollen, also lass dich nicht abschrecken, falls du eins bist.  Wer‘s noch nicht kapiert hat: Wir sind eine Studentenverbindung, du Blitzmerker. Wenn du Interesse an einem arschbilligen Zimmer und vielleicht sogar an einer Mitgliedschaft hast, schreib gefälligst einem von uns und besuch im besten Fall (das war keine Bitte!) auch unser Instagram corpssaxonialeipzig! Dort gibt’s nämlich noch ein bisschen Bildmaterial. Du bist noch skeptisch? Beweg deinen Hintern hierher und lern uns kennen!  Um uns zu kontaktieren, schreib uns einen kurze Nachricht auf WG-Gesucht, dann können wir über WhatsApp ein Treffen arrangieren.",,0,"Männer-WG, Verbindung, keine Zweck-WG",https://www.wg-gesucht.de/wg-zimmer-in-Leipzig-Eutritzsch.6640750.html,7er WG,Eutritzsch,    20,190 ,https://www.wg-gesucht.de/wg-zimmer-in-Leipzig-Eutritzsch.6640750.html
Mierendorffstraße 42,04318 Leipzig Reudnitz-Thonberg,320,150,17.07.2023,5,"Waschmaschine,Spülmaschine,Terrasse,Garten,Gartenmitbenutzung,Keller,Fahrradkeller",1,2,0," Hey,   in unserem schönen Loft-Haus wird von ca. Mitte Juli bis Mitte Oktober ein Zimmer frei. Der genaue Zeitraum der Zwischenmiete ist flexibel, d.h. du könntest z.B. auch etwas länger (oder kürzer) bleiben.   Wir wohnen in einem dreistöckigen Haus mit vier gleich großen Zimmern. Das frei werdende Zimmer befindet sich im Hochparterre und hat ein riesiges helles Fenster. Das Zimmer geht nach hinten raus, man blickt also auf ein paar Bäume und dahinter auf einen Weg, der eine Verlängerung des Lene-Voigt-Parks ist (in der Regel verweilen dort aber auch im Sommer keine Menschen und es ist sehr ruhig). Aktuell kommt es einem auch eher so vor, als würde man direkt im Wald schlafen. Ich würde das Zimmer möbliert vermieten und den Kleiderschrank für deine Dinge leer räumen.   Deine Mitbewohner*innen sind Adrian, Anna, Jo und Friedi (unsere Katze). Adrian arbeitet als Bauingenieur und ist viel im Home Office. Anna und Jo machen gerade ihre Psychotherapeut*innenausbildung und sind ein Paar. Friedi ist gerne mal für ein paar Tage auf Achse, aber wenn sie zu Hause ist, wird sie auch gernemal durchgekrault. Das WG-Leben ist ziemlich entspannt. Wir kochen ab und zu, treffen uns auf einen Plausch in der Küche oder hängen im Wohnzimmer rum. Wir teilen uns eine Gemüsekiste von einer Solawi, an der du dich beteiligen kannst, wenn du magst. Der große Gemeinschaftsraum mit Küche, Wohnzimmer, Esszimmer und einem Arbeitsplatz ist quasi das Schmuckstück der Wohnung. Er befindet sich im oberen Stockwerk und kann selbstverständlich mitgenutzt werden.   Einen Balkon haben wir leider nicht, aber im ""Garten"" vor dem Haus lässt es sich im Sommer sehr gut aushalten. Ansonsten hat man den Lenepark, das Stötteritzer Wäldchen und den Friedenspark quasi vor der Haustüre. Mit dem Rad (oder der Bahn) ist man in 10 Minuten sowohl in der Innenstadt, als auch auf der Eisenbahnstraße. Bars sind in Laufnähe erreichbar und schräg gegenüber ist ein nettes Café mit sehr gutem veganen Essen und ab und an einer Konzertveranstaltung oder Lesung.   Schreib uns gerne eine Nachricht und komm auf einen Kaffee (o. Ä.) vorbei. Wir freuen uns dich kennenzulernen!  Adrian, Anna, Jo und Janine",,,,1.0,0,"keine Zweck-WG, Internationals welcome",https://www.wg-gesucht.de/wg-zimmer-in-Leipzig-Reudnitz-Thonberg.10000320.html,4er WG,Reudnitz-Thonberg,    14,470 ,https://www.wg-gesucht.de/wg-zimmer-in-Leipzig-Reudnitz-Thonberg.10000320.html
Wurzner Straße 8,04315 Leipzig Neustadt-Neuschönefeld,240,72,23.07.2023,3,Waschmaschine,1,1,0," Das Zimmer ist gemütliche15 m*2 groß und eher länglich geschnitten, mit einer Deckenhöhe von 2.60m. Das Fenster geht nach hinten zum Innnenhof raus, wodurch es meist sehr ruhig auf der Seite ist und man die Straße nicht wirklich hört."," Die Lage der WG ist für Studies ideal. Sie liegt in Neustadt-Neuschönefeld. Die 4 und 7,als Tramlinien, sind nur 3 Minuten entfernt, also quasi direkt vor der Tür und dazu gibt es auch noch drei Buslinien. Mit den Öffentlichen braucht man nur 10 Minuten zum Haupt-Campus, also auch in die Innenstadt. Kaufland und  eine Apotheke sind auch direkt um die Ecke, in weniger als 5 Minuten zu erreichen. Einmal die Straße hoch ist auch ein kleiner Späti, ein Kino und an Essensmöglichkeiten fehlt es hier auch nicht.","Zu unserer WG gehören Toni (21) und ich, Lisa, (21). Tonistudiert Sonderpädagokik im 4. Semester und ist ein sehr aufgeschlossener Mensch der gerne mal feiern geht. ich studiere im 4. Semester Anglistik und Amerikanistik und bin ein eher ruhigerer Mensch. Wir sind keine Zweck WG, machen momentan aber nicht zuuu viel zusammen. Gelegentlich trifft man sich in der Küche oder auf dem Flur und bleibt bei Gesprächen hängen. Dadurch, dass wir uns relativ unterschiedlich ernähren kochen wir nicht zusammen, aber was nicht ist kann ja noch werden."," Uns wär es wichtig, wenn eine offene und aufgeschlossene Person in unsere Wg kommt. Wir leben nach dem Prinzip alles kann, nichts muss. Aber es wäre schön, wenn man nicht nur als Fremde zusammenlebt.  Es wäre nett wenn du erstmal hier über WG Gesucht schreiben würdest und nicht direkt WhatsApp,  damit die Nachricht nicht unter geht  :)",1.0,0,"Studenten-WG, keine Zweck-WG, gemischte WG",https://www.wg-gesucht.de/wg-zimmer-in-Leipzig-Neustadt-Neuschoenefeld.10186431.html,3er WG,Neustadt-Neuschönefeld,    15,312 ,https://www.wg-gesucht.de/wg-zimmer-in-Leipzig-Neustadt-Neuschoenefeld.10186431.html
Wurzner Str.,04315 Leipzig Volkmarsdorf,230,0,22.06.2023,3,,8,7,0," Unser Haus teilt sich in verschiedene Räume: Gemeinschaftszimmer (Fernsehzimmer, Lernsaal, Sportraum ...) und die privaten Räume.   -ca. 10 m² für 230 € Warmmiete  Die Mietkaution beträgt 300 €.  Die Schlüsselkaution beträgt 30€. Also insgesamt 330 €."," Die WG liegt, zentrumsnah, in Leipzig-Ost. Die Straßenbahnhaltestelle „Annenstraße“ ist ca. 100 Meter entfernt. Mit der Tram braucht ihr ca. 12 Minuten bis zum Augustusplatz (Innenstadt). Der Bahnhof Leipzig-Sellerhausen ist 6  Minuten zu Fuß entfernt. Vor der Tür und direkt an der Straße gibt es zudem ausreichend Parkmöglichkeiten.  Auch Einkaufsmöglichkeiten sind in großer Vielfalt entweder zu Fuß oder auch mit der Tram erreichbar. Der Konsum ist zu Fuß innerhalb von 5 Minuten, Kaufland oder REWE innerhalb von 15 Minuten zu erreichen.","Wir wollen keine Zweck-WG sein, sondern schätzen geselliges Beisammensein. Ob im Fernsehzimmer beim Filme schauen oder bei einem ruhigen Bierchen, ist egal. Daher suchen wir jemanden, der gesellig ist und Lust hat, uns kennenzulernen und am gemeinsamen WG-Leben teilzunehmen. Das bedeutet natürlich nicht, dass wir hier alles zusammen machen müssen. Wenn du Zeit für dich brauchst, kannst du dir den Freiraum nehmen. Wir sind hier super offen und aufgeschlossen fürneue Charaktere, weshalb man hier sehr schnell Teil der WG-Gemeinschaft wird, sofern das auch gewünscht ist. Außerdem findet man fast immer einen Ansprechpartner für alle möglichen Probleme oder um gemeinsam etwas zu unternehmen. Auch gemeinsame Kochabende gibt es fast jede Woche mit immer neuen Inspirationen und Ideen.  Besonders zu erwähnen ist, dass wir sehr sportbegeistert sind. Seien es die regelmäßigen Dienstag-Abend-Workouts, Volleyball im Park oder Sportkurse der Universität oder in Vereinen. Sport ist uns wichtig und verbindet uns. Wir planen für den Winter, soweit es die Pandemie zulässt, auch die Teilnahme an kleinen Breitensportturnieren, sodass sich die Möglichkeit gemeinsamer Unternehmungen ergibt. Diese Möglichkeiten werden zusätzlich durch unseren Semesterplan erweitert, der sowas wie internationale Abende, eine Weihnachtsfeier oder Beerpong-Turniere umfasst. Ganz wichtig dabei: Es besteht kein Zwang/keine Pflicht, daran teilzunehmen, wir wollen einfach ein paar schöne gemeinsame Erinnerungen schaffen."," Für uns ist es wichtig, dass du kontaktfreudig, tolerant, engagiert und aufgeschlossen bist. Wenn du dann noch eine Begeisterung für Sport mitbringst oder entwickeln willst, solltest du dich auf jeden Fall bei uns melden!   Wenn wir dein Interesse geweckt haben, schreib uns gern hier und wir finden einen Termin zum persönlichen Kennenlernen.",,0,"keine Zweck-WG, gemischte WG",https://www.wg-gesucht.de/wg-zimmer-in-Leipzig-Volkmarsdorf.9498448.html,16er WG,Volkmarsdorf,    10,230 ,https://www.wg-gesucht.de/wg-zimmer-in-Leipzig-Volkmarsdorf.9498448.html
Braustraße,04107 Leipzig Zentrum-Süd,285,40,01.07.2023,5,Waschmaschine,2,0,0," Das Zimmer zeigt nach Norden, hat ein großes Fenster mit grüner Aussicht Richtung Stadtmitte. In dem Zimmer ist es im Sommer trotz 4. Etage schön angenehm kühl. Auf den ca. 14 qm findet alles nötige und noch mehr gut Platz."," Die Lage der Wohnung ist sehr gut!   Zum Einkaufen befindet sich Aldi direkt gegenüber und ein kleiner Konsum direkt die Straße runter. Da die Wohnung direkt in einer Querstraße der Karli liegt sind Bars und Restaurants direkt um die Ecke und der. Auch zum Clara Zetkin Park braucht man zu Fuß nicht mehr als 15 Minuten und mit dem Fahrrad sowieso noch weniger. Fahrräder können übrigens im Innenhof abgestellt werden.","Deine Mitbewohnerinnen wären Dana und Miri. Dana studiert Grundschullehramt in Halle und pendelt drei Tage in der Wochezwischen Leipzig und Halle. Miri studiert Druck und Verpackungstechnik an der HTWK und arbeitet bereits in diesem Berufsfeld. Wir sind beide offen für nette WG Abende, wobei wir auch gerne mal zusammen kochen oder etwas Essen gehen. Wenn es sich passt gehen wir auch mal zusammen aus, wobei du natürlich gerne dabei sein kannst. Im Sommer sind wir gerne im Park oder fahren mit dem Fahrrad an den Cossi und verbringen dort den Tag. Das Zusammenleben ist im Grunde sehr entspannt und wenn jemand mal seine Ruhe braucht ist das auch kein Problem."," Das Zimmer ist wie angegeben zum 01.07 frei. Da das aber zeitlich etwas knapp ist, ist auch ein Einzug zum 15.07  oder 01.08 möglich. Je nachdem wie es passt.",0.0,0,Studenten-WG,https://www.wg-gesucht.de/wg-zimmer-in-Leipzig-Zentrum-Sued.10071340.html,3er WG,Zentrum-Süd,    14,325 ,https://www.wg-gesucht.de/wg-zimmer-in-Leipzig-Zentrum-Sued.10071340.html
Meißner Str.,04315 Leipzig Neustadt-Neuschönefeld,226,77,01.07.2023,2,"Waschmaschine,Spülmaschine,Balkon,Garten,Keller",0,1,0," Die Wohnung befindet sich im 3. Stock und hat 2 Zimmer, ein Badezimmer, eine Küche, einen Kellerabteil, einen Stauraum im Hausflur, einen benutzbaren Dachboden, einen kleinen Balkon und hat eine Fläche von ca. 67m2.   Das zu vermietende Zimmer hat ca. 17m2 und wird ab dem 01.07 frei. Die Meißner Straße ist eine ruhige Wohnstraße, die parallel zur bekannten Eisenbahnstraße verläuft. Das Zimmer hat zwei große Fenster, durch die es den ganzen Tag hell bleiben kann. Der Laminatboden ist top, die 2 Heizkörper funktionieren einwandfrei und das Zimmer wurde Weiß gestrichen als wir im Juli 2022 eingezogen sind. Das Zimmer ist also in einem guten Zustand.   Die Wohnung zeigt mit Ihren Fenstern Richtung Norden und Süden, also ist es tagsüber immer hell, aber im Sommer vor allem nicht warm. Die Sonne scheint jeden Tag ungefähr 4-5 Stunden auf den Balkon, meistens von 11-16/17 Uhr."," Die Wohnung liegt ziemlich zentral im Osten am Anfang der Eisenbahnstraße. Sie ist gut angebunden - es gibt viele Möglichkeiten mit den Öffis zu fahren, zum Einkaufen, in Parks chillen, Bars besuchen und vieles mehr. In 2 Minuten erreicht man die Haltestelle Einertstr., wo die Trams 1, 3, und die 8 fahren. Wenn man 5 Minuten die Meißnerstr. Richtung Osten langgeht, erreicht man die Hermann-Liebmann-Straße, wo auch die 70 Richtung Süden fährt. Um die Ecke ist auch der Friedrich-List-Platz, wo die 72 fährt. Innerhalb von 10 Minuten Fußweg bietet die Wohnung einen Netto, 2 mal Konsum, im Angebot, einen Rewe, sowie unzählige andere, kleinere Läden und Imbisse auf der Eisenbahnstraße. Parks in Gehnähe gibt es viele, unter anderem den Rabet, den Elsa und den Mariannen Park. Bars und Spätis gibt es im Osten Leipzigs ebenfalls viele, also stellt das auch kein Problem dar.","Ich heiße Carl, bin 22, komme aus Berlin und habe gerade mit meiner Ausbildung zum Ergotherapeuten angefangen. Ich bin bilingual (Deutsch/Englisch) aufgewachsen und habe 7 Jahre in England gewohnt. Ich wohne seit Oktober 2019 in Leipzig. Ich würde mich schon als ein ziemlich gelassener, offener Mensch beschreiben. Ich höre mir immer gerne an wie du dich fühlst, was dich stresst, was dichhappy macht und frage auch meistens immer nach - respektiere aber auch deine Grenzen! Zeit für mich verbringe ich gerne mit Zeichnen, Zocken oder mal einen hauen. Ich bin viel draußen unterwegs und verbringe gerne Zeit mit meiner NachbarWG, die 20 Sekunden weit weg wohnen. Im Moment liegt mein Fokus auf die Ausbildung und darauf, einer WG zu gründen, in der ich spaß haben kann und mich wohl fühle. :)  Und damit wir uns in diesem Space wohlfühlen können, müssen wir auch auf ein paar Sachen achten. Keine Nazis. Ich will dass Grenzen und Bedürfnisse geäußert und respektiert werden können. Gewaltfreie, offene Kommunikation ist das wichtigste. Wenn wir uns hier einig sind, haben wir schon eine gute Grundlage für eine nice WG. Wie ihr oben schon hoffentlich gelesen habt bin ich ziemlich gelassen, bin aber dadurch etwas durcheinander und verpeilt. Temporäre Unordnung ist also für mich kein Thema, aber ich will dass sauber gewohnt wird. Mich würde es freuen, wenn du auch Spaß am Kochen hast und gerne auf dem Balkon chillst und ein bisschen quatschen möchtest. Zusammen hängen, mal ein Filmchen schauen, im Park picknicken und Spaziergänge sind immer gute Ideen. Ich würde mich freuen wenn ihr eine Frage beantworten könntet: Was für ein Getränk wärst du und wieso? Würde mich auf eine Antwort freuen, schreibe auch gerne was über dich! Ich habe vor, die Wohnung richtig schön zu gestalten und dazu brauche ich jemanden, der kreative Impulse mit sich bringt und sich vor ein bisschen Handwerk nicht zurückscheut. Ich würde z.B gerne die Küchenwand bemalen und das Badezimmer kreativer gestalten. Wenn dir sowas Spaß macht und du Bock auf eine schöne Wohnung hast, melde dich gerne."," Eine weitere Voraussetzung ist, dass Ihr Hunde wenigstens Dulden könnt, im besten Falle aber mit denen gut klarkommt. Meine jetzige Mitbewohnerin besitzt nämlich einen kleinen Hund, der bestimmt 1/2 mal im Monat hier übernachten wird. Tamino ist ein ruhiger, zutraulicher, verspielter kleiner Hund und chillt meistens einfach im Bett. Dennoch ist der Süße 24/7 offen für Streicheleinheiten. Er ist gerade noch hier also werdet ihr den kleinen bestimmt auch kennenlernen. ;)",1.0,0,"gemischte WG, inklusive WG, WG-Neugründung",https://www.wg-gesucht.de/wg-zimmer-in-Leipzig-Neustadt-Neuschoenefeld.10118778.html,2er WG,Neustadt-Neuschönefeld,    18,353 ,https://www.wg-gesucht.de/wg-zimmer-in-Leipzig-Neustadt-Neuschoenefeld.10118778.html
Waldstraße 4,04105 Leipzig Waldstraßenviertel,610,35,01.07.2023,1,,0,2,0," Das hier angebotene Zimmer (Schlafen 2) ist in eine frisch sanierte, klassische Altbauwohnung eingebettet und ist zum ruhigen Hinterhof hin ausgerichtet. Auch wenn es ""nur"" 16 qm sind, bietet die Wohnung in ihrer Gesamtheit, auch durch die zwei gemeinschaftlich genutzten Zimmer und einen Kellerraum, genügend Platz um alles unterzubringen, was man so brauchen kann.   Durch die großen Fenster ist die Wohnung sehr schön hell, es gibt Parkett in der ganzen Wohnung und die Deckenhöhe beträgt 3,8 Meter. Nebst den schon angesprochenen beiden Gemeinschaftsräumen ist die Wohnung mit 2 vollwertigen Bädern ausgestattet und hat, den französischen Balkon vom ""Zimmer 1"" mitgerechnet, 3 Balkone. In der Wohnung sind Klimaanlagen verbaut, auch wenn wir erwarten, diese nicht nutzen zu müssen. Des Weiteren steht uns der weitläufige Hinterhof zur Verfügung, der mit frischem Rollrasen und einer hölzernen Terrasse, die noch nicht ganz fertig gestellt ist, zu gemeinsamen Grillabenden einlädt."," Die Lage könnte besser nicht sein. Wir sind im wunderschönen Waldstraßenviertel, direkt am Waldplatz zwischen Bahnhof und Stadion, zwischen Rosenthal und Clara-Park. Alles ist super zu erreichen, sowohl mit Tram als auch zu Fuß oder bevorzugt mit dem Rad.  Fahrräder können im Innenhof oder im Keller abgestellt werden. Parken ist im Innenhof möglich, kostet allerdings 75€ extra. Die Zufahrt zum Innenhofist verschlossen und kann nur von Mieter:innen geöffnet werden. Zusätzlich ist der Durchgang zum Innenhof videoüberwacht.","Wir gründen die WG neu, daher muss sich alles noch ein wenig einspielen. Ziel ist es jedoch, ein harmonisches Zusammenleben zu schaffen, passend zum wundervollen Wohnraum, den wir angemietet haben.  Aktuell besteht die WG aus:  Julius, 30, arbeitet als Consultant. Julius geht gern raus zum Frisbee, Spikeball oder Volleyball spielen oder fährt ne Runde Rad. Ansonsten wird gerne gekocht.  Robert, 31, arbeitet im Süden von L als Qualitätsingenieur. Robert macht gerne Musik (Kla4, Seiteninstrumente oder auch mal etwas elektronisch) fährt viel Rad und ist für sonstige sportliche Aktivitäten immer zu haben. Ansonsten geht er auch gerne zu elektronischer Musik tanzen.  Wir wünschen uns Mitbewohner:innen, die aufgeschlossen sind, idealerweise WG-Erfahrung haben und sich in das WG-Leben einbringen und mitgestalten."," Die Preise können sich noch leicht in alle Richtungen ändern. Wir haben noch nicht alle Versorgerverträge abgeschlossen. Das wird aber bis zum 01.07. aller erledigt sein. Bisher ist die Wohnung noch leer, es werden also einige Anschaffungskosten auf uns zukommen. Die Hausverwaltung ist super nett und kümmert sich. Es wird gewünscht, dass jede:r Mitbewohner:in als Hauptmieter mit in den Vertrag aufgenommen wird. Dementsprechend werden Gehaltsnachweise etc. von der Hausverwaltung verlangt.",1.0,0,"Business-WG, keine Zweck-WG, gemischte WG, WG-Neugründung",https://www.wg-gesucht.de/wg-zimmer-in-Leipzig-Waldstrassenviertel.10191410.html,4er WG,Waldstraßenviertel,    16,645 ,https://www.wg-gesucht.de/wg-zimmer-in-Leipzig-Waldstrassenviertel.10191410.html
Johannes-R.-Becher Straße 5,04279 Leipzig Lößnig,245,0,22.06.2023,2,,0,0,0," - 21 m2 Zimmer mit Bett, Schrank, Schreibtisch, Regal  - Wohnung mit Küche und Bad"," - 2 min zur Haltestelle Moritz Hof (innerhalb von 10-15) Minuten mit der Straßenbahn am Augustusplatz  - direkte Nähe zum Studentenclub A4  - Einkaufsmöglichkeiten (Rossmann, Konsum Leipzig, Netto,…) direkt gegenüber  - 5 Minuten zum Großen Silbersee","Meine Mitbewohnerin und ich sind beide schon vorEnde der Mindestwohndauer aus dem Studentenwohnheimheim ausgezogen, da sich die Möglichkeit ergab, mit Freunden in eine eigene WG zu ziehen.  Ich suche nun eine Nachmieterin bzw. einen Nachmieter für mein WG Zimmer, der/die bis mindestens Oktober einziehen würde."," Wichtig ist, dass die Person immatrikuliert ist an der Uni Leipzig bzw. an einer anderen Leipziger Hochschule, da die Wohnung vom Studentenwerk ist.",0.0,0,Studenten-WG,https://www.wg-gesucht.de/wg-zimmer-in-Leipzig-Loessnig.10191444.html,2er WG,Lößnig,    21,245 ,https://www.wg-gesucht.de/wg-zimmer-in-Leipzig-Loessnig.10191444.html
