Street,Address,rent_cold,additional_cost,free_from,distance,gadgets,female_roommates,male_roommates,divers_roommates,room_description,location_description,flat_live,additional,smoker,accessible,kind_of_flat,Url,type,district,size,price,link
Kurt-Eisner-Str,04275 Leipzig Südvorstadt,350,0,09.04.2023,2,"Waschmaschine,Spülmaschine,Keller,Fahrradkeller",3,2,1," Da ich für einen Monat nicht in Leipzig bin, wird mein Zimmer zwischen April und Mai untervermietet.   Das Zimmer ist vollständig möbliert, aber werde natürlich Schubladen etc. leer räumen, damit du dich für die Zeit entfalten kannst :-)   Es gibt zwei Badezimmer, von denen eins auch über eine Badewanne verfügt. Im Flur haben wir eine Hochebene als Schlafmöglichkeit für Gäste gebaut. Außerdem gibt es einen Fahrradkeller und einen trockenen Abstellkeller."," Wir haben einige Busse (60 und 74) ums Eck, die Tram auf der Karl-Liebknecht-Straße (10/11) ist auch zu Fuß nicht weit und mit dem in Leipzig unersetzlichen Rad kommt der Mensch sowieso überall fix hin, aber die WG liegt so zentral, dass es ganz unabhängig von der Fortbewegungsart ziemlich gute Verbindungen für alles gibt. Gleich angrenzend sind die Trabrennbahn und der Clara-Park, der Focke-Berg und der Auwald sind n Katzensprung entfernt. An Grün wird es dir sicher nicht mangeln.","Wir leben zu siebt mit viel Platz in einer WG. Gemeinschaftliches/familiäres Leben wird hier groß geschrieben undInteresse daran solltest du schon mitbringen. Es herrscht Kühlschrankkommunismus für 120€ Beitrag im Monat. Eingekauft wird vorwiegend Bio, gekocht wird meist vegan oder zweigleisig (vegan+veggie), da zwei Veganer*Innen in der WG leben.  Du wirst aber nicht gekreuzigt, wenn du auch mal Fleisch zubereiten willst. Von der WG-Kasse wird auch unsere Biokiste von der SoLaWi finanziert. Unsere Wegekreuzen sich täglich in unserem pompösen Wohn- und Esszimmer, denn zusammen lässt sich das Leben einfach besser zelebrieren als alleine. Thema Zelebrieren: An Wochenenden sitzen wir auch gerne mal etwas länger zusammen, wobei sich im Sommer natürlich alles eher nach draußen verlagert. Darüber hinaus haben wir mittlerweile noch zwei flauschige Mitbewohner namens Mucke und Meeko, solltest du also eine Allergie gegen Hunde(-haare) haben. Jede*r hat hier so seinen eigenen Alltag, wir sind teils studierend oder arbeitend in welcher Form auch immer. Abends läuft das ganze dann aber eben fast immer in der Küche zusammen.  Sekt und Lazy Sunday gehören eben auch zum Leben dazu:)  Thema rauchen: Wir rauchen sowohl im Zimmer als auch in der Küche (dort ab 16.20 Uhr Nachmittags). Die letzten Menschen abends/nachts in der Küche lüften dann immer einmal ordentlich durch. Das klappt soweit auch recht gut, vor allem da wir selbst keine Gelüste haben in einer Dauerqualmwolke zu leben. In meinem Zimmer während ich weg bin, bitte nicht rauchen.  Die Nachbarschaftssituation ist hier sehr komfortabel: Neben 3 anderen WGs, mit denen wir gut vernetzt sind, gibt es im Haus eigentlich nur Büros, die am Wochenende leer sind und auch unter der Woche maximal unkompliziert sind. Im Keller ist noch eine Musikschule und im Dach Ateliers."," Bei uns finden Nazis und Verschwörungstheoretiker*innen kein Zuhause.  Faschismus, Rassismus, Sexismus...nein danke. Go read a book!",1.0,0,"Studenten-WG, keine Zweck-WG, gemischte WG, Vegetarisch/Vegan",https://www.wg-gesucht.de/wg-zimmer-in-Leipzig-Suedvorstadt.9745545.html,7er WG,Südvorstadt,    22,350 ,https://www.wg-gesucht.de/wg-zimmer-in-Leipzig-Suedvorstadt.9745545.html
Arno-Nitzsche-Str,04277 Leipzig Connewitz,290,0,31.07.2023,3,"Waschmaschine,Spülmaschine,Garten,Keller,Fahrradkeller",0,2,0," Hi,   ich vermiete mein gemütliches WG Zimmer für August und September unter.   Ich würde dir meine Kommoden frei räumen, damit du Staufläche hast. Ich freue mich, wenn du meine Pflanzen gießt :)  I'm renting out my cosy room for August and September.   I would clear out my dressers for you so that you have storage space."," Wir wohnen in Connewitz am Wiedebachpark. Chilliger Park und nicer Späti um die Ecke, Einkaufsmöglichkeiten, Öffis, Wald und co sind alles fußläufig zu erreichen. Mit dem Fahrrad in 15 min im Zentrum oder im Osten oder Westen. Und in 20 min mit dem Fahrrad am Cossi oder am Markkleeberger See!!!  We live in Connewitz at Wiedebachpark. Chilly park and nice Späti around the corner, shopping facilities, public transport, forest and co are all within walking distance. By bike it's 15 minutes to the centre or to the east or west.  And in 20 min by bike at the Cossi or at the Markkleeberger See!!!","Du würdestmit Milan und Solomon leben. Manche studieren, manche arbeiten, wir sind alle in ein bisschen unterschiedlichen Lebenssituationen. Die beiden machen gerne Musik. Es ist ein entspanntes Miteinander in der Wohnung, manchmal hängen wir gemeinsam rum, sonst gehen aber auch alle ihrem individuellen Alltag nach. Das Haus ist sehr freundlich, es gibt einen hübschen Garten hinter dem Haus. Da Solomon aus der UK kommt, sprechen wir miteinander Englisch. You would live with Milan and Solomon. Some study, some work, we are all in a bit different life situations. They both like to make music. It's a relaxed togetherness in the flat, sometimes we hang out together, but otherwise we all go about our individual daily lives. The house is very friendly, there is a nice garden behind the house. As Solomon is from the UK, we speak English with each other."," Melde dich einfach bei uns, dann können wir genauer über alles quatschen!  Just get in touch with us, then we can chat about everything in more detail!",,0,,https://www.wg-gesucht.de/wg-zimmer-in-Leipzig-Connewitz.10148223.html,3er WG,Connewitz,    20,290 ,https://www.wg-gesucht.de/wg-zimmer-in-Leipzig-Connewitz.10148223.html
Nürnberger Straße 42,04103 Leipzig ,295,0,01.10.2023,2,"Waschmaschine,Keller,Fahrradkeller",4,0,0," Das Zimmer ist möbliert mit Bett und Matratze, Kleiderschrank, Regal und Schreibtisch mit Stuhl. Außerdem bleibt auch noch etwas Platz für kleinere eigene Möbelstücke. Dank des großen Fensters und der Ausrichtung nach Westen wird es selbst im Winter nicht zu dunkel und im Sommer nicht zu warm im Zimmer.   Die WG teilt sich die Küche und zwei Bäder jeweils mit Toilette, Waschbecken, Dusche und Handtuchheizung.   Einen Fahrstuhl zur WG im 6. Stock gibt es leider nicht, aber das hält fit. ;)  Im Keller gibt es einen Waschraum, weitere Mehrzweckräume und einen Fahrradkeller.  Im Wohnheim befindet sich außerdem auch der STUK, zudem du kostenlosen Eintritt habt! Oben hört man davon kaum etwas :)  Weitere Informationen zum Wohnheim und einen Grundriss gibt es auf der Internetseite des Studentenwerks:   https://www.studentenwerk-leipzig.de/wohnen/studentenwohnheime/nuernberger-strasse-42-48-bruederstrasse-26"," Die WG liegt in unmittelbarer Nähe zum Bayrischen Bahnhof (Bus, Tram, S-Bahn) und zum UKL.   Zum Zentrum und zum Hauptcampus sind es 10 Minuten zu Fuß.   Direkt um das Wohnheim sind Aldi, Edeka, DM, eine Apotheke und ein Dönerladen, falls du nach 21 Uhr noch Hunger bekommt :)  Der Friedenspark ist auch ganz in der Nähe und schön zum Grillen mit Freunden.","Wir sind 4 Mädels (Charlotte, Annika, Sophie & Alma). Alma (23) kommt aus der Schweiz, studiert im Master Biologie und wohnt seit einem halben Jahr hier. Annika (20) kommt aus Leipzig,studiert Zahnmedizin und wohnt seit 2 Jahren in der WG. Sophie (20) kommt aus Stralsund, studiert Internationales Management und wohnt seit Oktober 2022 im Wohnheim. Charlotte (19) kommt aus Magdeburg, studiert Lehramt fürs Gymnasium und wohnt auch seit einem Jahr in der WG. Wir suchen eine Mitbewohnerin, die gerne für eine längere Zeit bei uns einziehen möchte und mit der wir viel Spaß haben können. Gerne wollen wir gemeinsame Abende im Park oder in den Bars auf der Karli miteinander verbringen. :)  Uns ist wichtig, dass Küche und Bad ordentlich und sauber sind. Gerne kannst du dich auch in die Gestaltung der Wohnung mit einbringen."," ACHTUNG - da es sich um ein Wohnheimzimmer des Studentenwerks handelt, gibt es ein paar Besonderheiten:   Der Mietpreis (295€) beinhaltet alle Kosten, also Warmmiete, Strom und sogar einen Kabel-Anschluss für TV und einen Internetzugang (600 GB/Monat). Es gibt also keine zusätzlichen Nebenkosten :)  Nur an einer Leipziger Hochschule/Universität immatrikulierte Studenten können ein Platz im Wohnheim mieten (man muss also schon immatrikuliert sein!). Außerdem kann ich als Nachmieterin nur eine Person angeben, die neu in ein Wohnheim des Studentenwerks Leipzig zieht (Umzüge gehen nur über einen Umzugsantrag).   Wenn du Interesse an dem WG-Zimmer hast, dann schreibt uns und erzählt uns ein bisschen von euch. Wir freuen uns!  Charlotte, Annika, Sophie und Alma   Bilder vom Zimmer folgen noch :)",0.0,0,"Studenten-WG, Frauen-WG",https://www.wg-gesucht.de/wg-zimmer-in-Leipzig.10143344.html,5er WG,,    12,295 ,https://www.wg-gesucht.de/wg-zimmer-in-Leipzig.10143344.html
Arndtstraße 37,04275 Leipzig Südvorstadt,679,195,01.07.2023,1,"Waschmaschine,Spülmaschine,Balkon,Keller",,,," Hallo liebe Suchende,  schweren Herzens ziehe ich aus meiner Wohnung in der Südvorstadt aus und suche daher einen Nachmieter zum 01.07.2023. Ein späterer Einzug ist theoretisch auch möglich. Meldet euch gerne per Telefon oder Nachricht, falls ihr Interesse habt und die Wohnung besichtigen wollt. Die Wohnung ist für eine oder zwei Personen gut geeignet :)  Freue mich von Euch zu hören!  Über die Wohnung:  Die hier angebotene geräumige 2 Raum Wohnung befindet sich in zentraler Lage im Hochparterre eines liebevoll sanierten Altbaus. Bei der Sanierung wurde insbesondere auf die Erhaltung historisch wertvoller architektonischer Details Wert gelegt. Die umfassende Sanierung und Modernisierung des Objektes erfolgten im Jahr 2003, seither wurde das Objekt mit viel Engagement in Stand gehalten.  - 1 großer Flur  - 1 Bad mit Wanne und WC  - 1 Küche mit Einbauküche und Waschmaschine  - 1 Keller  - 1 Balkon  - 24h Hausmeisterdienst  - Laminatfußboden in allen Wohnräumen  - Fliesen inKüche und Bad"," Die Leipziger Südvorstadt ist ein unmittelbar südlich an das Zentrum angrenzender Stadtteil, der sowohl bei Bewohnern als auch bei Besuchern der Stadt sehr beliebt ist. Kein Wunder, denn hier wohnt man zentrumsnah und zum größten Teil in schönen sanierten Gründerzeithäusern. Insgesamt gilt der Stadtteil mit dem südlich angrenzenden Connewitz als bunt gemischt geprägtes Szeneviertel. Die Karl-Liebknecht-Straße, auch liebevoll ""Karli"" genannt, bildet das Zentrum der Leipziger Südvorstadt. Hier findet man fast ausschließlich kleine Geschäfte, Cafés, Bars, Kneipen und Restaurants. Beim Shopping in den Szeneläden auf der ""Karli"" findet jeder etwas nach seinem Geschmack. In den zahlreichen Freisitzen kann man von früh bis spät gemütlich essen und trinken. Die ""Karli"" ist eine Straße mit Zukunft: individuell, traditionell, jung und sehr besonders! Der Stadtteil verfügt über eine gute Infrastruktur und man benötigt meist nur wenige Gehminuten zum Ziel. Der Anschluss an das Leipziger Nahverkehrsnetz ist sehr gut, so verkehren die Straßenbahnlinien 10 und 11 auf der Karl-Liebknecht-Straße mindestens im 10 Minuten-Takt.",,,,0,,https://www.wg-gesucht.de/wohnungen-in-Leipzig-Suedvorstadt.10148142.html,2-Zimmer-Wohnung  ,Südvorstadt,    60,874 ,https://www.wg-gesucht.de/wohnungen-in-Leipzig-Suedvorstadt.10148142.html
Demmeringstraße,04177 Leipzig ,320,0,01.07.2023,4,"Waschmaschine,Spülmaschine,Balkon,Keller,Fahrradkeller,Aufzug",1,3,0.0," Bei dem Zimmer handelt es sich um das kleinste der Wohnung, jedoch bietet unsere riesige Wohnküche viel Platz zum Ausgleich!  Wenn du dein Zimmer verlässt, betrittst du einen sehr großen Flur mit Leseecke / Lounge und einer Dartecke. Außerdem haben wir noch eine recht große Abstellkammer, die von allen für Kram, der es nicht ins Zimmer geschafft hat, mitbenutzt werden kann. Für weiteren Kram gibt es auch ein Kellerabteil. Die Wohnung wurde kürzlich renoviert und hat neben einem Badezimmer mit Dusche, Wanne und Bidet noch zwei Gäste-WCs (wovon wir eins als Wäschekammer nutzen). Dein Zimmer wird wie die gesamte Wohnung mit Fußbodenheizung geheizt. Das absolute Highlight an unserer Wohnung ist *Trommelwirbel* unsere Wohnküche mit angrenzendem Balkon, in der wir nicht nur viel Platz zum Kochen haben, sondern auch gemeinsam mit Freund:innen Mate, Bier oder was auch immer trinken können. Mittlerweile steht da auch eine zweite sehr schöne Couch, das Bild ist leider noch nicht aktuell!"," Generell finden wir hier alles was wir brauchen:  - Keine 5 Gehminuten entfernt befindet sich der Lindenauer Markt, der eine gute ÖPNV-Anbindung, mehrerer Essens- und Einkaufsmöglichkeiten (2 x die Woche Wochenmarkt, Kaufland, Dm und 2 Bäcker und Bankautomaten (Sparkasse, Volksbank, Commerzbank)) bietet  - Falls Du mal genug hast vom Großstadtwahnsinn, bist du in 5-10 min. im Auenwald, der Kaos-Villa oder im Palmengarten  - Wir wohnen zwischen Karl-Heine-Straße und Georg-Schwarz-Straße, wo es mehr als genug Bars, Kneipen (""Am Kanal""!) Second-Hand-Läden und Restaurants gibt  - Unser Kiez wartet außerdem mit einem Highlight auf: das ""Im Angebot"", ein supergünstiger Supermarkt mit einer Auswahl an Produkten, die du bestimmt zum Teil noch nie gesehen hast   - Der Südflügel der Wohnung ist zur Straße hin und damit auch auf die dort verlaufenden Tramschienen ausgerichtet (Tram 7). Falls du nicht sehr lärmempfindlich bist, sollte das jedoch kein Problem sein, wir kommen gut damit klar und die Fenster sind auch gut gedämmt :)","Wir vier, die teilweise seit über drei Jahren hier gemeinsam wohnen, das sind:  Alex (27) und Lux (26) wohnen schon seit 2019 in der Demmering. Omar (26) ist seit Februar 22 bei uns in der WG. Gretha (25) ist im März dieses Jahres dazugestoßen, da ihr Referendariat leider nicht wie geplant in Leipzig statt finden kann, muss sie uns nun schweren Herzens wieder verlassen. In wenigen Tagen erwarten wir zudem noch Lisa, die ein anderes Zimmer neu beziehen wird!  Deine Mitbewohner:innenim Schnelldurchlauf:  Das Privileg des größten Zimmers räumt Lux die Möglichkeit ein, ein kleines Sammelsurium an Musikinstrumenten zu beherbergen. Von Zeit zu Zeit und in verschiedenen Konstellationen wird hier gejamt, Unfug getrieben oder in diverser Literatur gestöbert. Ansonsten verbringt Lux die Vormittage in der Kita als Integrationshelfer und die Nachmittage mit diversen Musen. Omar ist ein sehr entspannter und meist ausgeglichener Mitbewohner, der gerne Zeit in seinem zu Hause/Zimmer verbringt. Ein großer Teil seiner Freizeit nimmt die Musik ein, da er als Techno DJ und Produzent tätig ist. Er ist nach Leipzig gekommen, um hier eine Ausbildung zum Hörakustiker zu machen. Alex bewegt sich zwischen Berlin und Leipzig und ist viel unterwegs. In Berlin, wo seine Freundin lebt, arbeitet er für eine NGO direkt am Kotti. Das letzte Jahr war er nach seinem Bachelor viel in Europa unterwegs. Seit Oktober studiert er im Master und freut sich darüber wieder mehr Zeit in Leipzig zu haben und kann es kaum erwarten, den Sommer in Leipzig auf dem Rad, am See, an der Tischtennisplatte und mit Bier im Park zu verbringen. Unsere neueste Mitbewohnerin Lisa stößt in wenigen Tagen zu uns und ist gerne auf Achse, und tingelt zwischen Nachtleben und einem Studium der sozialen Arbeit.  Wir versuchen uns allen den Raum zu geben, den wir gerade brauchen und ermöglichen können, was in der Vergangenheit auch gut geklappt hat. Wir haben alle ein Stück weit unser eigenes Leben, Friends etc., aber stecken auch gern mal die Nase in die Welt der andern und bereichern uns so gegenseitig. Wenn es passt, freuen wir uns über gemeinsames Essen, frisch gepressten Orangensaft (mit Orangen aus dem Angebot) oder einen kleinen Ausflug zusammen. Auf die drückenden Bässe unserer WG-Partys mussten unsere Nachbar:innen pandemiebedingt lange Zeit leider verzichten, aber wir geben erdgeschossbedingt nach wie vor die Pakete weiter und diskutieren anlässlich hin und wieder über das Dasein als Paketbot:in. Wir würden uns über einen Menschen freuen, der Lust hat in einer Gemeinschaft zu wohnen und trotzdem eigenständig ist. Einen Menschen, der um die eigenen Bedürfnisse weiß, die der anderen respektieren kann und ab und an auch mal uns oder sich selbst nicht zu ernst zu nehmen weiß. Wir freuen uns auf dich!"," Wir suchen vorwiegend nach FLINTA Personen.   Schreib uns gerne eine Nachricht und erzähl dabei ein bisschen von dir und was du so in Leipzig machst. Wir freuen uns auf dich :)",1.0,0,"Studenten-WG, keine Zweck-WG, gemischte WG, Vegetarisch/Vegan, Internationals welcome",https://www.wg-gesucht.de/wg-zimmer-in-Leipzig.7662140.html,5er WG,,    10,320 ,https://www.wg-gesucht.de/wg-zimmer-in-Leipzig.7662140.html
Holbeinstrasse 5a,04229 Leipzig Schleußig,180,20,15.06.2023,3,"Garten,Haustiereerlaubt",2,1,0.0," Ein kleines süßes Zimmer, wobei das Hochbett einiges an Platz spart."," Wir wohnen direkt in der Nähe der Haltestelle Holbeinstrasse und sehr nah am Park, bis zur  Sachsenbrücke ist es nicht weit. Diverse Bioläden sind gleich um die Ecke. Mit dem Rad oder der Tram ist man schnell in der Stadt, in Lindenau oder auch am See. Die Straße ist bis auf gelegentliche Bauarbeiten auch sehr ruhig und grün! :)","Hallo! Wir sind Stefan, Gerda (3 Jahre alt und Stefans Tochter), Helene und Luka.Zunächst ein paar Worte zu jedem von uns, damit du weißt mit wem du zusammenwohnen würdest:Stefan arbeitet an der HTWK, bastelt gerne an Projekten, wie Faltbooten, Transporter umbauen und hat einen gemeinschaftlichen Garten in der Nähe, wo wir immer wieder auch gerne Zeit verbringen. Er ist mehr oder weniger gut strukturiert und geht früh zu Bett.Helene studiert Soziale Arbeit in Merseburg, ist viel draußen, macht dabei gerne Sport (Inlinern am See, Laufen, Klettern) und ist auch oft unterwegs, um Freunde zu treffen.Luka studiert Psychologie im Master, ist gern draußen, meditiert, macht Yoga, kocht leckere vegane Speisen und verkrümelt sich auch gern mal früh ins Bett. :) Wir sind gern gemeinschaftlich unterwegs und würden gern noch mehr Gemeinschaft leben und zusammen kochen (vegan :)), Ausflüge machen, Zeit in der WG verbringen, was spielen, bauen, diskutieren, lesen... Wir versuchen generell auf Nachhaltigkeit zu achten und immer wieder im Unverpacktladen & Bio zu kaufen,...:) Momentan teilen Stefan und Luka sich auch das Essen und Kochen oft gmeinsam, wo du auch gerne mit einsteigen kannst, wenn du Lust drauf hast.Jeder braucht auch regelmäßig Zeit für sich und gerade im Sommer sind tatsächlich auch einige von uns unterwegs, aber generell wäre es schön wenn du Interesse mitbringst am WG-Leben teilzunehmen. :)Da Jonas noch nicht sicher weiß ob er nach den 4 Monaten wieder hier zurückkommen wird, besteht die Möglichkeit, wenn es für dich und uns passt, dass du auch langfristig hier wohnst!Wir freuen uns dich kennenzulernen, wenn dich das anspricht! Und schreib uns gern ganz zu Beginn dein Lieblingsgemüse, dann wissen wir dass du unsere Anzeige gelesen hast! :)"," Wir haben einen Garten im Hinterhof, in dem man gut in der Hängematte liegen kann und ein bisschen Natur in der Stadt tanken kann. :)",0.0,0,"keine Zweck-WG, Vegetarisch/Vegan",https://www.wg-gesucht.de/wg-zimmer-in-Leipzig-Schleussig.10080997.html,4er WG,Schleußig,    9,200 ,https://www.wg-gesucht.de/wg-zimmer-in-Leipzig-Schleussig.10080997.html
Kurt Eisner Straße,04275 Leipzig Südvorstadt,420,80,07.06.2023,1,"Waschmaschine,Spülmaschine,Terrasse,Balkon,Garten,Keller,Fahrradkeller,Aufzug,Haustiereerlaubt",1,1,0.0," Hallo,  Wir (Jana 33 und Sören 34) suchen eine*n neue*n Mitbewohner*in für unsere schöne WG in der Südvorstadt.  Die Lage ist exzellent, der Bus fährt vor der Tür, die Karli ist 3 min zu Fuß entfernt , Einkaufsmöglichkeiten Konsum, Lidl etc.  Die Wohnung ist im 4. OG (Aufzug, keine Sorge) hat eine große Wohnküche mit Terrasse und einen kleinen Extrabalkon.   Dein Zimmer ist c.a. 15qm groß, hat ein Deckenlicht sowie ein großes Fenster zur Straße raus. Da wir viel Zuhausezeit in dem gemeinsamen Wohnraum verbringen, wünschen wir uns eine*n Mitbewohner*in die Lust an einem gemeinsamen WG Leben mitbringt. Unkompliziertheit und Toleranz sind uns wichtig, wir versuchen Probleme offen anzusprechen und legen nicht jedes Wort auf die Goldwage.   Deine Pronomen, kulinarischen oder sexuellen Vorlieben sind uns völlig egal.  Jana ist in der Hotelbranche tätig, spiel gern Squash, liebt selbstgebackene Zimtschnecken, hat ab und zu royalen Pudelbesuch namens Lord Leopoldund nun auch eingesehen, dass man ums Rennrad fahren in Leipzig nicht drum rum kommt.  Sören arbeitet als Mediziner in der Klinik, fährt sogar gern Rennrad und verschleppt jedes Jahr erneut die fällige Insolvenz seiner Tauchschule.  Wenn uns langweilig wird machen wir gern spontane Ausflüge zur Stammkneipe, auf Konzerte, zur Leipziger Esoterikmesse oder aber auch nach Breuna, Borcha, Bölitz, Brandau, Böhrlau, Brächswitz, Bochhwollschlitz, Blähwitz oder Bobo.  Das Einzugsdatum ist verhandelbar. Es liegt uns viel daran eine Person zu finden  mit der wir uns ein harmonisches Zusammenleben vorstellen können.  Liebe Grüße,  Jana und Sören"," 500 Meter zum Park, 25 Minuten Fahrrad zum See,  15 Minuten in die Innenstadt.","Kein Thermomix, keine Salatschleuder."," Der genaue Mietpreis kann noch um +- 20 Euro variieren, die Miete richtet sich ein wenig nach der Größe der jeweiligen Einzelzimmer und dem wirtschaftlichen Vermögen.  Größere Nachzahlung sind hochgradig unwahrscheinlich. Die Miete ist aktuell für 2,5 Jahre stabil.",1.0,0,"Studenten-WG, keine Zweck-WG, gemischte WG",https://www.wg-gesucht.de/wg-zimmer-in-Leipzig-Suedvorstadt.8245436.html,3er WG,Südvorstadt,    15,500 ,https://www.wg-gesucht.de/wg-zimmer-in-Leipzig-Suedvorstadt.8245436.html
Erdmannstraße 11,04229 Leipzig Plagwitz,490,0,03.08.2023,5,"Waschmaschine,Spülmaschine,Fahrradkeller",0,1,0.0," Hallo! Ich biete mein Zimmer vom 1. August bis 17. September zur Zwischenmiete an. Die Umzugsdaten sind flexibel. Du kannst auch nur August für 320 € mieten.   Das Zimmer ist 16qm groß und voll möbliert mit Bett, Schreibtisch, Regal, TV, Stuhl etc.  Die Küche und das Bad sind ebenfalls komplett eingerichtet (mit Geschirrspüler und Waschmaschine). Diese werden mit meinem netten Mitbewohner Christian gemeinsam genutzt. Ich werde dir natürlich Platz für deine Sachen schaffen! Und falls ich es schaffen sollte, es rechtzeitig zu reparieren, steht auch mein Fahrrad zur Verfügung :)"," Die Wohnung ist sehr schön gelegen mit Palmengarten, Weißer Elster und Clara-Zetkin Park quasi direkt nebenan. Auch die Karl-Heine Straße mit verschiedenen Bars und Restaurants ist nichtweit entfernt.  Zum Einkaufen sind Aldi und Rewe am nächsten gelegen, im weiteren Umfeld gibt es auch Kaufland, Edeka, Lidl sowie Bio- und Unverpackt-Läden. Ein Späti ist auch direkt nebenan :)  Der ÖPNV ist über Nonnenstraße oder Felsenkeller in 3-5 Minuten zu erreichen. Mit dem Fahrrad kommt man in 15-20 Minuten bis mitten ins Stadtzentrum.","Du wirst die Zeit mit Christian in der WG wohnen, ein freundlicher und humorvoller Philosophiestudent, mit dem man immer faszinierende Unterhaltungen mit einem Glas Wein haben kann."," Schreib mir ein paar Zeilen über dich und was du in Leipzig vorhast und wir können ein Video-Telefonat (mit Skype oder Zoom) vereinbaren :)  Ich freue mich auf deine Nachricht!  Liebe Grüße, Krasna",0.0,0,"Studenten-WG, Frauen-WG",https://www.wg-gesucht.de/wg-zimmer-in-Leipzig-Plagwitz.9889958.html,2er WG,Plagwitz,    16,490 ,https://www.wg-gesucht.de/wg-zimmer-in-Leipzig-Plagwitz.9889958.html
