Street,Address,rent_cold,additional_cost,free_from,distance,gadgets,female_roommates,male_roommates,divers_roommates,room_description,location_description,flat_live,additional,smoker,accessible,kind_of_flat,Url,type,district,size,price,link
August-Bebel-Straße,04275 Leipzig Südvorstadt,325,0,22.06.2023,3,"Waschmaschine,Spülmaschine,Balkon,Fahrradkeller",3,3,0," Wir, eine 7er WG (50/50 Frauen und Männer), suchen nach einem entspannten, liebenswerten und innerlich schönem Menschen für ein harmonisches und geselliges Zusammenleben in unserer riesigen 233 m2 großen Wohnung in der Südvorstadt.  Du bist gut organisiert, du kommst auf deinem Leben klar, bist kein Hänger und kannst dich gut in eine Gruppe integrieren? Dann bist Du hier genau richtig und es wird fabelhaft mit uns matchen :) Trifft das auf Dich eher nicht zu, dann spar dir den restlichen Text und swipe lieber zur nächsten Anzeige weiter - das wird so leider nichts mit uns!  •《《 •《🍍 • 🌴 • 🍍》• 》》•《《 •《🍍 • 🌴 • 🍍》• 》》•《《 •《🍍 • 🌴 • 🍍》• 》》•   Eine 7er WG klingt für manche groß und stressig, doch keine Sorge, hier wohnen zwar 7 Leute aber dadurch, dass viele von uns recht regelmäßig unterwegs sind, fühlt es sich eher oft an wie in einer 3er oder 4er WG. Dadurch ist es in der Wohnung häufig eher ruhig und das Zusammenleben ganz entspannt. Oft sitzen wir gerne ungezwungen in unserer gemütlichen Küche mit einem (oder keinem) alkoholischen Kaltgetränk und reden über alles Mögliche und Unmögliche dieser Welt! Und ja, ab und an wird hier auch sehr lecker zusammen gekocht, gechillt und gelacht. In den Sommermonaten wird das bunte Treiben nach Draußen auf den chilligsten Küchen-Balkon von Leipzig verlegt. In der dort dschungelartig zugewachsenen grünen Oase wird dann ganz beherzt Tarzan & Jane gespielt ;)  Wir lieben allerlei Musik (von Techno, Reggaeton, Hip Hop über Soul, Funk, Garage-Punk, Italo Disco und Wave ist hier alles dabei), viel Sport und ab und an ein gemeinsames Glas Wein. Wie Du auf den Bildern erkennen kannst, lieben wir Pflanzen sehr. Davon gibt es hier nicht wenige und die müssen auch gegossen werden ;) Wir lassen uns aber gerne auch von deinen Lieblingsdingen begeistern!  Beschreiben würden wir uns als aufgeschlossen, recht aktiv und respektvoll mit einer großen Portion kontrastreichen Charakter-Allerlei. Wir sind keine typische Dauer-Party-WG aber lange Abende mit tiefgründigen Gesprächen und auch ab und an etwas lauterer Musik mit tanzenden Freunden sind hier keine Seltenheit. Du solltest auf jeden Fall feierbar sein und ab und zu Lust darauf haben gemeinsam abzuhängen oder auszugehen.  Für eine 7er WG sind wir mega gut organisiert und legen sehr großen Wert ....jaaa jetzt kommt's... auf Sauberkeit und Ordnung! Unser Level ist da schon definitiv (ohne zu übertreiben) ne 10 von 10:) In so einer großen WG vielleicht schwer vorstellbar aber doch wahr. Darauf musst Du, wenn du hier einziehen magst, richtig Bock haben, Verantwortung übernehmen und mitziehen wollen. Auf E x p e r i m e n t e diesbezüglich haben wir keine Lust! Das ist uns SEHR WICHTIG!  Wir wohnen teilweise schon lange in dieser WG und es gibt dadurch Abläufe und Gewohnheiten die für gut befunden wurden und an denen wir hier fest halten. Deshalb suchen wir jetzt eine Person, die WG-Erfahrung mitbringt und auch kein Problem damit hat sich an sowas wie vorgegebene Abläufe und WG-Regeln (wie z.B. das erwähnte Premium-Sauberkeits-Level) zu halten. Des Weiteren solltest Du nicht an einer Zweck-WG interessiert sein, sondern Lust haben, sich auch mal zu uns zu gesellen. Aber keine Angst, wir hängen nicht 24/7 aufeinander. Genauso gerne sind wir jeder für sich in unseren Zimmern und tagelang nicht zu sehen. Auch gibt es bei so vielen verschiedenen Leuten hier und da Reibungspunkte - das ist ganz normal. Ganz wichtig ist uns einfach, dass wir über alles offen reden können, respektvoll miteinander umgehen und sich jeder wohlfühlt. Es ist ja unser gemeinsames zu Hause!  Das Z I M M E R ...  Ist das am ruhigsten gelegene Zimmer unserer WG. Die Morgensonne geht auf, streichelt dein Gesicht und Du erwachst in diesem schönen und sehr kuscheligen Zimmer mit Blick auf die großen alten Bäume unseres ruhigen Hinterhofes. Statt Straßenlärm gibt es hier Vogelgezwitscher und sattes grün. Das Zimmer hat hohe Decken, da wir in einer alten Gründerzeit-Wohnung leben. Es hat zwei tolle alte doppelglasige Holzfenster, die durch den idyllischen Ausblick zum verweilen einladen."," Die Lage ist top! Da wir direkt in der Nähe der Karl-Liebknecht-Straße wohnen, die gesäumt ist mit Restaurants, zig Imbissläden, Bars und Spätis, ist dein verkaterter Sonntag gerettet! Hast du Lust auf Eis oder Pizza? Gehste einfach um die Ecke die Straße hoch. Schwing dich aufs Rad und du bist in 20 min am See, das nächste Open Air ist auch nicht weit. Der Fockeberg istdirekt um die Ecke und bietet dir sehr viel Grün in unmittelbarer Nähe. Öffentliche Verkehrsmittel fahren auch vor der Haustür, wobei wir am liebsten die Gegend mit dem Fahrrad erkunden. Im Zentrum/an der Uni oder HGB bist du in 10 Minuten, die HTWK ist fußläufig in 5 Minuten erreichbar.   So oder so, du hast es nie weit und es gibt viel zu entdecken! Egal ob ins Conne Island zur Halftime, zur Baumwollspinnerei oder ins Goldhorn in der Waffenverbotszone Eisenbahnstraße.  E I N K A U F E N & N A H V E R K E H R  Die Tramstation (11, 10) und Busstation (60, 74, 89) befinden sich zu Fuß nur 5 Min entfernt. Die Anbindung an den öffentlichen Verkehr ist perfekt, direkt unten gibt es eine Bushaltestelle, die Parallelstraße ist eine große Verkehrsachse, nämlich die Karl-Liebknecht-Straße mit Kneipen, dem besten Falafelladen, einer Spitzenpizzeria, Spätis, Kino, Feinkost, unzähligen Einkaufsmöglichkeiten (Lidl, Netto, Aldi und kleiner Biomarkt um die Ecke) - alle zu Fuß in 5-10 Minuten erreichbar.   N A T U R & E N T S P A N N U N G  Natur pur gibt es auch ganz in der Nähe! Der Auenwald und die höchste Erhebung von Leipzig - der Fockeberg (3 Gehminuten), Elster und der Clara-Zetkin-Park sind mit dem Fahrrad oder zu Fuß in 5 Minuten zu erreichen - zum Joggen oder im Park liegen also perfekt geeignet.   Der Cospudener See, der beliebteste Badesee Leipzigs, liegt mit dem Fahrrad, auf einer wunderschönen Strecke durch den Wald, nur 20 Minuten entfernt.  P A R T Y & N A C H T L E B E N  Für Feierwütige, die das Leipziger Nachtleben genießen wollen, ist die Lage der Wohnung ebenfalls mehr als optimal. Mit dem Rad erreichst du in rund 10 Minuten die angesagtesten Clubs der Stadt - Institut für Zukunft (IfZ), Distillery, UT Connewitz, Werk 2, Elsterartig oder das Conne Island.","Klingt abgedroschen, aber wir sind einfach ein bunter Haufen. Ein bunter Haufen aus Menschen mit vielen unterschiedlichen Interessen und Persönlichkeiten, die aber auch sehr gern Zeit miteinander verbringen. Das bedeutet für uns, sich nicht nur mit Freude und Energie am WG-Leben zu beteiligen sondern auch kein Problem damit zu haben, sich an den Putzplan zu halten und hier und da in der WG Aufgaben zu übernehmen.  Wir haben große Lust auf gemeinsames Kochen, Lachen bei Wein und Bier, spontan den Dancefloor zu entern, die ein oder andere gemeinsam organisierte Party, Cocktailabende, Chillen auf unserem wunderschönen Balkon und zusammen ein Open Air, Festival, Konzert oder eine spontane Jam-Session zu besuchen! Da einige von uns sehr Sport-Affin sind, bist du gerne dazu eingeladen dich einem Work-out, Joggen im Auenwald, dem Besuch in der Boulder-Halle oder Fitnessstudio anzuschließen!  Wir freuen uns darauf Dich kennenzulernen! Komm vorbei und check uns aus:)"," Hier die H A R D F A C T S zusammengefasst:  KONTAKT:  Wenn du unsere Annonce auch so toll findest wie wir, dir das Zimmer zusagt und du Interesse hast, schreibe uns eine Nachricht mit ein paar Zeilen zu deiner Person und hänge bitte sehr gerne ein Foto von Dir an.  Kommst Du in die Auswahl, melden wir uns zeitnah bei Dir. Es sind leider zu viele Nachrichten um allen eine Rückmeldung zu geben :/ Sehr wichtig ist uns, dass wir Dich dann persönlich kennenlernen können und Du bereit bist zu einem Casting vorbei zu kommen. Überrasche uns und bringe gerne deinen Lieblings-Wein oder Bier mit ;)   ZWISCHENMIETE: 01.02.23 bis 30.06.2023  UNMÖBELIERT  ZIMMER: 18 m2   MIETE: 323 €  KAUTION: 277 €  AUSSTATTUNG DER WOHNUNG: Wir sind top ausgestattet ;) Natürlich auch mit Waschmaschine, Geschirrspüler und sogar einer Badewanne!  WAS WIR SUCHEN: Ein Mann oder eine Frau im Alter von 23 - 33 Jahre mit WG-Erfahrung (!)  WAS UNS SEHR WICHTIG IST: Du solltest Lust darauf haben am WG-Leben teilzunehmen, das Premium-Sauberkeits-Level unserer Wohnung genauso feiern wie wir und richtig Bock darauf haben dich in der Zeit in der du bei uns wohnst, dich engagiert einzubringen! Auf Leute die Verantwortung lieber abgeben, anstehende Dinge auf andere abladen als sie selbst zu erledigen und Menschen die eher ne Zweck-WG suchen, haben wir einfach keinen Bock!  KEINE HAUSTIERE: Auch wenn wir Tiere sehr lieben, finden bei uns Haustiere leider keinen Unterschlupf!  HIER IST ABSOLUT KEIN PLATZ FÜR CORONA-LEUGNER*INNEN, RASSISMUS, HOMOPHOBIE, SEXISMUS ODER SONSTIGE INTOLERANZ!",1.0,0,"Studenten-WG, keine Zweck-WG, gemischte WG",https://www.wg-gesucht.de/wg-zimmer-in-Leipzig-Suedvorstadt.8721778.html,7er WG,Südvorstadt,    18,325 ,https://www.wg-gesucht.de/wg-zimmer-in-Leipzig-Suedvorstadt.8721778.html
Karl-Liebknecht-Straße 92,04275 Leipzig Südvorstadt,360,40,07.07.2023,2,"Waschmaschine,Spülmaschine,Balkon,Garten,Gartenmitbenutzung,Keller,Fahrradkeller",2,1,0," Willkommen auf der Karli im Herzen der Südvorstadt!   Das Zimmer ist mit über 20qm das größte der schönen Altbauwohnung und wartet nur darauf, von Dir bewohnt und belebt zu werden. Es ist voll ausgestattet. Bett, Schreibtisch, Sofa, sowie eine Kleiderstange stehen dir zur freien Verfügung!"," Unser schönes Eckhaus liegt zwischen Kurt-Eisner-Straße und Richard-Lehmann-Straße direkt auf der Karli mitten im Leipziger Süden. Döner, Pizza, Falafel, Vietnamesisch, Späti, Konsum, Rewe alles in unmittelbarer Nähe, Cafés, Bars ums Eck, Connewitz vor der Tür, zwei Mini-Parkanlagen vorm Haus, Clara-Zetkin-Park, Zentrum und Albertina in zehn Minuten erradelbar, mit der Kurt-Eisner auch schnellen Zugang nach Ost und West. Zur Tram- und auch Bushaltestelle Kurt-Eisner-Str./Karl-Liebknecht-Str. sind's nur zwei Fußminuten (Linien 10, 11, 60, 74).","Die WG-Mitbewohner sind Sophia und Niclas, sowie vielleicht eine weitere Zwischenmiete, denn Diana ist ebenfalls auf Reisen. Alle sind sehr herzlich und weltoffen und stehen dir immer gerne mitRat und Tat zur Seite. Wer genau wann da ist, können wir gerne persönlich besprechen. Auch könntest du theoretisch für einen Monat mit jemand zweitem bei uns einziehen. Melde dich dazu gerne.  Die Wohnung ist für uns auch Arbeits- und Erholungsraum. Kommunikation und Rücksichtnahme, einfach miteinander reden. Wir legen Wert auf Sauberkeit, haben einen Putzplan, halten ihn uns aber nicht bei jeder Gelegenheit gegenseitig unter die Nase: wer hinter sich aufräumen und einmal die Woche zum Lappen greifen kann, ist hier gut aufgehoben."," Gemeinsam genutzt werden unser riesiger Flur, das Bad (mit Eckbadewanne sowie separater Dusche), eine zusätzliche Gästetoilette, Abstellraum, Balkon und unsre Küche, welche sich auch ausstattungsmäßig sehen lassen kann.  Das Auszugsdatum kann notfalls auch um 1-3 Tage verschoben werden.   Fotos vom Zimmer folgen die Tage! :)   Schreib mir gerne ein paar Zeilen von dir und hoffentlich bis bald!!",1.0,0,Studenten-WG,https://www.wg-gesucht.de/wg-zimmer-in-Leipzig-Suedvorstadt.6866147.html,4er WG,Südvorstadt,    25,400 ,https://www.wg-gesucht.de/wg-zimmer-in-Leipzig-Suedvorstadt.6866147.html
Philipp-Rosenthal-Straße,04103 Leipzig ,680,150,22.09.2023,1,Balkon,,,," Hallo Ihr Lieben, ich vermiete meine komplette Wohnung für 6 1/2 Wochen unter da ich im Urlaub bin. Es ist vom 9.9-26.9.23Von dieser zentral gelegenen Unterkunft aus seid ihr in Nullkommanichts anallen wichtigen Orten. Der Bayrische Bahnhof ist 2 Minuten Fußweg, genauso wie Rewe und die Straßenbahn Johannisallee. Innenstadt 10 Minuten zu Fuß.  Der Preis ist Pro Monat und wird verrechnet.",,,,,0,,https://www.wg-gesucht.de/wohnungen-in-Leipzig.9912764.html,2-Zimmer-Wohnung  ,,    15,830 ,https://www.wg-gesucht.de/wohnungen-in-Leipzig.9912764.html
Karl-Liebknecht-Straße,04275 Leipzig Südvorstadt,200,120,01.08.2023,2,"Balkon,Garten",2,1,0," Willkommen auf der Karli im Herzen der Südvorstadt!Das Zimmer ist mit 12qm nicht das größte der schönen Altbauwohnung, doch der Balkon (bei dem du den ganzen Tag Sonne und am Abend auch Sonnenuntergang genießen kannst) und das selbstgebaute Hochbett unter den hohen Altbaudecken machen das auf jeden Fall süß, gemütlich und zu einem tollen Wohlfühlort. Bett, Sofa, eine Kommode und die Regale stehen dir zur freien Verfügung!"," Unser schönes Eckhaus liegt zwischen Kurt-Eisner-Straße und Richard-Lehmann-Straße direkt auf der Karli mitten im Leipziger Süden. Döner, Pizza, Falafel, Vietnamesisch, Späti, Konsum, Rewe alles in unmittelbarer Nähe, Cafés, Bars ums Eck, Connewitz vor der Tür, zwei Mini-Parkanlagen vorm Haus, Clara-Zetkin-Park, Zentrum und Albertina in zehn Minuten erradelbar, mit der Kurt-Eisner auch schnellen Zugang nach Ost und West. Zur Tram- und auch Bushaltestelle Kurt-Eisner-Str./Karl-Liebknecht-Str. sind's nur zwei Fußminuten (Linien 10, 11, 60, 74).","Die WG-Mitbewohner sind Sophia, Niclas und Paula. Allesind sehr herzlich und weltoffen und stehen dir immer gerne mit Rat und Tat zur Seite.Unser Zusammenleben folgt dem Motto „alles kann, nichts muss“.Die Wohnung ist für uns auch Arbeits- und Erholungsraum. Kommunikation und Rücksichtnahme, einfach miteinander reden. Wir legen Wert auf Sauberkeit, haben einen Putzplan, halten ihn uns aber nicht bei jeder Gelegenheit gegenseitig unter die Nase: wer hinter sich aufräumen und einmal die Woche zum Lappen greifen kann, ist hier gut aufgehoben."," 320€ ist die Gesamtmiete, in der alles inkludiert ist (GRZ, Internet, Nebenkosten).Gemeinsam genutzt werden unser riesiger Flur, das helle Bad (mit Fenstern, Eckbadewanne, sowie separater Dusche), eine zusätzliche Gästetoilette, Abstellraum, Balkon und unsere Küche, welche sich auch ausstattungsmäßig sehen lassen kann.  Das Ein- und Auszugsdatum kann auch um 1-3 Tage verschoben werden.Schreib mir gerne ein paar Zeilen von dir und hoffentlich bis bald!!",,0,,https://www.wg-gesucht.de/wg-zimmer-in-Leipzig-Suedvorstadt.10190740.html,4er WG,Südvorstadt,    12,320 ,https://www.wg-gesucht.de/wg-zimmer-in-Leipzig-Suedvorstadt.10190740.html
Karl-Heine-Straße,04229 Leipzig Plagwitz,200,120,01.07.2023,1,,3,1,0, Rechteckig geschnitten mit Blick auf die Karl-Heine-Straße.," 2 Minuten Fußweg zum Felsenkeller, 5 Minuten zum Westwerk.","Wir suchen eine coole Person, die Lust auf gemeinsame Aktivitäten hat. Ob Tischtennis, Volleyball, Feiern gehen, Ausglüge zum See oder gemeinsam zusammen sitzen. Die meisten Sachen, die wir machen ergeben sich spontan und das soll auch so bleiben :)"," Das wichtigste in Kürze:  Wir möchten das Zimmer ab 1. Juli dauerhaft wieder vermieten. Da es zurzeit für uns aber schwierig ist,Tage zu finden, an denen wir alle Zeit für Castings haben, sind wir auch offen für eine Zwischenmiete für ein bis zwei Monate. Wir legen Wert auf gemeinschaftliches WG-Leben. Wir sind ein bunter Haufen aus künstlerischen, arbeitenden, studierenden, freizeitgenießenden und partybegeisterten Menschen. Gelegentlich machen wir ein kleines Lagerfeuer oder grillen in unserem Hinterhof, von dem aus wir auch Zugang zu einer kleinen Grünfläche mit ein paar selbstangelegten Gemüseberten haben. Für Klatsch und Tratsch lädt unser Wohnzimmer ein.",,0,"Zweck-WG, gemischte WG",https://www.wg-gesucht.de/wg-zimmer-in-Leipzig-Plagwitz.10190713.html,5er WG,Plagwitz,    11,320 ,https://www.wg-gesucht.de/wg-zimmer-in-Leipzig-Plagwitz.10190713.html
Mariannenstraße,04315 Leipzig Volkmarsdorf,200,150,01.07.2023,3,Balkon,0,0,1, Das Zimmer schaut Richtung Südseite und ist sehr lichtdurchflutet und ruhig. Die Küche ist sehr geräumig und lädt zu schönen Kochabenden mit Freunden ein. Unser Balkon verschafft einen Panoramablick über den Leipziger Osten und bietet schöne Sonnenuntergänge :)," Die Wohnung ist in der Nähe von der Eisenbahnstraße und ist 3 min zu der Tramhaltestelle (1, 3, 8) entfernt. Die Eisenbahnstrasse bietet eine große kulinarische Vielfalt und eine bunte Szene an. Neben orientalischen Lebensmitteln findet man aber auch einen Aldi und Konsum für den täglichen Einkauf.   Das Viertel ist abends sehr lebendig. Die Wohnung ist umgeben von Bars, ist aber vom Lärm nicht betroffen, da sie sich in einer Seitestrasse befindet.","Ich vermiete meine komplette Wohnung für einen Monat (juli 2023), da ich in der Zeit in Berlin sein werde. Daher wir kein richtiges WG-Leben zustandekommen :/ Die Wohnung wird sozusagen als 1-Zimmerwohnung vermietet. Jedoch werde ich am Wochenende immer nach Leipzig kommen und würde mich natürlich über gemeinsame Aktivitäten, wie kochen, reden, Wein trinken, freuen :)",,1.0,0,"Studenten-WG, gemischte WG",https://www.wg-gesucht.de/wg-zimmer-in-Leipzig-Volkmarsdorf.9534798.html,2er WG,Volkmarsdorf,    18,450 ,https://www.wg-gesucht.de/wg-zimmer-in-Leipzig-Volkmarsdorf.9534798.html
Kreuzstr. 3b,04103 Leipzig Zentrum-Ost,300,100,01.08.2023,7,"Waschmaschine,Spülmaschine,Gartenmitbenutzung,Keller,Haustiereerlaubt",1,3,0," Hallo ihr lieben Suchenden,   Wir wollen eine neue (Familien)WG gründen.   das heißt, Familien sind sehr willkommen, aber wenn bei Einzelnen oder einem Paar der Funke überspringt, ist das auch toll und gar kein Muss.  Die riesige Wohnung im Zentrum von Leipzig bietet viel Platz zum Austoben, kreative Gestaltung, Lachen, Genießen und gegenseitige Unterstützung.   Die Wohnung:  Es lockt eine 230m² helle Erdgeschoss-Wohnung in ruhiger Lage auf 6 Zimmer, hohen Decken und teilweise Parkett (Flur und Wohnzimmer haben Laminat) Kassettendecke und 2 Bädern.   -mit Wintergarten, und gemütlichen Hof mit Feuerschale.  Etwas in die Jahre gekommen ist sie,  aber wir finden: lieber alt charmant, als tot durchsaniert. Hier fehlt etwas Lack, die Raufasertapete muss teilweise ab, ein paar Fliesen kaputt. So bleiben aber viele Möglichkeiten, neu zu gestalten.   Für euch sind 2 Zimmer frei ( welche konkret können wir gemeinsam überlegen)   + gemeinsame Wohnzimmer und   + optional auch gemeinsames Arbeitszimmer. Der Mietpreis wird dementsprechend variabel sein und können wir solidarisch gestalten. ca. 300-400€ pro Person."," Die Kreuzstraße ist sehr ruhig, aber zentral gelegen. Zum Bahnhof hab ich es schon mal in 6 min Rennen geschafft, als ich den Zug noch kriegen wollte.   Zum Ausgehen sinds 10 min Radstrecke zur Eisi, oder Südvorstadt,nur leider zur Westkultur etwas weiter. Aber eigentlich ist es überall hin mit dem Rad schnell.","Bisher sind wir zwei Erwachsene und zwei Teilzeit-Kinder, die eine Woche da sein werden und die andere bei ihrem Papa sein werden. Bisher haben wir alle zusammen nur 3 Häuser weiter gewohnt ( nicht verwirren lassen: da gibts tatsächlich auch ne WG Anzeige und freie zimmer :-) )  Mit euch wollen wir gemeinschaftlich eine gute Balance zwischen eigenem Rückzugsort und sozialen Miteinander finden. Elementar für uns sind u.a. gemeinsam kochen, Nahrungsmittel und Co. zu teilen (Das am liebsten bio, und größenteils vegetarisch, ohne dogmatisch zu sein), Zuhören und offene Kommunikation, Eigenverantwortung und Gastfreundschaft.  Optional je nach Situation, aber Musik in unseren Ohren:   Gemeinsame Bauaktionen, Brettspiel-Abende, Gärtnern, gemeinsame Ausflüge ins Grüne, oder auf Festivals, zusammen sporteln, laut Musik hören und tanzen. Events planen, chillen und kraulen auf dem Sofa. Das sind wir:  Wir sind ein Paar, das sich schon sehr lange kennt, aber keine verschmolzende Einheit. Das individuelle Agieren ist uns wichtig. Lilli, 34:  Ich bin Textildesignerin in einer kleine Seidenmanufaktur und pendel für meine Arbeit täglich nach Crimmitschau. Meine Lohnarbeit ist für mich wichtig, aber meine Hobbys, Freund*innen und Familie nicht weniger.  Ich bin gern kreativ - beim Zeichnen, Nähen und Heimwerkeln. Bewege mich gern - mit großer Begeisterung hab ich kürzlich angefangen Tuchakrobatik zu machen, boulder gern und liebe das Wandern in den Bergen.  ...und ich bin gern Mama -mal mit Überforderung, mal mit Gelassenheit und (fast immer) mit Neugier und Albernheit. ..und zu guter Letzt will ich die Welt ein bisschen besser machen - Im Alltag und bei der Nummer gegen Kummer, wo ich gelegentlich aktiv bin, wenn ich es schaffe. Samuel, 9: geht bald aufs Gyymnasium und ist schon sehr aufgeregt. Er liebt auch boulern, kann gern mal Harry Potter in 2 Tagen auslesen und baut seit 6 Jahren unermütlich Lego  Fabian, 5: findet fast alles toll, was sein großer Bruder macht, - außer dass er rosa und räuchertofu liebt. ;)  Beide kennen das WG-Leben von klein auf. Das Wechselmodell wird für sie aber neu sein. Gerrit 36,  Kind des Ruhrpotts, aber seit 13 Jahren in Leipzig eine neue Heimat gefunden. Vom Biochemie-Labor in die (bevorzugt medizinischen) Datenwissenschaften gestolpert sitz ich neben meiner Haupt-Lohnarbeit (Irgendwas mit KI) wohl bald vermehrt an meiner Masterarbeit.  Die liebste Kultur ist mir oft das (gemeinsame) Kochen und Essen. Gerne auch mal aufwändig verkünstelt, aber wesentlicher mit nachhaltigem und regionalem Bezug. Ab und zu ruft mich die Freiheit, in kleinen Reisen unf Fluchten auf 2 Rädern find ich zu mir und der Welt zurück, wenn sie mal zu absurd wird oder zuviel einfordert. Oder ich schnall mir die Laufschuhe an, oder ziehe ein paar Bahnen durchs Wasser. Alles lieber zusammen als für mich allein. Eigentlich selbstverständlich, aber dennoch besser zu erwähnen: Wir setzen uns für eine vielseitige, bunte Gesellschaft, ohne starre Rollenbilder und Diskriminierung ein und erwarten das auch von unseren Mitwohnenden."," Schreib uns gern ein bisschen was zu dir, wenn du das Gefühl hast, es könnte gut zusammenpassen...  Formale Rahmenbedingungen lassen sich finden, wenn es zwischenmenschlich gut passt.  Wir sind gespannt von euch zu hören.  Eure Lilli (Magdalena), Gerrit, Samuel und Fabian",1.0,0,"WG mit Kindern, keine Zweck-WG, gemischte WG, Vegetarisch/Vegan, Alleinerziehende, WG-Neugründung",https://www.wg-gesucht.de/wg-zimmer-in-Leipzig-Zentrum-Ost.10160335.html,6er WG,Zentrum-Ost,    25,400 ,https://www.wg-gesucht.de/wg-zimmer-in-Leipzig-Zentrum-Ost.10160335.html
