Street,Address,rent_cold,additional_cost,free_from,distance,gadgets,female_roommates,male_roommates,divers_roommates,room_description,location_description,flat_live,additional,smoker,accessible,kind_of_flat,Url,type,district,size,price,link
Arthur-Hoffmann-Straße 95,04275 Leipzig Südvorstadt,290,147,24.07.2023,1,"Waschmaschine,Keller",,,," Ich wohne ab Ende Juli bis Ende September in einer anderen Stadt und möchte in dieser Zeit meine Wohnung untervermieten. Sie ist geeignet für eine Person oder ein Paar. Eigentlich beträgt die Kaltmiete 325,15€, aber da ich natürlich die meisten meiner Sachen nicht mitnehmen kann und du/ihr somit weniger Platz für eigene Sachen habt, finde ich es fair, wenn ich einen Teil der Miete weiterhin übernehme. Natürlich werde ich aber auch genug Platz schaffen, damit es für dich/euch auch Stauraum gibt.   Die sonstigen Kosten beziehen sich auf das Internet.   Die Wohnung hat zwei Zimmer, ein großes Wohnzimmer und ein kleines Schlafzimmer mit Hochbett und begehbarem Kleiderschrank darunter.   An das Wohnzimmer schließt auch die Küche an, eine Spülmaschine ist nicht vorhanden.   Ansonsten gibt es natürlich noch ein Badezimmer mit Waschmaschine sowie Duschbadewanne und einen kleinen Flur.   Alle Möbel werden in der Wohnung bleiben, außerdem die meisten anderen Sachen, wie zum Beispiel Bücher, einige Klamotten, der Fernseher, Drucker, Küchengeräte und Geschirr etc. Diese Sachen dürfen dann natürlich auch benutzt werden, solange sie pfleglich behandelt und im gleichen Zustand wie vorher hinterlassen werden.   I am moving to another city from the end of July until the end of September and would like to sublet my apartment during this time. It is suitable for one person or a couple. Actually, the cold rent is 325.15€, but since most of my stuff will stay in the apartment, I think it's just fair if I still pay a little of the rent. But of course I will also make enough space so that there is storage room for you. The ""sonstige Nebenkosten"" refer to WLAN.   The apartment has two rooms, a big living room and small bedroom with a loft bed and a kind of walk-in closet underneath.  Attached to the living room is also the kitchen, which doesn't have a dishwasher. Otherwise, there is of course the bathroom (including a washing machine) and a small hallway.   As already mentioned, all furniture will stay in the apartment, as well as most other things, such as books, clothes, the TV, printer, kitchen utensils and dishes, etc. These thingsmay then of course be used, as long as they are treated with care and left in the same condition as before."," Die Wohnung befindet sich in der Südvorstadt. Haltestellen für Bus und Bahn sind quasi direkt vor der Haustür und werden oft befahren, aber auch mit dem Fahrrad dauert der Weg in die Innenstadt nur 10 Minuten.   Die Karl-Liebknecht-Straße ist nur wenige Minuten zu Fuß entfernt und auch sonst gibt es viele Geschäfte, Restaurants etc. in der Nähe.   Die Wohnung befindet sich an einer recht großen Kreuzung, ist aber trotzdem relativ ruhig. Durch die Nähe zur Uniklinik fahren allerdings etwas häufiger als gewöhnlich Krankenwagen vorbei, die hört man dann natürlich schon.   Den nächsten Park erreicht man in ca. 10-15 Minuten zu Fuß.   The apartment is located in the ""Südvorstadt"". Bus and tram stops are virtually right outside the front door and trams are very frequent, but you can also get to the city center by bike within 10 minutes.   The ""Karl-Liebknecht-Straße"" is only a few minutes of walking away and there are also many other stores, restaurants, etc. nearby.   The apartment is located at a fairly large intersection, but is still relatively quiet. However, due to the proximity to the university hospital, ambulances pass by more often than usual and of course you can hear those.   The nearest park can be reached in about 10-15 minutes on foot.",," Falls ich niemanden finden sollte, der die Wohnung für den gesamten Zeitraum nehmen würde, wäre ich auch bereit, sie für nur einen Monat oder ein paar Wochen zu vermieten.  Außerdem ist vielleicht wichtig zu wissen, dass ich das nicht offiziell mache. Das heißt, der Vertrag läuft in der Zeit weiterhin über mich und eine Wohnungsgeberbescheinigung kann nicht ausgestellt werden.   In case I can't find anyone who would take the apartment for the entire period, I would also be willing to rent it for only a month or a few weeks.  Also, it's important to note that I'm not doing this officially. You wouldn't have a contract with the landlord and couldn't get a ""Wohnungsgeberbescheinigung"" or something like that from me.",,0,,https://www.wg-gesucht.de/wohnungen-in-Leipzig-Suedvorstadt.9384428.html,"1,5-Zimmer-Wohnung  ",Südvorstadt,    45,472 ,https://www.wg-gesucht.de/wohnungen-in-Leipzig-Suedvorstadt.9384428.html
Arndtstrasse,04275 Leipzig Südvorstadt,400,130,01.08.2023,2,Balkon,0,2,0," Die zimmer sind groß, hell, mit niedrigen decken, ab 14-15 uhr sonnenlicht mit Sonnenuntergangsblick,laminat und geweisste wände", Super geile lage mitten auf der karli,,,,0,,https://www.wg-gesucht.de/wg-zimmer-in-Leipzig-Suedvorstadt.10191922.html,3er WG,Südvorstadt,    20,530 ,https://www.wg-gesucht.de/wg-zimmer-in-Leipzig-Suedvorstadt.10191922.html
Leplaystraße 3,04103 Leipzig Zentrum-Südost,262,0,01.08.2023,3,"Waschmaschine,Spülmaschine,Keller",1,1,1," Das unmöblierte Zimmer hat 4 weiße Wände, Fußboden, Decke, großes Fenster und Tür. 4,14 m x 3,60 m und 3 m hohe Decke laden dich zum Dekorieren ein. Die Fotos sind aktuell und stellen eine mögliche Lebensform da. 262 € all inclusive.  (Miete, Internet, Strom, GEZ, Mieterschutzbund usw.) Für viele gemeinsame Verbrauchssachen wie Salz, Klopapier usw. haben wir ein ausgeklügeltes Einkaufs- und Abrechnungssystem (EAS) entwickelt. 75 € berechnet unser Vermieter für deinen Einzug."," Kurz und knapp ==> Top Lage.  Du kannst in dieser Stadt kaum zentraler wohnen.  7 Minuten für Mensaspaziergänge, 3 Minuten um in die 2, 9 oder 16 zu hüpfen  oder in 5 Minuten vom Wilhelm Leuschner Platz in jede Richtung zu kommen.  Edeka, Aldi und die Stadtbibliothek sind wenige 100 Meter entfernt.  Die Fahrradselbsthilfewerkstatt vom Studentenwerk ist genau 1 Minute entfernt.   Den Döner gibts im Haus mit dazu, der ist aber nicht gut, für was Besseres kann man sich aber einfach 5 min zur Windmühlenstraße bewegen. Noch besser ist aber Pizza für 7 Euro direkt um die Ecke, die Jungs kennen uns schon, man wird herzlich empfangen und die Mütter werden gegrüßt.   Da wir im Hinterhaus wohnen, bekommen wir aber vom Verkehrslärm sehr wenig ab.","Hello Liebe(r) zukünftige(r) Mitbewohner,  wenn du eine herzliche WG suchst, deren Mitbewohner*innen es wichtiger ist, deine Lieblingsserie zu kennen, als einen dreckigen Teller nach 5 Minuten abzuwaschen, dann bewirb dich bei uns. Wir würden uns freuen, wenn sich etwas freundschaftliches Entwickeln würde und du Herz, Charme und Witz mitbringst. Gemeinsame Brettspieleabende (hier kannst du Pluspunkte bei der Bewerbung sammeln), ausgedehnte Spaziergänge,Container - und Kochaktionen, mittlere Trinkrunden, um die Häuser ziehen könnten deinen grauen Alltag bereichern. :D  Unser lieber Thilo verlässt uns für eine Frau. Wir sind immer noch völlig geschockt von dieser Tatsache.  Wer wird Leah nun Tofu zum Kochen beisteuern? Mit wem wird Pia das literarische Quartett, was nur ein Duett war, fortführen?Und wem skizziert Matti die geopolitische Weltlage am Frühstückstisch? Fragen über Fragen !!!  In der WG backen bleiben folgende Menschen:  Leah, 24 Jahre, studiert Informatik im Bachelor, kommt aus einem Kaff bei Duderstadt.  War nach der Schule 3 Jahre auf Weltreise in Südostasien, wo auch der Entschluss gefasst wurde den digitalen Nomaden Lifestyle zu verwirklichen und hat dort auch ihre Fernbeziehung klargemacht und später wieder aufgelöst. Kann dir tollen Gossip von ihrem Singleleben erzählen. Leah liebt alle Arten von Verkleidung und geht gerne auf Mittelalterfestivals oder WTGs. Versucht schon seit 3 Jahren einen Frühjahrsputz zu organisieren. Leah kocht gerne (z.B.mit Thilo) alle Arten von Hülsenfrüchten, Kartoffeln, Reis und ganz viel Gemüse. Der Dal-Donnerstag unter ihrer fachkundigen Anleitung ist legendär. Hat sich praktisch die komplette Zimmereinrichtung auf Ebay-Kleinanzeigen zusammengeklaubt. Zu ihren Hobbys gehört Slacklinen, Ariel Circle, Wandern, Klettern, Campen, Poi spielen. Ihre nerdige Art lebt Leah beim Programmieren, Sudoku Videos gucken oder beim Brettspielen gegen Matti aus. Hat dort die gefürchtete Leahglücksstrategie entwickelt. Arbeitet nicht mehr in nem unterbezahlten Dödeljob an der Hochschule HTWK, sondern hat sich einen richtigen IT Job gesucht (ganze 12 Wochenstunden). Demnächst startet die High Potential IT Karriere. Verarbeit den Alltag sehr lebhaft in den Träumen. Hat sich den Finger beim einem Rave gebrochen und wurde deswegen auf den Arm genommen. Oder sollte ich besser Finger sagen? Vegan. Pia, 24 Jahre, hat gerade den Germanistikmaster abgeschlossen, kommt aus einem Kaff im Schwarzwald.  Geflüchtet aus der heilen Welt des Schwarzwaldes ist Pia hier gelandet und studierte erst Literarisches Schreiben und dann Germanistik. Will noch einen 3.akademischen Grad in Lesen und Schreiben absolvieren, denn das Schriftstellerinnenleben istziemlich hart und muss mit Kaffee, Rotwein, schlecht gedrehten Zigaretten und ab und an mal IFZ aufgebessert werden. Das beschreibt auch ganz gut Ihr restliches Leben. Sehr gemütlich und sehr belesen wird sich im Morgenmantel und Nachthemd von Tag zu Tag geschrieben und geschlafen (Geheime Superpower: Locker mal 2 Tage schlafen). Falls Sie doch mal rausgeht, dann nur leicht bekleidet, auch bei -5 Grad Celsius reicht der Hoodie, es ist ja schließlich 'gar nicht so kalt'. Kann professionell Tinder Korrespondenz abwickeln. Pia geht um exakt 22 Uhr ins Bett. Uhren haben wir abgeschafft. Hat ihre erste Gedichtesammlung veröfffentlicht und haut das verdiente Geld gleich für die nächsten Bücher uffen Kopp. Ironie wird großgeschrieben und es gibt den ein oder anderen Moment, in dem man sich schon hart verarscht vor kommt, aber mit der Zeit verbessern sich die eigenen Ironiedetektoren. Für Gelaber in der Küche ist sie immer zu haben und auch nicht den nächtlichen Spaziergängen abgeneigt. Spielt höchstens mal ein Siedler mit. Schwäbelt. Matti, erfahrene 34 Jahre, 800. Semester Informatikmaster, ursprünglich aus einem Kaff im Norden Brandenburgs.  Hat mit viel Mühe (und Mate) seinen Bachelor in Wirtschaftsinformatik geschafft, versucht dass seine Semesterzahl nicht das Alter überrundet. Im 30ten Hochschulsemester dümpelt er an der Uni rum. War grad 2 Semester in Israel, für die Vorbereitung hat er nur 5 Jahre gebraucht. Seine Faulheit findet sich auch kulinarisch wieder - er ernährt sich von Mensa, Pizza und BACKCAMEMBERT und das exzessiv. Zuletzt hat er sich monatlang von Erasco Linsen-Einstopf mit Würstchen ernährt, die Sonderangebote der Supermärkte geplündert und eine Notreserve im Keller angelegt. Doch das ist nicht sein einziges Laster. Aktuell versucht er seine Mate-Sucht zu bekämpfen und die Burpeesätze zu steigern. Du triffst ihn überall an, wo es etwas umsonst gibt. Halte Ausschau nach einer rülpsenden Person mit schmuddeligem Jutebeutel, verschlissenem kurzen Jogger mit Löchern an pikanten Stellen, ausgelutschten Sandalen und einer Flasche Erdinger Alkoholfrei. Auf der Facebook Fan Seite von Sternburg kannst du dir ein Bild von ihm machen. Matti trinkt kein Alkohol, raucht nicht und nimmt auch keine anderen Drogen. Trotz dem kann man mit Ihm eine Menge Spaß haben... Er ist Flunkyball Schiedsrichter und hat schon das eine oder andere Turnier ausgerichtet, zuletzt mit seinen Tramper Freunden. Er organisiert abgesehen von diesem Jahr ein Tramp Rennen durch Europa - also falls du Lust hast, komm gerne das nächste Mal mit. Bitte verwende das Wort Steuererklärung in deiner Bewerbung, um deine Lesekompetenz zu überprüfen. Konträr dazu steht seine Leidenschaft zum Zocken. Am PC(Age of Empires) und auf dem Brett, vor allem komplexe Strategiespiele. Mach dich gefasst das ein oder andere Spiel mit ihm zu spielen, oder dir Ausreden einfallen zu lassen, warum das jetzt gerade wirklich gaaaaanz schlecht ist. Falls der Spieleabend in der HTWK mal ausgefallen ist, gibt es eine Runde Tagesthemen, heute- oder Auslandsjournal. Das geht immer als alternative zum Siedler spielen. Sein Humor ist dreckig, so auch seine Einstellung zum Putzen. Ist erklärter Fan von Karl Lauterbach und erzählt seinen 90 Mitbewohnern gerne Details aus dessen Leben. Lieblingsserien: Game of Thrones, House of Cards. Liefert sich bürokratische Scharmützel mit Dönerbudenbesitzern. Experte im Ran- und Wegschaffen... Hat konkrete Pläne, die Weltherrschaft an sich zu reißen, davor muss er aber erst seine Hose flicken lassen. BWLer"," Wir freuen uns auf deine Bewerbung. Je mehr und detaillierter du schreibst, desto besser können wir uns ein Bild machen und die Wahrscheinlichkeit eingeladen zu werden steigt. Wenn du magst, kannst du uns auch zusätzlich dein Facebook, Insta etc. schicken. Wenn du uns sympathisch bist, melden wir uns auch sehr schnell. ;)  Liebe Grüße  Leah, Pia und Matti",1.0,0,"Studenten-WG, keine Zweck-WG, gemischte WG, Internationals welcome",https://www.wg-gesucht.de/wg-zimmer-in-Leipzig-Zentrum-Suedost.7109071.html,4er WG,Zentrum-Südost,    15,262 ,https://www.wg-gesucht.de/wg-zimmer-in-Leipzig-Zentrum-Suedost.7109071.html
Thomasiusstraße 9,04109 Leipzig Zentrum-West,445,80,15.09.2023,1,"Waschmaschine,Spülmaschine,Balkon,Garten,Gartenmitbenutzung,Keller",0,2,0," Leider verlässt Simon uns im September, da er mit seiner Freundin zusammen zieht. Das Zimmer ist hell und zur Straße gelegen. Wir haben einen sehr großen Flur, Perfekt für Bierpong geeignet, zudem bietet die Küche genug Platz zum Essen, trinken und quatschen ;)  Neben dem normalen Bad haben wir noch ein Gäste-WC. Die Fahrräder können im Innenhof unter einer kleinen Überdachung abgestellt & angeschlossen werden.  Wie ihr auf den Bildern sehen könnt haben wir ein WG-Zimmer als Wohnzimmer umfunktioniert. Von diesem ist auch der Balkon zugänglich. Das Zimmer kann selbstverständlich von allen benutzt werden. :)"," Die Wohnung liegt im Herzen von Leipzig. Die Jahnallee ist ca. 2 Minuten entfernt. Dort gibt es allerlei Imbisse + Spätis. Zum Hauptgebäude der Uni braucht ihr ca. 15 Minuten zu Fuß und 5 Minuten mit dem Rad. In direkter Nähe haben wir zwei Konsums, ein Rewe sowie ein Aldi. Zum Clara Park bzw. zur Innenstadt fährt man ca. 5 min mit dem Rad bzw. Bahn. Die Anbindung an die Öffis ist perfekt. Zum See brauchtman ca. 30 - 45 Minuten mit dem Rad.   Der Hauptbahnhof ist ca. 5 Minuten mit der Bahn entfernt.","Zur Zeit leben Alex, Simon und Christoph in der WG. Alex ist Projektleiter in einer IT-Firma. Simon ist als Berater für Kommunen im Breitbandausbau sowie als ehrenamtlicher Trainer tätig. Ich selbst(Christoph) habe gerade eine 2 jährige Weiterbildung abgeschlossen und fange im August wieder an als Bauleiter zu arbeiten. Jeder von uns hat seinen festen Tagesablauf. Wir treffen uns meist in der Küche um ein Bierchen oder Wein zu trinken. Im Sommer grillen wir ab und an auf dem Balkon bzw. machen gelegentlich einen Spiele-/Filmeabend. Da wir alle in Sachen Arbeit ziemlich gebunden sind ist die gemeinsame Zeit leider etwas gering. Dennoch spricht nichts dagegen etwas gemeinsam zu unternehmen wenn die Zeit und Motivation passt. :)  Alles kann - nichts muss."," Falls dir die Anzeige zusagt dann würden wir uns über deine Nachricht freuen.   Schreibt ein paar Sätze über euch und ich melde mich dann. (gern auch via WhatsApp etc.)",1.0,0,keine Zweck-WG,https://www.wg-gesucht.de/wg-zimmer-in-Leipzig-Zentrum-West.7327272.html,3er WG,Zentrum-West,    19,575 ,https://www.wg-gesucht.de/wg-zimmer-in-Leipzig-Zentrum-West.7327272.html
Prager Str. 33,04317 Leipzig Reudnitz-Thonberg,150,0,01.07.2023,1,"Waschmaschine,Spülmaschine,Balkon,Keller",0,2,0," Dein neues Zimmer kannst du oben auf dem ersten Bild sehen. Es ist komplett möbeiert mit allem was man braucht: Kleiderschrank, Schreibtisch und dem passenden Bürostuhl. Außerdem ist ein eingebautes, großes Hochbett mit dabei, genügend Platz zum Chillen und Lernen ist also vorhanden!", Direkt am Ostplatz gelegen erreichst du in zwei Straßenbahnstationen den Campus Augustusplatz. Auch die HTWK ist mit Bahn oder Fahrrad gut zu erreichen.,"Du bist Student und neu in Leipzig oder nie wirklich hier angekommen und suchst eine neue, aufregende WG? Du hast Lust auf eine etwas andere WG in der man nicht nur zum Zweck zusammen wohnt? Bier und Formel 1 sind Dir lieber als Matetee und Häkelrunden?  Dann haben wir genau das Richtige für Dich! Dein neues, gemütliches Zimmer in unserer abwechslungsreichen WG!  Wir sind eine Gruppe junger Studierender, die noch viel Wert darauf legt, Freundschaften zu pflegen und gemeinsam etwas zu unternehmen, und suchen neue Mitbewohner für unsere zentrumsnahe WG in der aufregenden Studentenstadt Leipzig. Bei uns kannst Du nahezu alles haben, egal ob die Ruhe zum Lernen oder die eigene Hausparty.  Netzanschluss ist vorhanden. Natürlich kommt auch der Spaß nicht zu kurz. Bei einem gemütlichen Bier pflegen wir desAbends sowohl studiumsbezogene und tiefgründige als auch unterhaltsame Gespräche. Darüber hinaus finden regelmäßig Ausflüge in andere deutsche Hochschulstädte statt. Allerdings achten wir auch darauf, dass unser und Dein Studium bei allem Vergnügen nicht zu kurz kommt!  Wir erwarten von Dir Spaß an der Gemeinschaft und die Bereitschaft zum ehrenamtlichen Engagement neben dem Studium. Sicherlich klingt all das für Dich erst mal etwas ungewöhnlich. Das liegt vielleicht daran, dass Du bisher mit dem Konzept einer Studentenverbindung noch nicht vertraut bist, höchstens vielleicht aus den Medien. Falls Du jedoch mehr über das Verbindungsleben erfahren willst, können wir uns gerne darüber unterhalten.  Unsere Gemeinschaft ist unpolitisch und überkonfessionell, das heißt, auf der Etage ist jeder gerne gesehen, unabhängig von seiner Religion, seiner politischen Einstellung (keine Extreme!), seiner Herkunft oder ob er Mitglied einer Verbindung ist. Wir geben Dir die Möglichkeit, Dein an der Universität angeeignetes theoretisches Wissen durch praktische Anwendung innerhalb unserer Strukturen zu vertiefen. Darüber hinaus bietet unsere Gemeinschaft die Grundlage für lebenslange Freundschaften und ein interdisziplinäres bundesweites Netzwerk sämtlicher akademischer Fachrichtungen. Falls wir Dein Interesse geweckt haben, vereinbare doch einfach einen Termin und besuche uns. Wir freuen uns auf Dich!",,1.0,0,"Studenten-WG, keine Zweck-WG",https://www.wg-gesucht.de/wg-zimmer-in-Leipzig-Reudnitz-Thonberg.10182210.html,3er WG,Reudnitz-Thonberg,    12,150 ,https://www.wg-gesucht.de/wg-zimmer-in-Leipzig-Reudnitz-Thonberg.10182210.html
Georg-Schumann-Str. 281,04159 Leipzig Möckern,399,130,01.08.2023,2,"Gartenmitbenutzung,Haustiereerlaubt",,,," Diese schöne 2-Zimmer-Altbau-Wohnung wartet auf einen neuen Mieter.  Der Einzug ist wahrscheinlich schon im JULI oder AUGUST möglich, spätestens aber zum 1. OKTOBER 2023.   Sie ist perfekt geeignet für Singles oder Paare.  Die schön helle Wohnung wurde vor wenigen Jahren frisch renoviert und ist ca. 50qm groß. Sie hat 2 Zimmer, ein Bad mit Dusche und eine offene Küchenzeile, in der man eine Küche perfekt einpassen kann.  Die Wohnung sticht durch ihre schönen Stuckelemente an der Decke hervor.   Die Wohnung befindet sich im 3. Stock eines saniertenAltbaus mit Denkmalfassade und historischem Treppenhaus. Hinten raus gibt es einen wunderschönen großen Garten, der gerne genutzt werden darf.  Öffentliche Verkehrsmittel und Supermärkte sind direkt vor der Tür und genauso fußläufig wie die Naherholungsgebiete Weiße Elster, Auensee und der Auwald. Die Straßenbahn und die S-Bahn fahren in 10-18min in die Innenstadt und zur Universität.  Die Wohnung kostet 399 Euro kalt plus 130 Euro Haus-Nebenkosten, dabei ist eine Vorauszahlung für die Heizkosten schon INKLUSIVE, es kommt also nur noch Strom dazu.  Bei Interesse gerne melden bei F. Bauer",,,,,0,,https://www.wg-gesucht.de/wohnungen-in-Leipzig-Moeckern.10175189.html,2-Zimmer-Wohnung  ,Möckern,    50,529 ,https://www.wg-gesucht.de/wohnungen-in-Leipzig-Moeckern.10175189.html
Bornaische Str. 110,04277 Leipzig Connewitz,380,0,12.07.2023,1,"Waschmaschine,Balkon,Gartenmitbenutzung,Haustiereerlaubt",,,," Hallo!   Wir möchten ein teilsaniertes Altbauzimmer unserer 3- Raumwohnung  für 4 Wochen vermieten, da wir vereisen.  Das Zimmer ist recht hell, die Fenster weißen nach Süden und Osten, der Fußboden besteht aus hellem Laminat. Es gibt einen großen begrünten Süd-Balkon.  Die Küche verfügt ebenfalls über Tageslicht, eine Sitz- und Essgelegenheit. Die Holzdielen wurden hier abgeschliffen.  Waschmaschine, W-Lan und natürlich der Kühlschrank können genutzt werden.   Das Bad ist recht klein, verfügt aber über eine Badewanne.  Da die Wohnung an einer befahrenen  Straße liegt, auf der eine Tram fährt, sind Straßengeräusche deutlich zu hören, wenn die Fenster geöffnet sind. Die Fenster sind allerdings neu, sodass sie recht gut Lärm  abdämmen."," Die Wohnung liegt in Connewitz, 5 Fußminuten vom Auwald entfernt. Bis zur Innenstadt sindes ca 20 Minuten mit dem Fahrrad oder derTram. Die S- Bahnstation, sowie die Tramhaltestellen der Linie 9 und 11 liegen direkt vorm Haus. Auch der Bus 79 fährt hier. Bis zur HTWK  sind es 7 Minuten mit dem Fahrrrad.",," Du sollst bitte zuverlässig  die Pflanzen in der Wohnung, auf dem Balkon, im Treppenhaus, sowie in einigen Baumbeeten vor dem Haus gießen. (Dafür benötigst Du etwas 5  bis 15 Min täglich, je nach Wettelage)  Es darf nicht in der Wohnung geraucht werden, aber auf dem Balkon. Hunde sind in Ordnung.  Da wir hier außerhalb der Ferienzeit als Familie leben, ist die lebendige Nutzung der Räume spürbar. Die Zimmer sind sauber und freundlich. Falls Du aber hohe hygiensiche Ansprüche hast, ist diese Wohnung wahrscheinlich wenig geeignet für Dich.",,0,,https://www.wg-gesucht.de/1-zimmer-wohnungen-in-Leipzig-Connewitz.9092060.html,1-Zimmer-Wohnung  ,Connewitz,    38,380 ,https://www.wg-gesucht.de/1-zimmer-wohnungen-in-Leipzig-Connewitz.9092060.html
Kurt-Eisner-Straße,04275 Leipzig Südvorstadt,544,226,15.07.2023,,"Balkon,Garten",,,," Huhuu ihr Lieben :))Wir suchen Nachmieter für unser Herzstück in der Südvorstadt. Die Wohnung besteht aus drei Zimmern, Küche, Bad und Flur und wirkt durch ihre hohen Decken noch geräumiger als sie eh schon ist.Die Lage in der Südvorstadt könnte besser nicht sein, Konsum und Bäcker sind direkt um die Ecke, Bus und Bahn sind auch nur wenige Minuten entfernt sodass man super schnell im Zentrum, Westen oder Osten ist :). Alle Zimmer bis auf die Küche gehen zum Hinterhof raus, es ist also trotzdem sehr angenehm ruhig und man bekommt gar nicht soviel von der Straße mit. Besonders gut lässt sich’s natürlich auf dem Balkon aushalten, der auch zum Hinterhof geht!Küche, Waschmaschine und Kühlschrank würden wir gerne in der Wohnung lassen, das spart euch also auch einen kleinen Transport. Aber über all das lässt sich ja noch bei einem kennenlernen quatschten! :))  Wir ziehen beide aus, die Wohnung kann also komplett neu bezogen werden (als WG mit bis zu drei Leute oder auch allein).Bei Interesse schreibt uns gerne jederzeit und wir machen was aus 🙃  GaLiGrüPauline & Florian",,,,,0,,https://www.wg-gesucht.de/wohnungen-in-Leipzig-Suedvorstadt.10189546.html,4-Zimmer-Wohnung  ,Südvorstadt,    70,770 ,https://www.wg-gesucht.de/wohnungen-in-Leipzig-Suedvorstadt.10189546.html
